name,country,area,chain,price,street,rooms
Hotel Camino Real,Nicaragua,Managua,,99USD,Km 9.5 Carretera Norte,
BEST WESTERN Las Mercedes,Nicaragua,Managua,,89USD,Km 11 Carretera Norte,
Barcelo Montelimar Beach,Nicaragua,Montelimar,,177USD,PO Box 1262 Playa Montelimar,
Hotel Plaza Colon,Nicaragua,Granada,,82USD,In front of Parque Central,
Barcelo Managua,Nicaragua,Managua,,91USD," Enitel Villa Fontana, 500 mts al Sur",
InterContinental Real Metrocentro Managua,Nicaragua,Managua,,156USD,Frente A Centro Comercial Metrocentro,
Holiday Inn Convention Center,Nicaragua,Managua,,82USD,Autopista Juan Pablo II,
Hilton Princess Managua,Nicaragua,Managua,,101USD,Km 4.5 Carretera a Masaya,
Pelican Eyes Hotel and Resort,Nicaragua,San Juan del Sur,,164USD,"De la Parroquia, 1½ cuadras al este",
Hotel Hex,Nicaragua,Managua,,71USD,Beilo Horizonte frente al centro comercial Multicentro,
Hotel Casa San Francisco,Nicaragua,Granada,,64USD,207 Calle Corral,
Hotel Colonial Granada,Nicaragua,Granada,,105USD,Calle Libertad 25 Metros Oeste Parque Central,
Hotel Don Carmelo Managua,Nicaragua,Managua,,35USD,"Ciudad Jardin, de la Clinica Santa Maria una cuadra al Oeste",
Crowne Plaza Hotel Managua,Nicaragua,Managua,,112USD,Octava Calle Suroeste 101,
Hotel Patio del Malinche,Nicaragua,Granada,,75USD,"Calle El Caimito, de Alcaldia 2 1/2 c. al Lago",
Holiday Inn Express Managua,Nicaragua,Managua,,88USD,"Blvd. Jean Paul Genie, rotonda 800 mts al oeste",
Hotel Dario,Nicaragua,Granada,,119USD,Calle La Calzada,
Hotel & Restaurante La Gran Francia,Nicaragua,Granada,,96USD,Esquina Sureste del Parque Central de Granada.,
Art Hotel Managua,Nicaragua,Managua,,38USD,De la estatua de Montoya 3 cuadras al Oeste 1.5 cuadra al Norte,
Aqua Wellness Resort,Nicaragua,Tola,,224USD,1 Redonda Bay,
Hotel Mozonte Managua,Nicaragua,Managua,,44USD,Entrada A Pricesmart 1.5 C Al Norte Frente,
HC Liri Hotel,Nicaragua,San Juan del Sur,,60USD,Frente a la Playa cruzando el Puente,
Hotel Contempo,Nicaragua,Managua,,111USD,Km 11 Carretera Masaya,
Mango Rosa Nicaragua,Nicaragua,San Juan del Sur,,124USD,Playa Marsella,
Wayak Hotel,Nicaragua,Managua,,70USD,"Villa Fontana, Frente a Club Terraza.",
Hotel Internacional Managua,Nicaragua,Managua,,59USD,"Rotonda Colonia Centro América, 1 c. a Este, 1/2 c. al Norte",
Airport X Managua Hotel,Nicaragua,Managua,,39USD,Frente Iglesia Residencial Montechristi,
Hacienda Puerta del Cielo Ecolodge Masatepe,Nicaragua,Masaya,,264USD,"Camino de los Bueyes, Nimboja # 2",
Hotel Granada Nicaragua,Nicaragua,Granada,,91USD,118 Calzada Street,
Los Patios Hotel,Nicaragua,Granada,,107USD,Calle Corrales 525,
Best Western El Almirante,Nicaragua,Granada,,64USD,Calle Corrales 111 Ferreteria Datisa 1/2 Cuadra al Lago,
Seminole Plaza Hotel,Nicaragua,Managua,,77USD,De Bancentro carretera a Masaya 1c oeste 1c al sur,
Hotel Kekoldi De Granada Nicaragua,Nicaragua,Granada,,62USD,El Consulado 35 Central Park Alhambra,
Hotel Spa Granada,Nicaragua,Granada,,97USD,"Calle Atravesada, Across from Bancentro",
Hotel Victoriano,Nicaragua,San Juan del Sur,,112USD,"Paseo de la Mar, Costado Norte Enitel",
Hotel Aloha Managua,Nicaragua,Managua,,56USD,From Hotel Seminole 3 blocksto the North and 25 mts to,
Hotel La Pergola Granada,Nicaragua,Granada,,58USD,"Calle el Caimito, desde la Alcaldia Municipal, 3 cuadras al Lago",
Jicaro Island Ecolodge,Nicaragua,Granada,,498USD,"Granda Isletas, Granada 100, Nicaragua",
Best Western Las Mercedes Leon,Nicaragua,Leon,,78USD,50 Metros Norte Catedral,
Mukul Luxury Resort and Spa,Nicaragua,Tola,,890USD,Guacalito De La Isla,
Hotel El Almendro Managua,Nicaragua,Managua,,77USD,"De la Rotonda Rubén Darío, Metrocentro 2 cuadras al Oeste y 1/2 cuadra al Sur.  2a Avenida S.O",
Hotel Casa Barcelona,Nicaragua,Granada,,36USD,"Desde Puente Palmira: 1 cuadra al este (lago), 1 cuadra al sur y 25 varas al este",
Hotel La Bocona,Nicaragua,Granada,,60USD,Calle La Libertad 1 Cuadra al Oeste del BAC,
Hotel Real La Merced,Nicaragua,Granada,,56USD,Frente a Iglesia la Merced,
El Jardin,Nicaragua,San Juan del Sur,,52USD,Bahia Nacascolo,
Hotel Casa del Consulado,Nicaragua,Granada,,83USD,"Banpro 30vrs al oeste, Calle El Consulado",
La Islita Boutique Hotel,Nicaragua,Granada,,70USD,"De la Alcaldía 2 Cuadras al Lago, 1 y ½ al Sur (Calle El Cisne)",
Surf Ranch Action Sports Resort,Nicaragua,San Juan del Sur,,78USD,"Empalme de El Valle, 991.5 m al Este",
Hotel il Padrino,Nicaragua,Granada,,51USD,"Del Convento San Francisco 1 y 1/2 cuadras al Norte, frente del Gimnasio Sports",
Marsella Beach Front,Nicaragua,San Juan del Sur,,38USD,Playa Marsella 0001,
Hotel Estrada,Nicaragua,Granada,,93USD,Calle El Arsenal,
Hotel RDG Managua,Nicaragua,Managua,,63USD,"Planes de Altamira 3era Etapa, de Pizza Hut Villa Fontana 1cuadra al oeste 1 cuadra al norte y 1 cuadra al este, al tope de rotonda.",
La Pyramide Managua,Nicaragua,Managua,,48USD,One block south from Hercules Gym at Reparto San Juan,
Hotel Vistamar Pochomil,Nicaragua,Pochomil,,108USD,Km 70 Carretera ,
Parque Maritimo el Coco,Nicaragua,San Juan del Sur,,105USD,Playa El Coco,
Hotel El Club,Nicaragua,Granada,,68USD,Calle de la Libertad / Avenida Barricada,
Hotel Estrella,Nicaragua,Managua,,58USD,"Gasolinera Esso Rubenia 200 mts al Norte, Pista Portezuelo",
Mansion Teodolinda,Nicaragua,Managua,,77USD,3a Avenida y 10ma Calle Sur Oeste Reparto Bolonia,
Hotel Europeo,Nicaragua,Managua,,58USD,"Del Canal 2, 75 vrs abajo Residencial Bolonia ",
Hotel Alhambra Granada Nicaragua,Nicaragua,Granada,,94USD,Costado Oeste Parque Central,
HC Suites Hotel,Nicaragua,San Juan del Sur,,30USD,"Zona Costera, Contiguo a Casa Marina y Frente Restaurante Joseline",
Hotel La Mar Dulce,Nicaragua,Granada,,84USD,"La Islita Street, from Supermarket La Colonia 3 blocks south.",
Hotel Real Destino Granada,Nicaragua,Granada,,77USD, El  Caimito,
Hotel El Internacional,Nicaragua,Granada,,48USD,Calle La Islita (2 blocks south and half a block east of the La Colonia supermarket),
Hotel Los Robles Managua,Nicaragua,Managua,,62USD,Los Robles Front of Restaurante La Marsellaise,
Punta Teonoste Nature Lodges Tola,Nicaragua,Tola,,94USD,5 km entre el Astillero y Las Salinas de Nahualapa,
Hotel Glifoos,Nicaragua,Granada,,31USD,C/ Real Xalteva 205 contiguo a farmacia Praga,
Hotel Villa Angelo,Nicaragua,Managua,,31USD,Del Hotel Mansion Teolinda 30 Vrs Abajo,
Hotel Casa Real Managua,Nicaragua,Managua,,69USD,"Lomas de Guadalupe Rotonda Ruben Dario, 2c al oeste, 2c al sur 1/2c al este",
Hotel El Maltese,Nicaragua,Granada,,45USD,Plaza Espana 50 mts al Sur - Malecon de Granada,
Royal Chateau Hotel,Nicaragua,San Juan del Sur,,57USD,"From the market, one block east",
Casa Bahia Hotel,Nicaragua,San Juan del Sur,,144USD,150 mts from Playa Marsella,
Hotel Posada Bahia Azul,Nicaragua,San Juan del Sur,,40USD,Park 1.5 block south,
La Estacion,Nicaragua,San Juan del Sur,,85USD,"Coastal Road, Oceanfront, PO Box 505",
San Juan de la Isla,Nicaragua,San Juan del Sur,,84USD,"""El Quino"" 200 meters to north, 2.3 km. to east. Ometepe Island, Nicaragua.",
Elements Hotel Boutique,Nicaragua,Managua,,162USD,"Residencial Los Robles, contiguo a Plaza Cuba",
Barrio Cafe Hotel Restaurant Bar,Nicaragua,San Juan del Sur,,70USD,Del Mercado Municipal 1 Cuadra Al Oeste,
Hotel Hamacas,Nicaragua,Rivas,,36USD,Del Muelle San Jorge 100 metros Oeste 25 metros Sur,
Casa Xanadu Granada,Nicaragua,Granada,,110USD,Calle El Arsenal,
Montecristo River Lodge,Nicaragua,El Castillo,,73USD,Frente Isla Sonbrero de Cuero,
Hotel Hex Esteli,Nicaragua,Jinotega,,65USD,Km 149 Carretera Panamericana,
Hotel Los Portales El Cubano,Nicaragua,El Cubano,,88USD,"Rotonda Los Encuentros, 500 metros al norte, contiguo a Restaurante RostiPollos",
Hotel Alcazar San Juan del Sur,Nicaragua,San Juan del Sur,,101USD,Zona Central,
Hotel Colibri Managua,Nicaragua,Managua,,45USD,"Colonial Los Robles, de Funeraria Monte de Los Olivos 1c norte y 1 1/2 c Oeste, #9, Managua 505, ",
Hotel Casa del Lago,Nicaragua,Granada,,22USD,"De la iglesia Guadalupe 1 cuadra y media al lago frente al multiestadio, Granada-Nicaragua",
Hotel La Posada de Don Pantaleon,Nicaragua,Managua,,54USD,Colegio Teresiano 1 cuadra al sur,
Hotel Roca de la Cumbre,Nicaragua,Jinotega,,40USD,"De la Biblioteca del Banco Central, 1 1/2 Cuadras al Este",
Hotel Los Chilamates,Nicaragua,Granada,,74USD,Del supermercado La Colonia 1 cuadra al sur,
Hotel Los Pinos Managua,Nicaragua,Managua,,50USD,"Gimnasio Hercules, una calle al sur media arriba, 314",
Hotel Austria Leon,Nicaragua,Leon,,78USD,Catedral 1 Cuadra Al Sur,
Milagro del Mar,Nicaragua,Montelimar,,135USD,Villa el Carmen. Km 49 road to Masachapa. 11 Km West,
Hotel Ivania's,Nicaragua,Masaya,,43USD,3 1/2 Cuadras Al Oeste,
Hacienda Iguana,Nicaragua,Tola,,146USD,Km 137 ,
Hotel Boutique La Cigale,Nicaragua,Granada,,84USD,"Del Parque Central, 4 cuadras al lago, Calle La Calzada",
Hotel Lomas del Valle,Nicaragua,Managua,,58USD,"Residencial Lomas del Valle de la entrada 2 cuadra Este, 3 cuadra Norte casa 151",
Hotel Colonnade Nicaragua,Nicaragua,Managua,,61USD,Planes de Altamira Primera Etapa,
Hotel Le Chateau,Nicaragua,Managua,,80USD,Planes de Altamira #76,
Hotel Casa San Martin,Nicaragua,Granada,,46USD,Calle La Calzada de la Iglesia Catedral 1c al Lago,
Angel Azul Hotel Managua,Nicaragua,Managua,,69USD,"Villa Fontana No.17, del Club Terraza 1 c. al Este, 75 vrs. al Norte",
Hotel El Familiar Granada,Nicaragua,Granada,,35USD,Da Casa Pellas 2.5c al este,
Hotel Encanto Del Sur,Nicaragua,San Juan del Sur,,35USD,75 Metros Al Sur Parque Central,
Hyatt Place Managua,Nicaragua,Managua,,135USD,Carretera Masaya Km 8 2 Next to Galeria Santo Domingo,
Hostal Real Los Robles,Nicaragua,Managua,,64USD,De los semáforos de la entrada principal de Los Robles 50 vrs. al Oeste y 3 cuadras al Sur,
Hotel & Casino Atlantic City De San Juan Del Sur,Nicaragua,San Juan del Sur,,56USD,1 Malecon,
El Coco Azul,Nicaragua,San Juan del Sur,,41USD,Avenida del Parque,
La Bicicleta Hostal - Hostel,Nicaragua,Managua,,16USD,Restaurante La Marsellaise 2c 1/2 abajo casa 7 Reparto San Juan,
The Surfing Donkey - Deluxe,Nicaragua,Granada,,25USD,Calle La Calzada casa 424 Del Parque Central 3 1 2 cuadras al lago frente el Colegio Carlos A Bravos,
Farallones Hotel,Nicaragua,Leon,,75USD,Rotonda de los Encuentros 800 Metros Norte,
Hotel La Estacion,Nicaragua,Granada,,56USD,De Gasolinera Uno Guapinol una cuadra y media al sur. Avenida Arellano frente al Silais.,
Hotel Ola Verde,Nicaragua,Tola,,14USD,Carretera De Guasacate,
Casa La Merced Hotel Granada Nicaragua,Nicaragua,Granada,,74USD,Real Xalteva Street,
Hostal Hamacas,Nicaragua,San Juan del Sur,,29USD,Escuela 50 mts Sur,
Hotel y Restaurante El Sueno de la Campana,Nicaragua,Jinotega,,35USD,"San Ramon, Detras del Instituto Nacional de San Ramon",
Casa Lucia Managua,Nicaragua,Managua,,34USD,"Colonial los Robles, de la Funeraria Don Bosco 75 varas arriba casa 3",
Hotel El Raizon,Nicaragua,Managua,,34USD,"Km 20.3 Carretera Masaya , Nindiri",
Executive Managua,Nicaragua,Managua,,64USD,"De la Policinica Nicaraguense 50 vrs. al Oeste, a un costado de las Pipitos, Bolonia",
Hotel de Calidad,Nicaragua,Granada,,70USD,Calle el Cementerio,
Hotel D'lido Managua,Nicaragua,Managua,,48USD,Centro Toyota Auto Nica 2 1/2 cuadras al sur. Barrio Altagracia,
Hotel Antigua Estacion Granada,Nicaragua,Granada,,81USD,Frente al parque de los poetas,
Hotel Villa Isabella,Nicaragua,San Juan del Sur,,70USD,Diagonal Norte Iglesias Catolica,
Hotel Casa de Angeles,Nicaragua,Managua,,27USD,From Consejo Supremo Electoral 1 block east 1/2 a block south,
La Posadita de Bolonia,Nicaragua,Managua,,49USD,Canal 2 tres cuadras Oeste 10 varas al norte,
Hotel Brial Plaza,Nicaragua,Managua,,54USD,Km. 7.5 carretera Managua a Masaya 500m al sur 100m al oeste,
Hotel Mi Bohio,Nicaragua,Masatepe,,61USD,"Costado este Policia Nacional, Diarimba",
Hotel Suyapa Beach,Nicaragua,El Cubano,,67USD,Las Penitas Poneloya,
Villa Americana,Nicaragua,Managua,,67USD,Tip Top Carretera a Masaya,
New Century Hostel,Nicaragua,Granada,,15USD,De la polvora 1 cuadra al sur 1/2 cuadra al oeste,
Hotel & Residencias Los Altos,Nicaragua,Managua,,74USD,"15 Avenida Sureste, 500 m. al sur de Villa Fontana del Club Terraza",
Pandora Hostel Managua,Nicaragua,Managua,,11USD,Ticabus 1 cuadra al sur,
Hotel La Perla Leon,Nicaragua,Leon,,91USD,From La Merced Church 11 2 Blocks North,
Hotel Cordoba Granada,Nicaragua,Granada,,71USD,Calle Atravesada Contiguo a Ixchen,
Hotel Asturias Nicaragua,Nicaragua,Managua,,46USD,"De la Iglesia El Carmen 1 cuadra al Oeste, 75 varas al Sur, M/I",
Hotel Real Altamira,Nicaragua,Managua,,46USD,"Avenida Principal de Altamira D'Este, CONICO 1 Cuadra al Este, en Rotonda a Mano Izquierda #539",
Hotel Casa del Sol,Nicaragua,Managua,,87USD,Semaforos del 7 Sur 100 vrs al sur,
Hotel Moderno Jinotega,Nicaragua,Jinotega,,16USD,Costado Sureste de catderal 2 1/2 cuadras al Sur,
Hotel Boutique Hacienda San Pedro,Nicaragua,Masatepe,,70USD,Parque Central 350 mts al norte,
Soma Surf Resort,Nicaragua,Tola,,173USD,600 Meters North of Holy Grinds,
Macheles Place Hotel,Nicaragua,Tola,,79USD,Playa Gigante Municipio Tola Departamento de Rivas,
Hotel Ambassador Managua,Nicaragua,Managua,,71USD,Km 5 Carretera A Masya Frente,
Hotel Restaurante Cesar,Nicaragua,Managua,,60USD,Kilometro 8 Carretera Sur 300 Metros Este,
Hotel Baltsol,Nicaragua,Managua,,37USD,Colonial los Robles Costado Sur Funera Monte de los Olivos 4 Cuadras al Es,
Hotel lara's Planet,Nicaragua,El Castillo,,74USD,"Del Muello 200 mt. al Norte 50 mt. al Sur, El castillo, Rio San Juan",
Hotel Jardin de Granada,Nicaragua,Granada,,64USD,La Otra Banda Contiguo a Farmacia,
Hotel El Valle,Nicaragua,Sebaco,,12USD,Km 102 Carretera Panamericana Norte,
Pacaya Lodge & Spa,Nicaragua,Masaya,,154USD,Comarca Pacaya Catarina Samiria National Reserve,
Marina Puesta del Sol Resort,Nicaragua,El Cubano,,220USD,Comunidad Aserradores,
Guacalito de la Isla,Nicaragua,Tola,,732USD,Km 10 Carretera las Salinas Tola Rivas,
Hostal San AgustAn,Nicaragua,Managua,,49USD,Planes de Altamira de la Vicky 2c al Oeste casa 157,
Hotel Holy,Nicaragua,Managua,,24USD,"Bolonia, de Su Medico 1 Calle al Oeste",
Sky Granada,Nicaragua,Granada,,80USD,Costado Sur de la Iglesia Catedral,
Hotel Vistamar Pochomil Pochomil,Nicaragua,Pochomil,,132USD,Playa Pochomil,
Brandt Los Robles de San Juan,Nicaragua,Managua,,55USD,Semaforos Del Hotel Seminole 2c S 1c O,
Hotel Ideas de Mama Managua,Nicaragua,Managua,,29USD,Rotonda Santo Domingo 5c Sur 2 1/2c Oest,
Punta Teonoste,Nicaragua,Tola,,118USD,From Las Salinas bridge,
Hotel Central Park Managua Managua,Nicaragua,Managua,,60USD,Km 4.5 Carretera Masaya Del Edif Bac,
Hotel El Convento,Nicaragua,Leon,,112USD,Iglesia San Francisco,
Hotel Cafe,Nicaragua,Jinotega,,72USD,Gasolinera Texaco 1calle Oeste 1/2 cuadra al norte,
Central Lodge,Nicaragua,Leon,,19USD,Iglesia El Calvario 1/2 cuadra abajo,
Hotel Los Balcones Leon,Nicaragua,Leon,,60USD,De la esquina de los bancos 1c al este,
Apartamentos Los Angeles Managua,Nicaragua,Managua,,44USD,Edificio Armando Guido 5 1/2 c al sur San Luis Sur,
Hotel Morgut,Nicaragua,Managua,,49USD,De Donde Fue El Cine Cabrera 3 Cuadras,
Apartamentos Vistas de Santo Domingo,Nicaragua,Managua,,81USD,Car Masaya KM 7 2 de Plaza Familiar 400 Mts al Sur Oeste,
Hotel Punta Teonoste Masatepe,Nicaragua,San Juan del Sur,,139USD,From Las Salinas bridge 7 km to Astillero,
Hotel Flor De Sarta,Nicaragua,Leon,,70USD,Del Parque San Juan 2 cuadras al Oeste 1/2 cuadra al Norte,
Hostal Monte Cristi,Nicaragua,Managua,,34USD,"Caretera Norte, Managua, Nicaragua",
Rositas Hotel,Nicaragua,San Juan del Sur,,30USD,Del Mercado 1 cuadra y media al oeste,
Azul Hotel & Restaurante,Nicaragua,Leon,,63USD,"Avenida Central, de la catedral 2 1/2 cuadras al norte",
Hotel Los Arcos Jinotega,Nicaragua,Jinotega,,56USD,"Del Costado Noroeste de Catedral, 1/2 cuadra al Norte",
Hotel Mariposa,Nicaragua,Leon,,54USD,Del Parque Arlen Siu 50 metros Sur,
Posada Fuente Castalia,Nicaragua,Leon,,47USD,"Iglesia la Recoleccion, 275 metros al norte",
Casa Pochomil,Nicaragua,Pochomil,,79USD,200 metros al sur del Hotel Ticomo,
Hotel Colonial San Juan del Sur,Nicaragua,San Juan del Sur,,54USD, Una Cuadra De La Playa,
Finca Hotel el Chipote,Nicaragua,San Juan del Sur,,70USD,Altagracia,
Hotel Ometepetl,Nicaragua,Rivas,,40USD,Del Puerto de Moyogalpa 70 varas al Este,
Hotel La Dolce Vita San Juan del Sur,Nicaragua,San Juan del Sur,,52USD,100 meters west of the Texaco,
Hotel Dulce Hogar,Nicaragua,Managua,,39USD,"Avenida Principal Altamira, 449 Contiguo Pintura Sur",
Hostal Brisas y Olas,Nicaragua,San Juan del Sur,,20USD,Parque 1 1/2 al Oeste,
Isleta El Espino,Nicaragua,Granada,,122USD,Isletas de Granada,
Hotel Tijerinos,Nicaragua,Boaco Department,,46USD,Frente al Parque Central,
Hotel Casa de Alto,Nicaragua,Granada,,58USD,Calle 14 de Septiembre Bomberos media cuadra al oeste,
La Jolla de Guasacate,Nicaragua,Tola,,126USD,"2KM west of Bridge, Las Salinas, Tola, Rivas",
Hostal El Rey,Nicaragua,Jinotega,,30USD,"Zona Central, de la iglesia Molaguina 75 vras al oeste.",
Buena Onda Beach Resort,Nicaragua,Tola,,89USD,Del Cementerio 100vrs al Norte 1 5km al Oeste Playa Santana - Popoyo,
Hotel Los Balcones de Chinandega,Nicaragua,Leon,,61USD,1 Avenida Este Entre Calle Central Y 1 Calle Norte,
Park Avenue Villas Hotel,Nicaragua,San Juan del Sur,,81USD,De Rest El Timon 2 Cuadras Al Norte 1,
Hotel Palacio Real,Nicaragua,Granada,,66USD,Carretera Masaya Granada Km 43 5,
Hotel Museo El Ceibo,Nicaragua,Rivas,,68USD,KM 8.2 Moyogalpa,
Hotel Don Vito,Nicaragua,Jinotega,,50USD,Parque Infantil 1 1/2 Cuadra Al Este,
Bubu Hotel,Nicaragua,Granada,,163USD,"Calle La Libertad, del edificio BAC 2 1/2 cuadras al Oeste",
Hotel Casa de Pacifico Masachapa Playa,Nicaragua,Pochomil,,93USD,Gasolinera Petronic Masachapa 1 c. oeste y 2 c. al sur,
Hotel Matagalpa Inn,Nicaragua,Jinotega,,47USD,Restaurante Tip Top 30 metros al Norte.,
Hotel The Place Inn San Marcos,Nicaragua,Masatepe,,29USD,KM 42 5 San Marcos Masatepe,
Hotel Mirador Ocotal,Nicaragua,Ocotal,,28USD,De la terminal de buses 100m al norte sobre la carretera,
Hotel Brio,Nicaragua,Tola,,40USD,Playa Gigante,
Hotel Apastepe,Nicaragua,Leon,,29USD,"Carretera panamericana Leon-Chinandega, Km. 125.5",
Pajaro Azul,Nicaragua,Masaya,,72USD,Laguna de Apoyo Del triangulo 1200mts al sur,
Hotel Casa Celebertti,Nicaragua,Jinotega,,74USD,"Calle de Los Bancos, contiguo al MINSA",
El Cardhu del Mar,Nicaragua,El Cubano,,72USD,From Pescanova 50 Mts South / Al Sur,
Hotel Plaza Cosiguina,Nicaragua,El Cubano,,61USD,Esquina de los Bancos 50 MTS al sur - Chinandega,
Redwood Beach Resort,Nicaragua,Chinandega Department,,154USD,100 Beach Way,
Dsantos Hotel Boutique,Nicaragua,Masatepe,,74USD,Km 43 Carretera Panamericana Sur 300 Metros Al Norte,
La Princesa de La Isla,Nicaragua,Corn Islands,,59USD,Barrio Brig Bay Waula Point,
Hotel Montserrat,Nicaragua,Managua,,39USD,Optica vision 1c abajo 1/2 al lago Residencial Bolonia,
Eco posada Tortuga Verde,Nicaragua,Masatepe,,36USD,Km 40 1 2 Carretera Sur,
Hotel Restaurante Plaza Manchon,Nicaragua,Granada,,57USD,Km 70 1/2 carretera Nandaime - Rivas,
Campo Royale Resort,Nicaragua,Managua,,75USD,Km 16.7 Carretera Ticuantepe,
Orquidea del Sur,Nicaragua,San Juan del Sur,,204USD,Playa Yankee,
Equilibrio Yoga Art Surf Resort,Nicaragua,Tola,,142USD,Pink Panther Road,
Catalanica,Nicaragua,Rio San Juan Department,,87USD,Isla Mancarron,
Brisas Del Mar Nicaragua,Nicaragua,Chinandega Department,,119USD,Brisas Del Mar Nica,
Hotel San Juan de Leon,Nicaragua,Leon,,52USD,"Costado Norte, parque San Juan",
Arenas Beach Hotel,Nicaragua,Corn Islands,,98USD,"Southwest Bay, Corn Island. Nicaragua",
Hotel Popoyo,Nicaragua,Tola,,49USD,Las Salinas - Tola - Rivas,
El Belga Loco,Nicaragua,El Cubano,,35USD,Costado Sur de Farallon Aquaculture de Nicaragua,
Hotel Villa Hermosa Jinotega,Nicaragua,Jinotega,,20USD,"Tercera entrada a Matagalpa 1 c. al este y 1/2 c. al sur, frente a Clinica Profamilia, Matagalpa, Nicaragua",
Hostal Ibesa,Nicaragua,Rivas,,13USD,Del puerto 100M Sur,
Laguna Beach Club,Nicaragua,Masaya,,34USD,Laguna de Apoyo Frente al empalme,
Simple Beach Lodge,Nicaragua,El Cubano,,35USD,Next to Playa Roca Hotel,
Casa Hotel Santa Elena,Nicaragua,Jinotega,,26USD,Contiguo a Oficinas de INiser O del Colegio de las Monjas 75 vrs al Norte,
Hotel Leon Viejo,Nicaragua,Leon,,59USD,Calle Real s/n,
Hotel El Sueno de Meme,Nicaragua,Leon,,28USD,De donde fue la Mercantil 3 cuadras abajo 75 varas al norte,
Posada Ecologica La Abuela,Nicaragua,Masaya,,87USD,Laguna de Apoyo del Triangulo del Plan de la Laguna 2 kms al Noreste,
Lady M Club Hotel,Nicaragua,Leon,,35USD,Routa De Poneloya Puente Arlen Siu 100mts Al Sur/100 Al Este Leon,
Hotel Pinolero,Nicaragua,Granada,,34USD,Calle Real Xalteva Iglesia la Merced 25 vrs al este,
Hotel y Apartamento Los Cisneros,Nicaragua,Managua,,24USD,CST 2 cuadra al sur 1/2 arriba,
Hotel y Restaurante la Casona,Nicaragua,Jinotega,,55USD,"Catedral San Juan 1 1/2 cuadra al norte, contiguo al BAC jinotega",
Hotel Vanderbilt,Nicaragua,Managua,,35USD,Iglesia El Carmen 100 metros al Norte 50 metros al Oeste,
Zopango Island,Nicaragua,Granada,,173USD,Bahia de Asese,
Brisas Hotel,Nicaragua,Jinotega,,56USD,Centro Medico Quirurgico Santa Fe 75 Varas Al Este Calle Santa Ana,
Hotel Los Arcangeles,Nicaragua,Chontales Department,,57USD,Bo Central Costado Este de Catedral,
Guesthouse El Nancite,Nicaragua,Leon,,45USD,De La Iglesia El Calvario Una Cuadra Y Media Al Norte,
Hotel Alameda Jinotega,Nicaragua,Jinotega,,52USD,K 148 Carretera Panamericana,
Cortijo Esperanza,Nicaragua,Leon,,186USD,Km 107 carretera poneloya,
Hotel Caribe Puerto Cabezas,Nicaragua,Puerto Cabezas,,17USD,Barrio San Luis Calle Principal,
Hotel Majestic Nicaragua,Nicaragua,Masatepe,,84USD,"Km 43 Carretera Diriamba, Jinotepe",
Melting Elefante,Nicaragua,Tola,,27USD,Guasacate - Popoyo Tola,
Hotel Leon del Sol,Nicaragua,Leon,,58USD,"De La Recoleccion 2 Cuadra al Este, 3 Era Avendia, Leon, Nicaragua",
Sunset Hotel San Juan del Sur,Nicaragua,San Juan del Sur,,50USD,"De banpro San Juan del sur 75 vrs, donde fue la policia san juan del sur",
Hotel Dalinky,Nicaragua,Rivas,,53USD,200 Al Oeste Del Muelle,
Paraiso Beach Hotel,Nicaragua,Corn Islands,,0,Brig Bay 2,
Hotel Casa Naranja,Nicaragua,Managua,,0,"Km 4.5 Carretera a Masaya, del Restaurante TipTop 100 mts al Oeste ",
Casa Maderas Ecolodge,Nicaragua,San Juan del Sur,,0,"Concha Cascante junction 200, vrs North",
Hotel Irish House,Nicaragua,San Juan del Sur,,0," From The Market, 2 Blocks To The North",
Casa Marina Condominium Hotel on the Beach San Juan del Sur,Nicaragua,San Juan del Sur,,0,Contiguo Al Banco Bdf Apartado Postal 17,
La Casona de Fabiana,Nicaragua,Granada,,0,De la Iglesia la Merced 3 cuadras al Sur,
Casa San Juan,Nicaragua,Managua,,0,"Rpto. San Juan, Calle Esperanza No.560",
Hostal San Angel,Nicaragua,Granada,,0,1/2 Cuadra al Sur de la Catedral,
Hostal Dona Ida,Nicaragua,Managua,,0,"Colonial Los Robles, De la gasolinera UNO Plaza el Sol 3c al sur 2 1/2 al este. No73",
Hotel Central Park Managua,Nicaragua,Managua,,0,Los Robles,
Hotel Gueguense,Nicaragua,Managua,,0," De La Estatua De Montoya Una, Y Media Cuadra Al Sur",
Hotel Destinos Nicaragua,Nicaragua,Managua,,0,Bolonia Costado Oeste Mansion Teodolinda 60 Varas al Lago,
Hostal Amigos de la Casa Roja,Nicaragua,Granada,,0,"Calle Estrada, from La Merced Church 1 block South, 75 mts East",
El Laurel en Pueblo Viejo,Nicaragua,Managua,,0,Obelisco Altos Santo Domingo 5 Km al sur,
Hostal Palma Real,Nicaragua,Leon,,0,"Hotel El convento, half block north",
Hotel Maritimo El Cubano,Nicaragua,El Cubano,,0,Calle Central Poneloya. Del Cruce de Las Penitas Girar a la Derecha 150 Metros Al Oeste,
Lost Inn Managua Hostel,Nicaragua,Managua,,0,Planes de Altamira 1,
Balcones de Majagual Eco Resort San Juan del Sur,Nicaragua,San Juan del Sur,,0,Playa Majagual,
El GA1/4egA1/4ense,Nicaragua,San Juan del Sur,,0,Playa Majagual,
Redonda Bay Resort,Nicaragua,San Juan del Sur,,0,Playa Majagual,
Parador Granada,Nicaragua,San Juan del Sur,,0,Playa Majagual,
Hotel Maritimo El Cubano Leon Department,Nicaragua,San Juan del Sur,,0,Playa Majagual,
Casa Sacuanjoche,Nicaragua,San Juan del Sur,,0,Playa Majagual,
Hotel Laguna de San Martin,Nicaragua,San Juan del Sur,,0,Playa Majagual,
Malibu At Pacific Marlin,Nicaragua,San Juan del Sur,,0,Playa Majagual,
Hotel Best View Corn Island,Nicaragua,San Juan del Sur,,0,Playa Majagual,
Hostal El Momento,Nicaragua,San Juan del Sur,,0,Playa Majagual,
Latina Hostal,Nicaragua,San Juan del Sur,,0,Playa Majagual,
Hotel Gran Oceano,Nicaragua,San Juan del Sur,,0,Playa Majagual,
Managua Hills Bed and Breakfast,Nicaragua,Managua,,0,"Primera Entrada a Las Colinas, 2 cuadras Este y 2 cuadras Sur",
Bastilla Ecolodge,Nicaragua,Jinotega,,0,Comarca Las Colinas,
Finca Neblina del Bosque,Nicaragua,Ocotal,,0,"De la Rampla, 300 mts al Este",
Buena Onda Backpackers,Nicaragua,San Juan del Sur,,0,"Barrio Frente Sur,, from casa de dragon, 50 meters on your left hand",
Backpackers Manahuac,Nicaragua,Managua,,0,"Hotel Seminole 1 cuadra oeste, 4 1/2 cuadras al sur",
Hotel Yolaina,Nicaragua,Managua,,0,"De Donde Fue Restaurante Quelite 1Cuadra al Este,1Cuadra al Norte,1Cuadra al este, junto a la mezquita de Nicaragua",
Hotel Ticomo,Nicaragua,Managua,,0,Km 8 1/2 Carretera Sur,
Lobster Pot,Nicaragua,Bluefields,,0,Barrio Punta Fria,
Farmstay El Porton Verde,Nicaragua,Managua,,0,"43 Rua Bartolomeu Zunega, Pinheiros",
Inn on the Pacific,Nicaragua,San Juan del Sur,,0,Del Restaurante el Timon 175 al Norte,
Surfing Donkey,Nicaragua,San Juan del Sur,,0,De la Iglesia del calvario 1 cuadra al sur,
Tocamar,Nicaragua,San Juan del Sur,,0,9 Km From San Juan Del Sur Middle Of,
