sku,name,url,price,full_description
110700,20 3M 8710E Cup Shape Dust Respirators,http://www.arco.co.uk/products/110700,18.42,3M 8710 Dust Respirator
111600,3M 6200M Low Maintenance Half Mask Respirator Medium,http://www.arco.co.uk/products/111500,12.56,3M 6000 Half Mask Respirator
111800,3M 6800S Low Maintenance Full Face Mask Respirator Medium,http://www.arco.co.uk/products/111400,81.53,3M 6000 Series Full Face Mask Respirator
112100,2 3M 6051 A1 Organic Vapours Gas Filters,http://www.arco.co.uk/products/112100,7.01,3M 6051 A1 Gas Filter
112300,2 3M 6057 ABE1 Combination Gas Filters,http://www.arco.co.uk/products/112300,8.00,3M 6057 ABE1 Gas Filter
112400,2 3M 6055 A2 Organic Vapours Gas Filter,http://www.arco.co.uk/products/112400,8.87,3M 6055 A2 Gas Filter
112500,2 3M 2125 P2 Particulate Filters,http://www.arco.co.uk/products/112500,5.38,3M 2125 P2 Particulate Filter
112700,2 3M 2135 P3 Particulate Filters,http://www.arco.co.uk/products/112700,6.50,3M 2135 P3 Particulate Filter
113200,10 3M 8812 Cup Shape Valved Dust Respirators,http://www.arco.co.uk/products/113200,14.94,3M 8812 Valved Dust Respirator
113300,10 3M 8822 Dust/Mist Respirators,http://www.arco.co.uk/products/113300,21.78,3M 8822 Valved Dust/Mist Respirator
113400,2 3M 2138 P3 Particulate Nuisance Level Organic Vapour & Acid Gas Filters,http://www.arco.co.uk/products/113400,7.86,3M 2138 P3 Particulate Filter
113500,20 3M 8810 Dust/Mist Respirators,http://www.arco.co.uk/products/113500,36.84,3M 8810 Dust/Mist Respirator
113800,4 3M 6035 P3SL Encapsulated Particulate Filters,http://www.arco.co.uk/products/113800,14.76,3M 6035 P3SL Encapsulated Particulate Filter
114100,2 3M 6038 P3HF Encapsulated Filters,http://www.arco.co.uk/products/113900,8.20,3M 6038 P3HF Encapsulated Filter
114200,10 3M 9928 FFP2 Valved Premium Soft Seal Welding Fume Respirator,http://www.arco.co.uk/products/114200,50.07,3M 9928 Valved Premium Welding Fume Respirator
114400,20 3M 9913 Nuisance Odour Respirators,http://www.arco.co.uk/products/114400,65.05,3M 9913 Nuisance Odour Respirator
114700,2 3M 6059 ABEK1 Combination Gas Filters,http://www.arco.co.uk/products/114700,9.72,3M 6059 ABEK1 Gas Filter
116100,5 3M 8825 FFP2D Valved Dust/Mist/Metal Fume Respirators,http://www.arco.co.uk/products/116100,22.66,3M 8825 Valved Dust/Mist/Metal Fume Respirator
116304,5 3M 8835 Valved Dust/Mist/Metal Fume Respirators Medium/Large,http://www.arco.co.uk/products/116303,29.49,3M 8835 Valved Dust/Mist/Metal Fume Respirator
116400,10 3M 8833 FFP3 Valved Dust/Mist Respirators,http://www.arco.co.uk/products/116400,39.39,3M 8833 Valved Dust/Mist/Metal Fume Respirator
116900,3M 4279 FFABEK1P3D Half Mask Respirator,http://www.arco.co.uk/products/116900,24.12,3M 4279 Organic Vapour/Inorganic & Acid Gases/Ammonia/Dust Half Mask Respirator
117000,3M 4277 FFABE1P3D Half Mask Respirator,http://www.arco.co.uk/products/117000,22.02,3M 4277 Organic Vapour/Inorganic & Acid Gases/Dust Half Mask Respirator
117100,3M 4251 FFA1P2D Half Mask Respirator,http://www.arco.co.uk/products/117100,15.95,3M 4251 Organic Vapour/Dust Half Mask Respirator
117400,3M 4255 FFA2P3D Half Mask Respirator,http://www.arco.co.uk/products/117400,19.01,3M 4255 Organic Vapour/Dust Half Mask Respirator
117600,40 3M 105 Face Seal Cleaner Wipes,http://www.arco.co.uk/products/117600,10.35,3M 105 Face Seal Cleaner
118200,20 3M Aura 9310+ FFP1 Dust/Mist Resp,http://www.arco.co.uk/products/118200,23.32,3M Aura 9310+ FFP1 Dust/Mist Respirator
118300,10 3M Aura 9312+ FFP1 Vlv Dust/Mist Resp,http://www.arco.co.uk/products/118300,19.05,3M Aura 9312+ FFP1 Valved Dust/Mist Respirator
118400,20 3M Aura 9320+ FFP2 Dust/Mist Resp,http://www.arco.co.uk/products/118400,43.06,3M Aura 9320+ FFP2 Dust/Mist Respirators
118500,10 3M Aura 9322+ FFP2 Vlv Dust/Mist Resp,http://www.arco.co.uk/products/118500,28.35,3M Aura 9322+ FFP2 Valved Dust/Mist Respirator
118600,10 3M Aura 9332+FFP3V Dust/Mist/FumeResp,http://www.arco.co.uk/products/118600,52.64,3M Aura 9332+ FFP3V Dust/Mist/Fume Respirator
118800,10 3M Aura 9432 FFP3V Food Industry Resp,http://www.arco.co.uk/textsearch?event=textsearch&searchTerms=118800,55.28,3M Aura 9432 FFP3V Food Industry Respirator
119600,2 3M 501 Filter Retainers,http://www.arco.co.uk/products/119600,2.77,3M 501 Filter Retainer
119800,20 3M 5925 P2 Particulate Filters,http://www.arco.co.uk/products/119800,43.48,3M 5925 P2 Particulate Filter
119900,10PRS 3M 5935 P3 Particulate Filters,http://www.arco.co.uk/products/119900,50.75,3M 5935 P3 Particulate Filter
125700,10 3M 9926 FFP2S Nuisance Level Acid Gas Respirators,http://www.arco.co.uk/products/125700,50.18,3M 9926 Dust/Mist/Acid Gas Respirator
125800,10 3M 9914 FFP1S Nuisance Level Acid Gas Respirators,http://www.arco.co.uk/products/125800,34.64,3M 9914 Dust/Mist/Nuisance Odour Respirator
125900,10 3M 9922 FFP2 Valved Respirators,http://www.arco.co.uk/products/125900,38.83,3M 9922 Nuisance Level Organic Vapour Relief Respirator
126003,3M 7502 Silicone Half Mask Respirator Medium,http://www.arco.co.uk/products/126002,21.91,3M 7500 Series Silicone Half Mask Respirator
128000,Box of 10 3M 8310 FFP1 Respirator Unvalved,http://www.arco.co.uk/products/128000,9.46,3M 8310 Dust Respirator
128100,Box of 10 3M 8312 FFP1 Respirators Valved,http://www.arco.co.uk/products/128100,17.59,3M 8312 Valved Dust Respirator
128200,Box of 10 3M 8320 Dust Respirators,http://www.arco.co.uk/products/128200,19.61,3M 8320 Dust Respirator
128300,Box of 10 3M 8322 FFP2 Respirator Valved,http://www.arco.co.uk/products/128300,25.58,3M 8322 FFP2 Respirator Valved
143110,Honeywell Airvisor 2 MV Airfed Paintspray Respirator,http://www.arco.co.uk/products/143100,241.58,Honeywell Airvisor 2 MV Airfed Respirator
143210,Honeywell Airvisor 2 MV Airfed Industrial Respirator,http://www.arco.co.uk/products/143100,198.49,Honeywell Airvisor 2 MV Airfed Respirator
201200,5 pairs Howard Leight Cool 2 Ear Muff Absorbent Pads,http://www.arco.co.uk/products/201200,2.03,Howard Leight Cool 2 Ear Muff Absorbent Pads
210001,Howard Leight Leightning LO Ear Muffs Behind Neck,http://www.arco.co.uk/textsearch?event=textsearch&searchTerms=210001,10.22,Howard Leight Leightning LO Ear Muffs
210002,Howard Leight Leightning LO Ear Muffs Folding Over Head,http://www.arco.co.uk/textsearch?event=textsearch&searchTerms=210002,12.17,Howard Leight Leightning LO Ear Muffs
210003,Howard Leight Leightning L1 Ear Muffs Behind Neck,http://www.arco.co.uk/textsearch?event=textsearch&searchTerms=210003,10.22,Howard Leight Leightning L1 Ear Muffs SNR29
210004,Howard Leight Leightning L2 Ear Muffs Folding Headband Hi-Vis Yellow,http://www.arco.co.uk/products/210004,15.85,Howard Leight Leightning L2 Ear Muffs Folding Headband SNR32
210006,Leightning L3 Ear Muffs Over Head Hi-Vis Yellow,http://www.arco.co.uk/products/210006,18.65,Howard Leight Leightning L3 Ear Muffs Over Head SNR34
218100,Howard Leight Leightning L1 Ear Muffs Over Head,http://www.arco.co.uk/products/218100,10.22,Howard Leight Leightning L1 Ear Muffs SNR30
218300,Howard Leight Leightning L3 Ear Muffs Over Head,http://www.arco.co.uk/products/218300,17.64,Howard Leight Leightning L3 Ear Muffs SNR34
227300,Centurion Connect S42C Ear Muffs Champion Helmet Mounted,http://www.arco.co.uk/textsearch?event=textsearch&searchTerms=227300,19.21,Centurion Connect S42 Aegean Ear Muffs Helmet Mounted SNR30
230100,E.A.R Classic Ear Plugs,http://www.arco.co.uk/products/230100,49.28,E.A.R Ear Plugs SNR28
231100,E.A.R Express Pod Ear Plugs,http://www.arco.co.uk/products/231100,79.38,E.A.R Express Pod Ear Plugs SNR28
232300,E.A.Rsoft Yellow Neon Ear Plugs,http://www.arco.co.uk/products/232300,55.00,E.A.Rsoft Yellow Neon Ear Plugs SNR36
232800,E.A.Rsoft Yellow Neon Corded Ear Plugs,http://www.arco.co.uk/products/232800,64.00,E.A.Rsoft Yellow Neon Ear Plugs - Corded SNR36
232900,E.A.Rsoft Blue Detectable Corded Ear Plugs,http://www.arco.co.uk/products/232900,92.00,E.A.Rsoft Blue Detectable Ear Plugs SNR36
233100,E.A.Rsoft FX Ear Plugs,http://www.arco.co.uk/products/233100,48.00,E.A.Rsoft FX Ear Plugs SNR39
235100,200 Pairs E.A.R Classicsoft Ear Plugs,http://www.arco.co.uk/products/235100,63.76,E.A.R Classicsoft Ear Plugs
235500,500 pairs E.A.R Classicsoft Ear Plug One Touch Dispenser Refill,http://www.arco.co.uk/products/235500,130.70,E.A.R Classicsoft Ear Plug One Touch Dispenser Refill SNR36
236100,200 pairs E.A.R Classicsoft Corded Ear Plugs,http://www.arco.co.uk/products/236100,106.26,E.A.R Classicsoft Ear Plugs - Corded SNR36
240300,E.A.R Cap Banded Ear Plugs,http://www.arco.co.uk/products/240300,2.93,E.A.R Cap Banded Ear Plugs SNR23
240500,E.A.R Cap and Band Replacement Pods,http://www.arco.co.uk/products/243100,44.74,E.A.R Cap Banded Ear Plugs SNR23
240600,E.A.R Classic Corded Ear Plugs,http://www.arco.co.uk/products/240600,82.74,E.A.R Classic Ear Plugs - Corded SNR28
241300,E.A.R Tracer Food Quality Detectable Corded Ear Plugs,http://www.arco.co.uk/products/241300,76.41,E.A.R Tracer Food Quality Detectable Ear Plugs SNR32
241800,E.A.R UltraFit Pre-Moulded Corded Ear Plugs,http://www.arco.co.uk/products/241800,65.88,E.A.R UltraFit Pre-Moulded Ear Plugs SNR32
244400,E.A.R One Touch Ear Plug Dispenser,http://www.arco.co.uk/products/244400,33.29,E.A.R One Touch Ear Plug Dispenser
244500,500 pairs E.A.R Classic Ear Plug One Touch Dispenser Refill,http://www.arco.co.uk/products/244500,108.90,E.A.R Classic Ear Plug One Touch Dispenser Refill SNR28
244600,500 Pairs E.A.Rsoft Yellow Neon Ear Plug One Touch Dispenser Refill,http://www.arco.co.uk/products/244600,89.30,E.A.Rsoft Yellow Neon Ear Plug One Touch Dispenser Refill SNR36
245200,E.A.R UltraFit 20 Corded Ear Plugs,http://www.arco.co.uk/products/245200,93.40,E.A.R UltraFit 20 Ear Plugs SNR20
247000,Peltor Optime I Ear Muffs Over Head,http://www.arco.co.uk/products/247000,11.01,Peltor Optime I Ear Muffs Over Head SNR27
247100,Peltor Optime I Ear Muffs Behind Head,http://www.arco.co.uk/products/247100,12.18,Peltor Optime I Ear Muffs Behind Head SNR26
247300,Peltor Optime I Ear Muffs Champion Plus Helmet Mounted,http://www.arco.co.uk/products/247300,13.40,Peltor Optime I Ear Muffs Helmet Mounted SNR26
247500,Peltor Optime I Ear Muffs Clip On Helmet Mounted,http://www.arco.co.uk/products/247300,13.40,Peltor Optime I Ear Muffs Helmet Mounted SNR26
248000,Peltor Optime II Ear Muffs Over Head,http://www.arco.co.uk/products/248000,13.49,Peltor Optime II Ear Muffs Over Head SNR31
248100,Peltor Optime II Ear Muffs Behind Head,http://www.arco.co.uk/products/248100,15.01,3M Peltor Optime II Ear Muffs Behind Head SNR31
248200,Peltor Optime II Ear Muffs Folding Headband Green,http://www.arco.co.uk/products/248200,17.61,Peltor Optime II Ear Muffs Folding Headband SNR31
248300,Peltor Optime II Ear Muffs Champion Plus Helmet Mounted Green,http://www.arco.co.uk/products/248300,16.06,Peltor Optime II Ear Muffs Helmet Mounted SNR30
248500,Peltor Optime II Ear Muffs Clip On Helmet Mounted Green,http://www.arco.co.uk/products/248300,16.06,Peltor Optime II Ear Muffs Helmet Mounted SNR30
249000,Peltor Optime III Ear Muffs Over Head Black & Red,http://www.arco.co.uk/products/249000,16.33,Peltor Optime III Ear Muffs Over Head SNR35
249100,Peltor Optime III Ear Muffs Behind Head,http://www.arco.co.uk/products/249100,18.27,Peltor Optime III Ear Muffs Behind Head SNR35
249300,Peltor Optime III Ear Muffs Champion Plus Helmet Mounted,http://www.arco.co.uk/products/249300,18.19,Peltor Optime III Ear Muffs Helmet Mounted SNR34
249400,Peltor Optime III Ear Muff Hygiene Kit,http://www.arco.co.uk/products/247400,5.32,Peltor Optime Ear Muff Hygiene Kits
249500,Peltor Optime III Ear Muffs Clip On Helmet Mounted,http://www.arco.co.uk/products/249300,18.89,Peltor Optime III Ear Muffs Helmet Mounted SNR34
249600,Peltor Optime III Ear Muffs Over Head High Visibility Yellow,http://www.arco.co.uk/products/249000,18.09,Peltor Optime III Ear Muffs Over Head SNR35
250200,3M Headgear G500 Industrial System,http://www.arco.co.uk/products/250200,37.07,3M Headgear G500 Industrial &<br/>Forestry System
250300,3M Headgear G500 Forestry System,http://www.arco.co.uk/products/250300,36.04,3M Headgear G500 Forestry System SNR26
258000,Peltor Lumberjack Combination Unit,http://www.arco.co.uk/products/258000,36.79,Peltor Lumberjack Combination Unit SNR28
262000,Peltor Lite-Com Basic Headset Over Head,http://www.arco.co.uk/products/262000,353.03,Peltor Lite-Com Basic Headset Over Head SNR31
262400,Peltor Optime Push-To-Listen Ear Muffs Over Head,http://www.arco.co.uk/products/262400,27.10,Peltor Optime Push-To-Listen Ear Muffs
264200,Peltor Protac Headset Over Head,http://www.arco.co.uk/products/264200,131.16,Peltor Protac Headset Over Head SNR32
265700,Peltor Alert Headset Over Head,http://www.arco.co.uk/textsearch?event=textsearch&searchTerms=265700,129.62,Peltor Alert Headset Over Head SNR32
280001,50 pairs Howard Leight SmartFit Corded Reusable Ear Plugs,http://www.arco.co.uk/products/280001,43.44,Howard Leight SmartFit Reusable Ear Plugs SNR30
281200,Howard Leight Clarity 656 Corded Ear Plugs,http://www.arco.co.uk/textsearch?event=textsearch&searchTerms=281200,3.18,Howard Leight Clarity 656 Ear Plugs SNR22
281300,Howard Leight Laser-Lite Disposable Foam Ear Plugs,http://www.arco.co.uk/products/281300,37.13,Howard Leight Laser-Lite Disposable Foam Ear Plugs SNR35
281700,Howard Leight Laser-Lite Disposable Foam Corded Ear Plugs,http://www.arco.co.uk/products/281700,34.05,Howard Leight Laser-Lite Disposable Foam Ear Plugs - Corded SNR35
282300,Howard Leight QB3 HYG Hygiene Banded Ear Plugs,http://www.arco.co.uk/products/282300,3.95,Howard Leight QB3 HYG Hygiene Banded Ear Plugs SNR23
282500,Howard Leight LS500 Ear Plug Dispenser,http://www.arco.co.uk/products/282500,122.57,Howard Leight LS500 Ear Plug Dispenser
282600,500 pairs Howard Leight Max Disposable Foam Ear Plugs LS500 Dispenser Refill,http://www.arco.co.uk/products/282600,75.59,Howard Leight Max Disposable Foam Ear Plugs LS500 Dispenser Refill
282900,500 pairs Howard Leight LaserLite Disposable Foam Ear Plugs LS500 Dispenser Refill,http://www.arco.co.uk/products/282900,68.08,Howard Leight Laser-Lite Disposable Foam Ear Plugs LS500 Dispenser Refill SNR35
283601,Box of 50 Pairs Howard Leight Quiet QD-1 Ear Plugs,http://www.arco.co.uk/products/283600,15.91,Howard Leight Quiet Reusable Ear Plugs SNR28
284301,Box of 50 Pairs Howard Leight Quiet QD-30 Corded Ear Plugs,http://www.arco.co.uk/products/284300,30.66,Howard Leight Quiet Reusable Ear Plugs - Corded
285300,Howard Leight Airsoft Reusable Corded Ear Plugs,http://www.arco.co.uk/products/285300,51.35,Howard Leight AirSoft Reusable Ear Plugs SNR30
287200,Pair Howard Leight QB300 Hygiene Banded Ear Plugs Replacement Pods,http://www.arco.co.uk/products/282300,91.77,Howard Leight QB3 HYG Hygiene Banded Ear Plugs SNR23
288300,Howard Leight Max Disposable Foam Ear Plugs,http://www.arco.co.uk/products/288300,39.64,Howard Leight Max Disposable Foam Ear Plugs SNR37
288500,Howard Leight Max Disposable Foam Corded Ear Plugs,http://www.arco.co.uk/products/288500,36.55,Howard Leight Max Disposable Foam Ear Plugs - Corded SNR37
289100,Howard Leight Laser-Trak Detectable Disposable Corded Ear Plugs,http://www.arco.co.uk/products/289100,49.51,Howard Leight Laser-Trak Detectable Disposable Ear Plugs SNR35
289700,Howard Leight SmartFit Detectable Reusable Corded Ear Plugs,http://www.arco.co.uk/products/289700,72.04,Howard Leight SmartFit Detectable Reusable Ear Plugs SNR30
304600,Honeywell Op-tema Eyeshield Blue Frame Clear Lens,http://www.arco.co.uk/products/304500,3.79,Honeywell Op-tema Eyeshield
305000,Honeywell Millennia Eyeshield Blue Frame Clear Lens,http://www.arco.co.uk/products/305000,6.36,Honeywell Millennia Eyeshield
305300,Honeywell Millennia Sport Eyeshield Clear Lens Teal Sidearms,http://www.arco.co.uk/products/305300,4.79,Honeywell Millennia Sport Eyeshield
318301,Honeywell Protege Eyeshield Clear Anti Mist Lens,http://www.arco.co.uk/products/318301,5.48,Honeywell Protege Eyeshield
318303,Honeywell Protege Eyeshield Indoor/Outdoor Hard Coat Silver Lens,http://www.arco.co.uk/products/318301,6.33,Honeywell Protege Eyeshield
318401,Honeywell A800 Eyeshield Clear Lens,http://www.arco.co.uk/products/318401,3.63,Honeywell A800 Eyeshield
318402,Honeywell A800 Eyeshield TSR Grey Lens,http://www.arco.co.uk/products/318401,4.31,Honeywell A800 Eyeshield
318403,Honeywell A800 Eyeshield In/Out Silver Lens,http://www.arco.co.uk/products/318401,5.91,Honeywell A800 Eyeshield
321400,uvex Ultravision Goggle Transparent Grey Frame Clear Supravision Lens,http://www.arco.co.uk/products/321400,9.06,uvex Ultravision Goggle
321600,uvex Ultravision Welding Goggle Black Frame Green Shade 5 Lens,http://www.arco.co.uk/products/321600,10.30,uvex Ultravision Welding Goggle
321900,uvex Ultrasonic Goggle Orange Frame Clear Supravision Lens,http://www.arco.co.uk/products/321800,9.94,uvex Ultrasonic Goggle
322300,Honeywell Vistamax VX Dual Lens Goggle,http://www.arco.co.uk/products/322300,6.53,Honeywell Vistamax VX Dual Lens Goggle
326500,Honeywell Duramaxx Goggle Clear Lens,http://www.arco.co.uk/products/326500,9.85,Speian Duramaxx Goggle
328300,Honeywell Xc Safety Spectacles Clear Lens,http://www.arco.co.uk/products/328300,6.73,Honeywell Xc Safety Spectacles
328400,Honeywell Xc Safety Spectacles Clear Fog-Ban Lens,http://www.arco.co.uk/products/328300,7.62,Honeywell Xc Safety Spectacles
328600,Honeywell Xc Safety Spectacles Yellow HD Lens,http://www.arco.co.uk/textsearch?event=textsearch&searchTerms=328600,7.34,Honeywell Xc Safety Spectacles
336800,uvex Ultrashield Faceshield,http://www.arco.co.uk/products/336800,6.42,uvex Ultrashield
339200,Honeywell Bionic Faceshield with Clear Polycarbonate Fog Ban Visor,http://www.arco.co.uk/products/339200,32.62,Honeywell Bionic Faceshield
339300,Honeywell Bionic Faceshield with Clear Acetate Visor,http://www.arco.co.uk/products/339200,22.03,Honeywell Bionic Faceshield
339500,Honeywell Bionic Faceshield Clear Polycarbonate Fog Ban Replacement Visor,http://www.arco.co.uk/products/339200,14.42,Honeywell Bionic Faceshield
339600,Honeywell Bionic Faceshield Clear Acetate Replacement Visor,http://www.arco.co.uk/products/339200,5.85,Honeywell Bionic Faceshield
340100,Clearways Browguard with Ratchet Adjustment,http://www.arco.co.uk/products/340100,8.61,Honeywell Clearways Faceshield
340500,Clearways Browguard with Elastic Headband,http://www.arco.co.uk/products/340100,6.79,Honeywell Clearways Faceshield
340700,Clearways Acetate Visor 200 mm Clear,http://www.arco.co.uk/products/340100,5.16,Honeywell Clearways Faceshield
340900,Clearways Polycarbonate Visor 200 mm Clear,http://www.arco.co.uk/products/340100,5.88,Honeywell Clearways Faceshield
345100,Honeywell Supervizor Browguard Ratchet Headband,http://www.arco.co.uk/textsearch?event=textsearch&searchTerms=345100,13.02,Honeywell Supervizor Faceshield
345300,Honeywell Supervizor SV9PC Polycarbonate Visor,http://www.arco.co.uk/products/345100,8.10,Honeywell Supervizor Faceshield
345900,Honeywell Supervizor Acetate Welding Visor Shade 5,http://www.arco.co.uk/products/345100,21.52,Honeywell Supervizor Faceshield
348800,uvex Skyper Eyeshield Black Frame Clear Supravision Lens,http://www.arco.co.uk/products/348800,8.90,uvex Skyper Eyeshield
371000,uvex Skybrite SX2 Eyeshield Blue Frame Clear Supravision Lens,http://www.arco.co.uk/products/371000,8.54,uvex Skybrite SX2 Eyeshield
377100,uvex Nylon Pouch with Belt Loops,http://www.arco.co.uk/products/377100,4.09,uvex Spectacle Pouch
408300,Centurion Vulcan Fibreglass Safety Helmet White,http://www.arco.co.uk/textsearch?event=textsearch&searchTerms=408300,22.96,Centurion Vulcan Fibreglass Safety Helmet
411600,Protector First Base + Safety Baseball Cap Reduced Peak Navy Blue,http://www.arco.co.uk/products/412400,10.26,Protector&reg; First Base + Safety Baseball Cap
419100,Centurion Bump Cap White,http://www.arco.co.uk/products/419100,4.20,Centurion Bump Cap
423100,Centurion S33/3 Safety Helmet Terylene Head Harness,http://www.arco.co.uk/textsearch?event=textsearch&searchTerms=423100,7.33,Centurion Safety Helmet Head Harness
424211,Centurion Frost Cape Hi-Vis Orange S50HVOEDFC,http://www.arco.co.uk/textsearch?event=textsearch&searchTerms=424211,19.59,Centurion All-In-One Winter System
470205,Impacto Back Coach Support Belt Large,http://www.arco.co.uk/products/470203,27.95,Impacto Back Coach Back Support Belt
565109,Dunlop Acifort 8808 Ribbed Black Safety Plus Knee Boot Black 9,http://www.arco.co.uk/products/565100,24.03,Dunlop Acifort Ribbed Black Safety Plus Knee Boot
565610,Dunlop Acifort Ribbed Safety Plus Thigh Boot Black 10,http://www.arco.co.uk/products/565600,59.85,Dunlop Acifort Ribbed Black Safety Plus Thigh Boot
572208,Dunlop Acifort Classic Wellington Safety Boot White 8,http://www.arco.co.uk/products/572200,24.98,Dunlop Acifort Classic White Safety Wellington
574009,Dunlop Purofort Professional Wellington Safety Boot White 9,http://www.arco.co.uk/products/574000,50.90,Dunlop Purofort Professional White Safety Wellington
574509,Dunlop Purofort Professional Safety Plus Wellington Yellow 9,http://www.arco.co.uk/products/574500,44.72,Dunlop Purofort Professional Yellow Safety Plus Wellington
576009,Dunlop Purofort Rig-Air Waterproof Safety Plus Boot S.9,http://www.arco.co.uk/products/576000,56.15,Dunlop Purofort Rig-Air Safety Plus Boot
576109,Dunlop Purofort Rig-Air Waterproof Lined Safety Plus Boot S.9,http://www.arco.co.uk/products/576100,63.43,Dunlop Purofort Rig-Air Lined Safety Boot
580709,Wellington Shoe Green 9,http://www.arco.co.uk/textsearch?event=textsearch&searchTerms=580709,7.50,Dunlop Green Wellington Shoe
580809,Wellington Shoe White 9,http://www.arco.co.uk/textsearch?event=textsearch&searchTerms=580809,9.09,Dunlop White Wellington Shoe
583209,Dunlop Purofort Thermo+ Insulated Wellington Safety Boot Green 9,http://www.arco.co.uk/products/583200,96.91,Dunlop Purofort Thermo+ Insulated Green Safety Wellington
586909,Century 4000 Super Wellington Safety Boot 9,http://www.arco.co.uk/products/586900,73.47,Century 4000 Super Safety Knee Boot
588410,Pricemaster 380VP Non Safety Wellington Boot Green 10,http://www.arco.co.uk/products/588400,11.99,Dunlop Pricemaster 380VP Non-Safety Wellington
589110,Dunlop Pricemastor Non-Safety Chest Wader 10,http://www.arco.co.uk/products/589100,63.60,Dunlop Pricemastor Non-Safety Chest Wader
589309,Dunlop Pricemaster 380PP Wellington Black 9,http://www.arco.co.uk/products/589300,11.99,Dunlop Pricemaster 380PP Wellington
589409,Dunlop Purofort+ C762241 Wellington Safety Boot Yellow 9,http://www.arco.co.uk/products/589400,55.13,Dunlop Purofort+ Yellow Full Safety Wellington
591210,Dunlop Acifort Rib Full Safety Chest Wader 10,http://www.arco.co.uk/products/591200,97.02,Dunlop Acifort Rib Full Safety Chest Wader
591609,Purofort Control Grip Blue Safety Wellington 9,http://www.arco.co.uk/products/591600,60.59,Dunlop Purofort Control Grip Safety Wellington
591709,Purofort Professional Green Full Safety Welly 9,http://www.arco.co.uk/products/591700,51.99,Dunlop Purofort Pro Green Full Safety Wellington
592109,Protomaster Black Safety Welly c/w Midsole 9,http://www.arco.co.uk/products/592100,12.60,Protomaster Black Safety Wellington c/w Midsole
592309,Dunlop Protomaster White Safety Wellington 9,http://www.arco.co.uk/products/592300,12.45,Dunlop Protomaster White Safety Wellington
592409,Dunlop Purofort Hi Grip White Safety Wellington 9,http://www.arco.co.uk/products/592400,52.99,Dunlop Purofort High Grip Safety Wellington
624109,241 Clyde Black Safety Boot Complete With Hiflex 9,http://www.arco.co.uk/textsearch?event=textsearch&searchTerms=624109,70.77,uvex 241 Black Clyde Safety Boot with Hydroflex Insole
624209,242 Clyde Black Safety Shoe Hiflex 9,http://www.arco.co.uk/products/624200,69.15,uvex 242 Black Clyde Safety Shoe with Hydroflex Insole
624509,uvex Hydroflex Insoles 9,http://www.arco.co.uk/products/624500,9.26,uvex Hydroflex&reg; Insoles
631909,Jalnevis SAS Safety Rigger Boot 9,http://www.arco.co.uk/products/631900,88.87,Jallatte Jalnevis SAS Rigger Boot
632008,Jallatte Jalnevis Cap SAS Safety Rigger Boot 8,http://www.arco.co.uk/products/632000,93.88,Jallatte Jalnevis Cap Safety Rigger Boot
632109,Jalaska SAS Riggers Boots Size 9,http://www.arco.co.uk/products/632100,78.77,Jallatte Jalaska Rigger Boot
664109,641 Slip On Safety Shoe White 9,http://www.arco.co.uk/textsearch?event=textsearch&searchTerms=664109,34.99,Arco 641 White Slip-On Safety Shoe
680709,Dr Martens 8249 Black Non Safety Shoe 9,http://www.arco.co.uk/products/680700,55.00,Dr. Martens 8249 Black Non Safety Shoe
806544,Dickies Redhawk Zip Front Coverall Navy 44 Regular,http://www.arco.co.uk/products/806500,23.90,Dickies Redhawk Zip Front Coverall Navy
806646,Dickies Redhawk Zip Front Coverall Navy 46 Tall,http://www.arco.co.uk/products/806500,24.85,Dickies Redhawk Zip Front Coverall Navy
806905,Dickies WD2360R Lined Coverall Navy Large Regular,http://www.arco.co.uk/products/806900,47.26,Dickies WD2360R Lined C/all Navy
939205,Viking Orange Anorak Large,http://www.arco.co.uk/products/939200,43.89,Viking Anorak Orange
939305,Viking Orange Bib Trousers Large,http://www.arco.co.uk/products/939300,45.96,Viking High Bib Trousers Orange
1052305,Xcelcius Men's Ultratherm Long-Sleeved Top Wht L,http://www.arco.co.uk/products/1052300,21.94,Xcelcius&trade; Men's Ultratherm Long-Sleeved Top White
1052405,Xcelcius Mens Ultratherm Long Pant Wht L,http://www.arco.co.uk/products/1052400,21.61,Xcelcius&trade; Mens Ultratherm Long Pant White
1052605,Xcelcius Men's Megatherm Long Pant Nvy L,http://www.arco.co.uk/products/1052600,34.11,Xcelcius&trade; Men's Megatherm Underwear
1076105,Sprayway Genesis II Fleece Black Large,http://www.arco.co.uk/textsearch?event=textsearch&searchTerms=1076105,37.50,Sprayway Genesis IA Fleece Black
1079205,Regatta W283 Packaway Jacket Navy Large,http://www.arco.co.uk/products/1079200,26.50,Regatta Packaway Jacket Navy
