sku,name,url,price,full_description
1079505,Regatta Packaway Overtrousers Navy Large,http://www.arco.co.uk/textsearch?event=textsearch&searchTerms=1079505,14.00,Regatta Packaway Overtrousers Navy
1206710,Anti Syringe Gloves Size 10,http://www.arco.co.uk/products/1206700,178.81,Anti Syringe Glove & Gauntlet
1400610,Kilnmaster Foundry Gauntlets Size 10,http://www.arco.co.uk/textsearch?event=textsearch&searchTerms=1400610,61.37,Kilnmaster Foundry Gauntlet
1401200,"Mercury 400 13"" Kevlar Gloves 43-113",http://www.arco.co.uk/products/1401200,26.99,Ansell Mercury 400 43-113 Kevlar&reg; Glove
1403209,Ansell Neptune Kevlar? 70-205 Lightweight Glove 9,http://www.arco.co.uk/products/1403200,6.58,Ansell Neptune Kevlar&reg; Glove
1403309,Ansell Neptune Kevlar? 70-215 Mediumweight Glove 9,http://www.arco.co.uk/products/1403300,9.80,Ansell Neptune 70-215 Kevlar&reg; Mediumweight Glove
1403409,Ansell Neptune Kevlar? 70-225 Heavyweight Glove 9,http://www.arco.co.uk/products/1403400,12.97,Ansell Neptune 70-225 Kevlar&reg; Heavyweight Glove
1405000,Polyco Ambi Bakers Mitt Universal Size,http://www.arco.co.uk/products/1405000,18.43,Polyco Ambi Baker's Mitt
1425119,ME101 Emperor Mediumweight Seamless Black Rubber 10.5in Gauntlet 9.5,http://www.arco.co.uk/products/1425100,5.35,Marigold Emperor Mediumweight Seamless Black Rubber Gauntlet
1425219,ME104 Emperor Mediumweight Seamless Black Rubber 17in Gauntlet 9.5,http://www.arco.co.uk/products/1425100,7.47,Marigold Emperor Mediumweight Seamless Black Rubber Gauntlet
1425319,ME107 Emperor Mediumweight Seamless Black Rubber 24in Gauntlet 9.5,http://www.arco.co.uk/products/1425100,12.02,Marigold Emperor Mediumweight Seamless Black Rubber Gauntlet
1434309,Showa Orange Grip Glove Size 9 (Large),http://www.arco.co.uk/products/1434300,3.39,Showa 310 Orange Grip Glove
1434509,Showa Blue Kelvar Grip KnitPlus Glove Size 9,http://www.arco.co.uk/products/1434500,11.86,Showa Blue Kevlar Grip KnitPlus Glove
1437109,Marigold N230 Nitrotough Lightweight Glove 9,http://www.arco.co.uk/products/1437100,2.32,Marigold N230 Nitrotough&trade; Lightweight Glove
1437210,M/Gold N250 N/Tough Lightweight F/C Knit Wrist Glove 10,http://www.arco.co.uk/products/1437200,2.42,Marigold N250 Nitrotough&trade; Glove
1438509,Marigold Z51G Long Nitrosolve Glts 9,http://www.arco.co.uk/products/1438500,5.56,Marigold Z51G Long Nitrosolve&trade; Gauntlet
1438718,Marigold G07B+ Nitrile Gauntlet size 8.5,http://www.arco.co.uk/textsearch?event=textsearch&searchTerms=1438718,0.96,Marigold G07B+ Nitrile Gauntlet
1438809,Marigold PX Insulator Thermal Gloves 9,http://www.arco.co.uk/products/1438800,5.35,Marigold PX-Insulator&trade; Thermal Gloves
1439109,Marigold N1300 Nitrotough F/C Glove 9,http://www.arco.co.uk/textsearch?event=textsearch&searchTerms=1439109,2.83,Marigold N1300 Nitrotough F/C Glove
1439209,Marigold N1700 Nitrotough F/C Glove 9,http://www.arco.co.uk/products/1439200,2.93,Marigold N1700 Nitrotough&trade; Glove
1439605,50 Marigold NT14 Disposable Gauntlets size Large,http://www.arco.co.uk/products/1439600,19.03,50 Marigold NT14 Disposable Gauntlets
1439710,Matrix Fully Coated K/W Nitrile Glove 10,http://www.arco.co.uk/products/1439700,1.26,Matrix Grip Fully Coated Knit Wrist Nitrile Glove
1440605,Marigold G01R Red Lightweight Gloves Large,http://www.arco.co.uk/textsearch?event=textsearch&searchTerms=1440605,21.72,Marigold G01R Lightweight Glove Red
1441805,Marigold G43Y Tripletec Plus Gloves L,http://www.arco.co.uk/products/1441800,25.82,Marigold G43Y Tripletec Plus Gloves
1442105,Marigold G25B Blue Nitrile Gloves Blue Large,http://www.arco.co.uk/products/1442100,35.88,Marigold G25B Blue Nitrile Glove
1442505,Marigold G04Y Suregrip? Gloves Large,http://www.arco.co.uk/products/1442500,35.88,Marigold G04Y Suregrip&trade; Glove
1443006,Marigold G17K Black Heavyweight GlovesXL,http://www.arco.co.uk/products/1443000,40.00,Marigold G17K Black Heavyweight&trade; Glove
1443405,Marigold G02T Orange Supaweight Glove Large,http://www.arco.co.uk/products/1443400,40.00,Marigold G02T Superweight Glove Orange
1444305,Marigold U12B Foodsure Glove Large,http://www.arco.co.uk/products/1444300,18.18,Marigold U12B Foodsure&trade; Glove
1447100,Marigold KT1 White Insulator Gloves,http://www.arco.co.uk/products/1447100,4.25,Marigold Insulator&trade; KT1 & KT2 Thermal Glove
1447200,Marigold KT2 Blue Insulator Gloves,http://www.arco.co.uk/products/1447100,4.62,Marigold Insulator&trade; KT1 & KT2 Thermal Glove
1447400,Marigold KT2D Blue Insulator Dotted Gloves,http://www.arco.co.uk/products/1447400,5.02,Marigold Insulator&trade; KT2D Blue Dotted Thermal Glove
1450606,100 Skytec Utah Nitrile Disp P/F Glove XL,http://www.arco.co.uk/products/1450600,10.15,Skytec&reg; UTAH Disposable Nitrile Glove
1451205,Skytech Iris Disposable Purple Nitrile Glove L,http://www.arco.co.uk/products/1451200,8.95,Skytec&reg; Iris Disposable Nitrile Purple Gloves
1455205,100 Finity Powdered Latex Free Disposable Gloves Large,http://www.arco.co.uk/products/1455200,6.69,100 Finity Powdered Latex Free Disposable Gloves
1455305,100 Finity Powder Free Latex Free Disposable Gloves Large,http://www.arco.co.uk/products/1455300,7.22,100 Finity Powder Free Latex Free Disposable Gloves
1455405,100 Finite P Nitrile Disposable Gloves Indigo Large,http://www.arco.co.uk/products/1455400,8.99,100 Finite P Nitrile Disposable Gloves Indigo
1457509,Electricians Gloves Cl 00 500V Cream 350mm 9,http://www.arco.co.uk/products/1457500,28.12,Electricians Glove Class 00 500V Cream 350mm
1457609,Electricians Gloves Class 0 1000V Cream/Yellow 350mm Size 9,http://www.arco.co.uk/products/1457600,28.65,Electricians Glove Class 0 1000V Cream 350mm
1458010,Lthr Low Voltge Glove Protectors 01-101 Size 10,http://www.arco.co.uk/products/1458000,15.17,Leather Low Voltage Glove Protectors
1468109,Marigold P3000 Puretough P/C Glove 9,http://www.arco.co.uk/products/1468100,8.08,Marigold P3000 Puretough P/C Glove
1468209,Marigold P1100i Puretough P/C Glove 9,http://www.arco.co.uk/products/1468200,2.83,Marigold P1100i Puretough P/C Glove
1468309,Marigold P3000 Puretough 3DO P/C Glove 9,http://www.arco.co.uk/products/1468300,8.08,Marigold P3000 Puretough 3DO P/C Glove
1468710,Marigold P3000 Puretough FD Ins Glove 10,http://www.arco.co.uk/products/1468700,11.50,Marigold P3000 Puretough&trade; FD Ins Glove
1468909,Marigold N1700 Nitrotough FD Ins Glove 9,http://www.arco.co.uk/products/1468900,9.95,Marigold Nitrotough&trade; N1700 Insulator Glove
1469009,Marigold P5000 Puretough Cut 5 Gloves 9,http://www.arco.co.uk/products/1469000,12.68,Marigold P5000 Puretough Cut 5 Glv
1474409,Marigold PX130 PU P/C Nylon Glove Grey 9,http://www.arco.co.uk/products/1474400,2.12,Marigold PX130 PU P/C Nylon Glove Grey
1474509,Marigold PGK10 Latex P/C Kevlar Glove 9,http://www.arco.co.uk/textsearch?event=textsearch&searchTerms=1474509,9.99,Marigold PGK10 Latex P/C Kevlar Gloves
1474609,Marigold PG10 Latex P/C Polycotton Glove 9,http://www.arco.co.uk/products/1474600,2.11,Marigold PG10 Latex P/C Polycotton Gloves
1474710,Marigold N110 Nitrile P/C Nylon Glove 10,http://www.arco.co.uk/products/1474700,3.32,Marigold N110 Nitrotough&trade; Nitrile P/C Nylon Glove
1483205,Impacto 501-00 Gloves Large,http://www.arco.co.uk/products/1483200,13.01,Impacto&trade; 501-00 Anti-Impact Glove
1488009,Polyco Tremor-Low Anti Shock/Impact Glove 9,http://www.arco.co.uk/products/1488000,14.99,Polyco Tremor-Low Anti-Vibration Glove
1488900,Thermatex CTH303 34oz Terrycloth 40cm Gauntlet,http://www.arco.co.uk/textsearch?event=textsearch&searchTerms=1488900,3.52,Thermatex CTH310 34oz Terrycloth 40cm Gauntlet
1489510,Marigold Astroflex Latex Gauntlet 10,http://www.arco.co.uk/products/1489500,4.03,Marigold Astroflex Latex Gauntlets
1490209,Grip Latex Coated Gloves Blue 9,http://www.arco.co.uk/products/1490200,3.64,Blue Grip Fully Coated Latex Gloves
1494305,HexArmor 8TW Arm Guard 8in Large,http://www.arco.co.uk/products/1494300,45.15,HexArmor 8TW Arm Guard 8in
1494409,Marigold PF Insulator Hi Viz Orange 9,http://www.arco.co.uk/products/1494400,5.28,Marigold PF Insulator&trade; Hi-Vis Glove
1504610,Ansell Winter Hi-Viz 23-491 Knit Wrist Gloves Size 10,http://www.arco.co.uk/products/1504600,12.76,Ansell 23-491 Winter Hi-Vis Glove
1504709,Powerflex 80-400 HiViz Thermal Glove 9,http://www.arco.co.uk/products/1504700,5.84,Ansell PowerFlex&reg; T 80-400 Hi-Vis Thermal Glove
1508108,Hynit 32-105 Regular Slip On Gloves Size 8,http://www.arco.co.uk/textsearch?event=textsearch&searchTerms=1508108,2.34,Ansell Hynit 32-105 Regular Slip-On Glove
1508309,Hynit 32-125 Perforated Slip-On Gloves Size 9,http://www.arco.co.uk/textsearch?event=textsearch&searchTerms=1508309,3.66,Ansell Hynit 32-125 Perforated Slip-On Glove
1510908,100 Clear Dura-Touch? 34-500 Gloves Size L (8-81/2),http://www.arco.co.uk/products/1510900,7.68,Ansell Dura-Touch&trade; Glove Clear
1511209,Dispenser Box 100 Conform +? Powder Free Gloves Size 9-101/2,http://www.arco.co.uk/products/1511200,9.70,Ansell Conform+&trade; Powder Free Glove
1511605,Ansell Virtex 79-700 Nitrile Gloves L (9),http://www.arco.co.uk/products/1511600,1.48,Ansell Virtex&trade; 79-700 Nitrile Gloves
1511709,Ansell Alphatec 58-530 Gauntlet 30cm 9,http://www.arco.co.uk/products/1511700,6.94,Ansell Alphatec&trade; 58-530 Gauntlet 30cm
1511809,Ansell Alphatec 58-535 Gauntlet 35cm 9,http://www.arco.co.uk/products/1511800,7.23,Ansell Alphatec&trade; Gauntlet
1513210,Classic Sol-vex Green Unlined 37-655 Gauntlets Size 10,http://www.arco.co.uk/products/1513200,2.44,Ansell Classic Sol-vex 37-655 Gauntlet Green
1513309,Classic Sol-vex Green Lined 37-675 Gauntlets Size 9,http://www.arco.co.uk/products/1513300,2.48,Ansell Classic Sol-vex 37-675 Green Gauntlet
1513409,Classic Sol-vex Green Lined 37-695 Gauntlets Size 9,http://www.arco.co.uk/products/1513400,3.47,Ansell Classic Sol-vex 37-695 Green Gauntlet
1513509,Premium Solvex Lined Red 37-900 Gauntlets Size 9,http://www.arco.co.uk/products/1513500,4.35,Ansell Premium Sol-vex 37-900 Gauntlet Red
1513610,Regular Sol-vex Blue Lined 37-500+ Gauntlets Size 10,http://www.arco.co.uk/products/1513600,2.40,Ansell Regular Sol-vex 37-500+ Gauntlet Blue
1514109,Crusader Flexible 42-445 24cm Gauntlets Size 9,http://www.arco.co.uk/products/1514100,11.74,Ansell Crusader Flex 42-445 10in Gauntlet
1514209,Crusader Flexible 42-474 33cm Gauntlets Size 9,http://www.arco.co.uk/products/1514200,13.24,Ansell Crusader Flex 42-474 13in Gauntlets
1515109,Ansell 52-502 Hyd Tuf Knitwrist Glove Size 9,http://www.arco.co.uk/textsearch?event=textsearch&searchTerms=1515109,5.31,Ansell Hyd Tuf 52-502 Knitwrist Glove
1515610,Ansell 52-547 Hyd Tuf Riggers Glove Size 10,http://www.arco.co.uk/textsearch?event=textsearch&searchTerms=1515610,5.77,Ansell Hyd Tuf 52-547 Riggers Glove
1521809,Ansell 16-500 Gladiator Palm Coated Knitwrist Glove Size 9,http://www.arco.co.uk/textsearch?event=textsearch&searchTerms=1521809,3.74,Ansell Gladiator 16-500 Palm Coated Knitwrist Glove
1523209,Hyflex 11-800 Palm Coated Knit Wrist Gloves Size 9,http://www.arco.co.uk/products/1523200,3.85,Ansell HyFlex&reg; 11-800 Palm Coated Glove
1525210,Polar Grip 23-700 Fully Coated Gloves Size 10,http://www.arco.co.uk/products/1525200,17.09,Ansell Polar Grip 23-700 Fully Coated Glove
1527709,Ansell 11-627 Hyflex PU/Dyneema Glove 9,http://www.arco.co.uk/products/1527700,12.90,Ansell HyFlex&reg; 11-627 PU/Dyneema&reg; Glove
1527909,Ansell Hyflex11-801 Foam P/C KW Glv Black 9,http://www.arco.co.uk/products/1527900,4.19,Ansell HyFlex&reg; 11-801 Foam Palm Coated Knitwrist Glove
1528009,Ansell Hyflex 11-630 PU Knitwrist Gloves 9,http://www.arco.co.uk/products/1528000,13.42,Ansell HyFlex&reg; 11-630 PU Knitwrist Gloves
1528109,Ansell Hyflex11-618 Ultralight Coated Glove size 9,http://www.arco.co.uk/products/1528100,3.42,Ansell HyFlex&reg; 11-618 Ultralight Ctd Gloves
1529109,Ansell Hyflex 18G PU 11-616 Glove 9,http://www.arco.co.uk/textsearch?event=textsearch&searchTerms=1529109,3.65,Ansell HyFlex 11-616 18G PU Glove
1535617,Universal Plus 87-665 Blue Gauntlets Size 71/2-8,http://www.arco.co.uk/textsearch?event=textsearch&searchTerms=1535617,1.13,Ansell 87-665 Universal&trade; Plus Low Protein Latex Gauntlet
1536218,Extra 87-950 Black Gauntlets Size 81/2-9,http://www.arco.co.uk/textsearch?event=textsearch&searchTerms=1536218,2.11,Ansell 87-950 Extra Low Protein Latex Gauntlet
1538205,Econohand 87-195 Blue Gauntlets 8.5 Large,http://www.arco.co.uk/products/1538100,0.77,Econohand Gloves
1538310,Ansell 11-400 Hyflex WBPU White Glove 10,http://www.arco.co.uk/products/1538300,2.21,Ansell HyFlex&reg; 11-400 WBPU White Glove
1538409,Ansell Hyflex 11-435 WBPU Glove 9,http://www.arco.co.uk/products/1538400,11.16,Ansell HyFlex&reg; 11-435 WBPU Glove
1538509,Ansell 80-658 Powerflex Latex Glove 9,http://www.arco.co.uk/products/1538500,10.89,Ansell PowerFlex&AElig; 80-658 Latex Glove
1538909,Ansell Hyflex 11-402 Hi-Viz WBPU Glove 9,http://www.arco.co.uk/products/1538900,2.88,Ansell HyFlex&reg; 11-402 Hi-Vis Glove
1539009,Vantage Profood 70-866 Dyneema Glove 9,http://www.arco.co.uk/products/1539000,10.45,Vantage proFood&trade; 70-866 Dyneema Glove
1539109,Ansell Alphatec 58-270 Glove 9,http://www.arco.co.uk/products/1539100,7.30,Ansell Alphatec&trade; 58-270 Glove
1539209,Ansell Powerflex 80-813 Arc Glove 9,http://www.arco.co.uk/textsearch?event=textsearch&searchTerms=1539209,13.99,Ansell Powerflex 80-813 Arc Glove
1539309,Ansell HyFlex 11-518 L/W Cut-Resistant Glove 9,http://www.arco.co.uk/textsearch?event=textsearch&searchTerms=1539309,12.90,Ansell HyFlex 11-518 L/W Cut-Resistant Gloves
1550119,Dispenser Box 100 Touch N Tuf Green Powdered Glove Size 91/2,http://www.arco.co.uk/products/1550100,11.81,Ansell Touch N Tuff Gloves
1550218,Dispenser Box 100 Touch N Tuf Green Powder Free Gloves Size 81/2,http://www.arco.co.uk/products/1550200,14.49,Ansell Touch N Tuff Green Powder Free Gloves
1550318,100 Blue TNT 92-670 Powder Free Glove Size 81/2,http://www.arco.co.uk/products/1550300,13.75,Ansell TNT 92-670 Glove
1550618,100 Neotouch 25-201 29cm Gloves 8.5-9,http://www.arco.co.uk/products/1550510,17.30,100 Neotouch Latex Free Gloves
1552800,Ansell SafeKnit 59-416 Welder's Sleeve,http://www.arco.co.uk/products/1542800,19.91,Ansell SafeKnit&trade; Guard 59-416 Welder's Sleeve
1564209,Ansell Hyflex 11-401 Blk Coated Gloves 9,http://www.arco.co.uk/products/1564200,4.33,Ansell HyFlex&reg; 11-401 Black Coated Glove
1700306,Tyvek Industry Coverall c/w Collar XL.,http://www.arco.co.uk/products/1700300,8.11,Tyvek&reg; Industry Coverall
1700406,Tyvek CHA5 Classic Plus Coverall White Extra Large,http://www.arco.co.uk/products/1700400,9.65,Tyvek Classic Plus Coverall White
1701206,Tyvek Classic Xpert Coverall c/w Hood XL,http://www.arco.co.uk/products/1701200,8.13,Tyvek Classic Xpert Coverall c/w Hood
1703400,Tyvek Hood.,http://www.arco.co.uk/products/1703400,1.30,Tyvek&reg; Elasticated Hood White
1703700,Tyvek Overshoes.,http://www.arco.co.uk/products/1703700,1.26,Tyvek&reg; Overshoes White
1703900,Pair of Tyvek Sleeves,http://www.arco.co.uk/products/1703900,1.32,Tyvek&reg; Sleeves White
1851505,Xcelcius Protex Flame Retardant Antistatic Polo Shirt Navy Large,http://www.arco.co.uk/products/1851500,44.05,Xcelcius Protex&trade; Flame Retardant Anti-static Polo Shirt Navy
1893105,6580 Flexothane Classic HiVis Trousers Orange L,http://www.arco.co.uk/products/1893100,36.59,Flexothane Classic Hi-Vis Trousers Orange
1939600,100 Pal D93230 Twin Elasticated Mob Cap Blue One Size,http://www.arco.co.uk/products/1939500,5.61,Pal Mob Caps
1941006,100 Pal N77114 Non-Woven Visitors Coats White XLarge,http://www.arco.co.uk/products/1941000,154.28,Pal Non-Woven Visitors Coat White
1946304,Rayon Mesh Trilby Hat White Medium,http://www.arco.co.uk/products/1946300,16.12,Mesh Trilby Hat White
1951000,100 Pal Bouffant Cap White,http://www.arco.co.uk/products/1951000,5.68,Pal Bouffant Cap
2621000,Regatta TRC304 Balaclavas Navy,http://www.arco.co.uk/products/2621000,4.10,Regatta Balaclava
2626434,Regatta J170 Action Trousers Navy 34W 33L,http://www.arco.co.uk/products/2626400,22.33,Regatta Action Trouser Navy
2627234,Regatta J170 Action Trousers Navy 34W 31L,http://www.arco.co.uk/products/2626400,22.33,Regatta Action Trouser Navy
2628634,Regatta TRJ314 Combat Trousers Navy 34W 33L,http://www.arco.co.uk/products/2628600,26.88,Regatta Combat Trouser Navy
2631100,Acrylic Watch Cap Navy,http://www.arco.co.uk/products/2631100,2.59,Acrylic Watch Cap
2634200,2 Pairs Dewalt Socks Black One Size.,http://www.arco.co.uk/products/2634200,10.85,DeWALT&reg; Black Socks
2750510,STOKO UV30 Complete Sun Cream 100 ml,http://www.arco.co.uk/textsearch?event=textsearch&searchTerms=2750510,9.65,STOKO UV 30 Suncream
2750600,STOKO Antibacterial Hand Cleanser Soft Bottle 2000 ml,http://www.arco.co.uk/products/2750600,11.51,STOKO&reg; Anti-bacterial Hand Cleanser
2750900,STOKO Vario Ultra Dispenser White,http://www.arco.co.uk/products/2750800,5.19,STOKO&reg; Vario Ultra Dispensers
2751000,Stoko Travabon L Protection Cream 100 ml Tube,http://www.arco.co.uk/products/2751000,2.83,STOKO&reg; Travabon&reg; Protection Cream
2751110,Stoko Universal Protect 1000 ml,http://www.arco.co.uk/textsearch?event=textsearch&searchTerms=2751110,16.16,STOKO Universal Protection Cream
2751150,Stoko Universal Protect 100 ml,http://www.arco.co.uk/textsearch?event=textsearch&searchTerms=2751150,2.30,STOKO Universal Protection Cream
2751200,Stoko Travabon S Protection Cream 1000 ml Bottle,http://www.arco.co.uk/products/2751000,18.28,STOKO&reg; Travabon&reg; Protection Cream
2751400,STOKO Progel 1000 ml Soft Bottle,http://www.arco.co.uk/products/2774200,21.42,STOKO&reg; Progel&reg; Hand Protection Gel
2751800,STOKO Soft Bottle Protect+ 1000 ml,http://www.arco.co.uk/textsearch?event=textsearch&searchTerms=2751800,21.72,STOKO Protect+ Protection Cream
2754800,STOKO Frapantol Hand Cleanser Bottle 2000 ml,http://www.arco.co.uk/textsearch?event=textsearch&searchTerms=2754800,12.90,STOKO Frapantol Hand Cleanser
2757900,STOKO Estesol Light Hand Cleanser 2000 ml Bottle,http://www.arco.co.uk/products/27S2800,11.25,STOKO&reg; Estesol&reg; Light Hand Cleanser
2758900,STOKO Slig Special Hand Cleanser Tube 250 ml,http://www.arco.co.uk/products/2758900,4.58,STOKO&reg; Slig&reg; Special Hand Cleanser
2759000,STOKO Slig Special Hand Cleanser 2000 ml,http://www.arco.co.uk/textsearch?event=textsearch&searchTerms=2759000,22.52,STOKO Slig Special Hand Cleanser
2761500,Grimeeez Mulit Wipes (150 Wipes per Tub),http://www.arco.co.uk/textsearch?event=textsearch&searchTerms=2761500,10.94,Grimeeez Multi Wipes
2761700,STOKO Solopol Hand Cleanser 250 ml Tube,http://www.arco.co.uk/products/2761700,2.59,STOKO&reg; Solopol&reg; Heavy Duty Hand Cleanser
2761900,Pail of Kresto Kwik Wipes (70 Wipes per Pail),http://www.arco.co.uk/products/2761900,11.23,STOKO&reg; Kresto Kwik Hand Wipes
2762000,Pail Grimeeez Paint Wipes (150 Wipes Per Tub),http://www.arco.co.uk/textsearch?event=textsearch&searchTerms=2762000,13.38,Grimeeez Paint Wipes
2762500,STOKO Solopol Hand Cleanser 2000 ml Vario Dispenser Bottle,http://www.arco.co.uk/products/2761700,13.24,STOKO&reg; Solopol&reg; Heavy Duty Hand Cleanser
2763700,STOKO Neopol Hand Cleanser 2000 ml Vario Dispenser Bottle,http://www.arco.co.uk/products/2763300,11.63,STOKO&reg; Neopol&reg; Medium Duty Hand Cleanser
2764900,STOKO Stokolan Unscented Skincare Cream 1000 ml Bottle,http://www.arco.co.uk/products/2764800,17.35,STOKO&reg; Stokolan&reg; Unscented Skincare Cream
2765400,STOKO Soft+Care Skin Care Cream 100 ml Tube,http://www.arco.co.uk/textsearch?event=textsearch&searchTerms=2765400,2.45,STOKO soft+care Cream
2765500,STOKO Soft+Care Skin Cream 1000 ml Soft Bottle,http://www.arco.co.uk/textsearch?event=textsearch&searchTerms=2765500,16.88,STOKO soft+care Cream
2767000,Stoko Hand Lotion 1000 ml Bottle,http://www.arco.co.uk/products/2766000,12.07,STOKO&reg; Lotion
2769300,STOKO Stokosept Gel Unperfumed Hand Sanitizer 1000 ml Bottle,http://www.arco.co.uk/textsearch?event=textsearch&searchTerms=2769300,7.93,STOKO Stokosept Gel Unperfumed Hand Sanitizer
2769800,STOKO Stokosept Gel Unperfumed Hand Sanitizer 100 ml Bottle,http://www.arco.co.uk/textsearch?event=textsearch&searchTerms=2769800,2.61,STOKO Stokosept Gel Unperfumed Hand Sanitizer
3106705,Stanley 9 Piece FatMax Screwdriver Set (5-65-424),http://www.arco.co.uk/products/3106705,33.05,Stanley 9-Piece FatMax Screwdriver Set
3132400,Stanley Powerlock Tape 10 metre (33 feet) - 25 mm blade,http://www.arco.co.uk/products/3132100,17.67,Stanley Powerlock Tape Measure
3132536,Stanley Laser Distance Measure,http://www.arco.co.uk/products/3132536,104.23,Stanley Laser Distance Measure
3132650,Stanley Powerlock Micro Tape Measure 5 metre (16 feet),http://www.arco.co.uk/products/3132100,11.19,Stanley Powerlock Tape Measure
3132700,Stanley Powerlock Armor Tape Measure 8 metre (26 feet),http://www.arco.co.uk/products/3132100,14.88,Stanley Powerlock Armor Tape
3155400,Pack of 3 Stanley Disposable Craft Knives,http://www.arco.co.uk/products/3155400,2.21,Stanley Disposable Craft Knife
3155700,Pack of 10 Stanley Knife Blades,http://www.arco.co.uk/products/3155700,2.51,Blade Selector Table
3156100,Stanley Lightweight Retractable Blade Knife,http://www.arco.co.uk/products/3156100,2.67,Stanley Lightweight Knife
3156500,Stanley Folding Pocket Knife,http://www.arco.co.uk/products/3156500,7.71,Stanley Folding Pocket Knife
3156600,Stanley Straight Slimknife Blades (Pack of 50),http://www.arco.co.uk/products/3156500,21.42,Stanley Folding Pocket Knife
3178344,Stanley Fat Max 18 inch Tool Bag 1-93-950,http://www.arco.co.uk/products/3178344,38.60,Stanley FatMax 18 inch Tool Bag
3180410,Stanley 26 inch Professional Toolbox 1-92-258,http://www.arco.co.uk/products/3180410,30.06,Stanley 26 inch Professional Toolbox
3460003,Swarfega Jizer Soluble Degreaser 5 litre Can SJZ75L,http://www.arco.co.uk/products/3460008,18.85,Jizer Degreaser
3460008,Swarfega Jizer Aerosol Degreaser 500ml SJZ5L9,http://www.arco.co.uk/products/3460008,5.51,Jizer Degreaser
4432200,Stanley TR250 Sharp Shooter Heavy Duty Staple Gun,http://www.arco.co.uk/products/4432200,24.38,Stanley TR250 SharpShooter Heavy Duty Stapler
4910006,Tork Advanced Hygiene Roll White 25 cm 60 metre (Case of 18),http://www.arco.co.uk/products/4914646,55.76,Tork Advanced Hygiene Rolls
4910007,Tork Advanced Hygiene Roll White 50 cm 60 metre (Case of 9),http://www.arco.co.uk/products/4914646,55.76,Tork Advanced Hygiene Rolls
4910008,Tork Advanced Hygiene Roll Blue 25 cm 56 metre (Case of 18),http://www.arco.co.uk/products/4914646,54.10,Tork Advanced Hygiene Rolls
4910009,Tork Advanced Hygiene Roll Blue 50 cm 60 metre (Case of 9),http://www.arco.co.uk/products/4914646,54.10,Tork Advanced Hygiene Rolls
4910011,Tork Premium Specialist Cloth Cleaning Folded White 150 Sheets (Case of 5),http://www.arco.co.uk/textsearch?event=textsearch&searchTerms=4910011,157.98,Tork Premium Specialist Cleaning Cloths
4910013,Tork Advanced Wiper 420 Centrefeed Roll 2-Ply Blue 157 metre (Case of 6),http://www.arco.co.uk/products/4916101,37.59,Tork Advanced Wiper 420 Blue Centrefeed Rolls
4910014,Tork Advanced Wiper 415 Centrefeed Roll 1-Ply Blue 320 metre (Case of 6),http://www.arco.co.uk/products/4910014,37.59,Tork Advanced Wiper 415 Blue Centrefeed Rolls
4910017,Top-Pak of Tork Premium 520 Grey Multi Purpose Cloths 58.8 metre (Case of 5),http://www.arco.co.uk/products/4912020,92.01,Tork Premium 520 Grey Multi-Purpose Cloths
4910018,Top-Pak of Tork Premium 530 White Multi Purpose Cloths 42 metre (Case of 5),http://www.arco.co.uk/products/4912024,92.15,Tork Premium 530 White Multi-Purpose Cloths
4910019,Top-Pak of 100 Tork Premium 530 Blue Multi Purpose Cloths (Case of 5),http://www.arco.co.uk/products/4912027,97.68,Tork Premium 530 Blue Multi-Purpose Cloths
4910023,Handy Box of 300 Tork Premium 510 Blue Multi Purpose Cloths,http://www.arco.co.uk/products/4910021,51.53,Tork Premium 510 Blue Multi-Purpose Cloths
4910032,2 Tork Advanced Wiper 420P Combi Rolls 2-Ply White 24 cm x 255 metre,http://www.arco.co.uk/products/4912947,48.43,Tork Advanced Wiper 420 Performance White
4910033,2 Tork Advanced Wiper 440P Combi Rolls 3-Ply Blue 23 cm x 119 metre,http://www.arco.co.uk/products/4913481,72.98,Tork Advanced Wiper 440 Performance Blue
4910034,2 Tork Advanced Wiper 440P Handy Boxes Folded 3Ply Blue 32 cm x 38 cm 200 Sheets,http://www.arco.co.uk/products/4913481,28.63,Tork Advanced Wiper 440 Performance Blue
4910035,5 Tork Advanced Wiper 440P Top Pak Folded 3-Ply Blue 32 cm x 38 cm 100 Sheets,http://www.arco.co.uk/products/4913481,64.38,Tork Advanced Wiper 440 Performance Blue
4910036,Tork Advanced Wiper 415P Centrefeed Blue 130035 (6 Rolls of 165 metres),http://www.arco.co.uk/products/4910014,41.00,Tork Advanced Wiper 415 Blue Centrefeed Rolls
4910040,2 Tork Advanced Wiper 420P Combi Rolls 2-Ply Blue 24 cm x 255 metre,http://www.arco.co.uk/products/4920127,36.23,Tork Advanced Wiper 420 Performance Blue
4910045,2 Tork Advanced Wiper 430P Combi Rolls 2-Ply White 23 cm x 170 metre,http://www.arco.co.uk/products/4923102,34.35,Tork Advanced Wiper 430 Performance White
4910143,Tork Advanced Wiper 420 Performance White Top Pak 130043 (5 packs x 200 sheets),http://www.arco.co.uk/products/4912947,66.10,Tork Advanced Wiper 420 Performance White
4910178,Tork Premium Multi-purpose Cloths 570 570178 (5 packs of 75 sheets),http://www.arco.co.uk/products/4910178,88.60,Tork Premium 570 Multi-Purpose Cloths
4912018,Combi Roll of Tork Premium 510 White Multi Purpose Cloths 152 metre,http://www.arco.co.uk/products/4912017,53.15,Tork Premium 510 White Multi-Purpose Cloths
4912020,Large Roll of Tork Premium 520 Grey Multi Purpose Cloths 399 metre,http://www.arco.co.uk/textsearch?event=textsearch&searchTerms=4912020,126.65,Tork Premium 520 Grey Multi-Purpose Cloths
