sku,name,url,price,full_description
4912021,Combi Roll of Tork Premium 520 Grey Multi Purpose Cloths 148.2 metre,http://www.arco.co.uk/products/4912020,42.45,Tork Premium 520 Grey Multi-Purpose Cloths
4912022,Handy Box of Tork Premium 520 Grey Multi Purpose Cloths 106.4 metre,http://www.arco.co.uk/products/4912020,37.33,Tork Premium 520 Grey Multi-Purpose Cloths
4912024,Combi Roll of Tork Premium 530 White Multi Purpose Cloths 106.4 metre,http://www.arco.co.uk/products/4912024,55.18,Tork Premium 530 White Multi-Purpose Cloths
4912026,Handy Box of Tork Premium 530 White Multi Purpose Cloths 84 metre,http://www.arco.co.uk/products/4912024,52.00,Tork Premium 530 White Multi-Purpose Cloths
4912027,Combi Roll of Tork Premium 530 Blue Multi Purpose Cloths 106 metre,http://www.arco.co.uk/products/4912027,40.30,Tork Premium 530 Blue Multi-Purpose Cloths
4912947,Tork Advanced Wiper 420P Solid Core Roll 2-Ply White 24 cm x 510 metre,http://www.arco.co.uk/products/4912947,48.48,Tork Advanced Wiper 420 Performance White
4913481,Tork Advanced Wiper 440P Solid Core Roll 3-Ply Blue 37 cm x 255 metre,http://www.arco.co.uk/products/4913481,95.53,Tork Advanced Wiper 440 Performance Blue
4920126,Tork Advanced Wiper 430P Solid Core Roll 2-Ply Blue 37 cm x 340 metre,http://www.arco.co.uk/products/4920126,42.68,Tork Advanced Wiper 430 Performance Blue
4920127,Tork Advanced Wiper 420P Solid Core Roll 2-Ply Blue 37 cm x 510 metre,http://www.arco.co.uk/products/4920127,50.80,Tork Advanced Wiper 420 Performance Blue
4923102,Tork Advanced Wiper 430P Solid Core Roll 2-Ply White 37 cm x 340 metre,http://www.arco.co.uk/products/4923102,51.90,Tork Advanced Wiper 430 Performance White
4960000,Tub of 150 Grimeeez Multi-Purpose Office Wipes,http://www.arco.co.uk/textsearch?event=textsearch&searchTerms=4960000,3.76,Grimeeez Multi-Purpose Office Wipes
5500615,Vikan Short Handled Standard Blade Shovel with D-Grip Blue,http://www.arco.co.uk/products/5500612,17.68,Vikan Hygiene One Piece Shovels
5500715,Vikan Short Handled Large Blade Shovel with D-Grip Blue,http://www.arco.co.uk/products/5500612,21.95,Vikan Hygiene One Piece Shovels
5610200,3M Safety Walk GP Cleat Blk 610mmx152mm,http://www.arco.co.uk/products/5610200,6.64,3M Safety-Walk&trade; General Purpose
5610602,3M Safety-Walk? General Purpose Black 51 mm x 18.3 metre Roll,http://www.arco.co.uk/products/5610200,57.61,3M Safety-Walk&trade; General Purpose
5610604,3M Safety-Walk? General Purpose Black102 mm x 18.3 metre Roll,http://www.arco.co.uk/products/5610200,115.18,3M Safety-Walk&trade; General Purpose
5610606,3M Safety-Walk? General Purpose Black 152 mm x 18.3 metre Roll,http://www.arco.co.uk/products/5610200,171.25,3M Safety-Walk&trade; General Purpose
5611002,3M Safety-Walk&trade; General Purpose Yellow 51 mm x 18.3 metre Roll,http://www.arco.co.uk/textsearch?event=textsearch&searchTerms=5611002,78.86,3M Safety-Walk&trade; General Purpose
5616606,3M Safety-Walk? Coarse 152 mm x 18.3 metre,http://www.arco.co.uk/products/5616200,183.34,3M Safety-Walk&trade; Coarse
5652400,3 3M Oil Multi Format 12 cm x 15.2 m,http://www.arco.co.uk/products/5652400,111.11,3M Multi Format
5654100,3 3M Maintenance Multi Format 12 cm x 15.2 m,http://www.arco.co.uk/products/5652400,112.57,3M Multi Format
5661003,PVC Builders Bucket Black 3 Gallon,http://www.arco.co.uk/products/5661002,3.46,Builders Buckets
5661004,PVC Pour & Scoop Builders Bucket Yellow 3 Gallon,http://www.arco.co.uk/products/5661002,5.18,Builders Buckets
5661317,PVC Builders Bucket Yellow 3 gallon,http://www.arco.co.uk/products/5661002,4.62,Builders Buckets
5663305,Vikan Polypropylene Dustpan & Hand Brush Set Medium Blue MS60B,http://www.arco.co.uk/products/5663002,9.03,Vikan Dustpan & Brush
5684502,Kentucky Bucket on Wheels Red 23 Litre KMKB03R,http://www.arco.co.uk/products/5684502,52.75,Vikan Hygiene Kentucky Bucket & Wringer
5684602,Kentucky Wringer 12oz to 20oz Red KMKW03R,http://www.arco.co.uk/products/5684502,59.26,Vikan Hygiene Kentucky Bucket & Wringer
5700130,Titan One Piece Barrier System 2 metre,http://www.arco.co.uk/products/5700130,97.08,Titan One-Piece Barrier System
5700131,Titan One Piece Barrier System 1.5 metre,http://www.arco.co.uk/products/5700130,94.42,Titan One-Piece Barrier System
5728815,RoadBloc Barrier Red 1 metre KAV030-000-600,http://www.arco.co.uk/products/5728815,64.79,RoadBloc&trade; Traffic Separators
5771900,Expanda Titan Barrier Red/White 3m,http://www.arco.co.uk/products/5771900,95.33,Expanda Titan Barrier Red/White 3 metre
10B1005,Berghaus 31903 Spectrum II Fleece Black Large,http://www.arco.co.uk/products/10B1000,41.67,Berghaus&reg; Men's Spectrum II Fleece Black
10B1105,Berghaus 49135 Spectrum Gilet Black Large,http://www.arco.co.uk/textsearch?event=textsearch&searchTerms=10B1105,33.34,Berghaus Spectrum Gilet Black
10B6305,Berghaus 33150 RG1 Jacket Black L,http://www.arco.co.uk/products/10B6300,74.99,Berghaus&reg; RG1 Jacket Eclipse
10B6405,Berghaus 32907 Deluge Overtrousers Black L Reg,http://www.arco.co.uk/textsearch?event=textsearch&searchTerms=10B6405,41.67,Berghaus Deluge RG1 Overtrousers Black
10B8505,Berghaus 33357 Cornice IA Jkt Black L,http://www.arco.co.uk/textsearch?event=textsearch&searchTerms=10B8505,149.99,Berghaus GORE-TEX Cornice IA Jacket Black
10B8605,Berghaus 33721RG1 Insulated Jacket Shadowed Navy L,http://www.arco.co.uk/products/10B8600,85.11,Berghaus&reg; RG1 Insulated Jacket Shadowed Navy
10B9005,Berghaus 33719 Spectrum H/Zip Flce Blk L,http://www.arco.co.uk/textsearch?event=textsearch&searchTerms=10B9005,29.17,Berghaus Spectrum Half-Zip Fleece Black
10BA105,Berghaus Cornice IA Jacket Eclipse/Ash L,http://www.arco.co.uk/textsearch?event=textsearch&searchTerms=10BA105,149.99,Berghaus GORE-TEX Cornice IA Jacket Eclipse/Ash
10BA305,Berghaus RG1 Jacket Thunder L,http://www.arco.co.uk/products/10BA300,74.99,Berghaus&reg; RG1 Jacket Thunder
10BA405,Berghaus RG 3-in-1 Jacket Jet Black L,http://www.arco.co.uk/textsearch?event=textsearch&searchTerms=10BA405,108.32,Berghaus RG 3-in-1 Jacket Jet Black/Black
10BA505,Berghaus RG Parka Jet Black L,http://www.arco.co.uk/products/10BA500,108.32,Berghaus&reg; RG Parka Jet Black
10BA805,Berghaus Akka Down Vest Jet Black L,http://www.arco.co.uk/products/10BA800,83.33,Berghaus&reg; Akka Down Vest Black
10BB412,Berghaus Women's Calisto 3-in-1 Jacket Jet Black 12,http://www.arco.co.uk/textsearch?event=textsearch&searchTerms=10BB412,108.32,Berghaus Women's Calisto 3in1 Jacket Jet Black
10BB906,Berghaus Spectrum II Fleece Grey Marl XL,http://www.arco.co.uk/products/10BB900,38.30,Berghaus Spectrum II Fleece Grey Marl
10BC405,Berghaus Maitland Jacket Black L,http://www.arco.co.uk/textsearch?event=textsearch&searchTerms=10BC405,114.95,Berghaus Maitland Jacket Black
10BC505,Berghaus RG 3in1 Jacket Navy/Eclipse L,http://www.arco.co.uk/textsearch?event=textsearch&searchTerms=10BC505,108.32,NEW Berghaus RG 3in1 Navy/Eclipse
10BC605,Berghaus Ardennes Soft Shell Jacket Black/Grey L,http://www.arco.co.uk/textsearch?event=textsearch&searchTerms=10BC605,74.99,Berghaus Ardennes Soft Shell Jacket Black/Thunder
10BD105,Berghaus Vinson Insulated Jacket Black L,http://www.arco.co.uk/textsearch?event=textsearch&searchTerms=10BD105,116.67,Berghaus Vinson Insulated Jacket
10D5005,DeWALT DWC1-001 Site Jacket Black Large,http://www.arco.co.uk/products/10D5000,44.16,DeWALT Site Jacket Black
10D5105,DeWALT DWC2-001 Padded Gilet Black Large,http://www.arco.co.uk/products/10D5100,29.16,DeWALT Padded Gilet Black
10D5205,DeWALT DWC39-014 Soft-Shell Black/Grey Large,http://www.arco.co.uk/products/10D5200,41.65,DeWALT Soft-Shell Black/Grey
10E1003,Regatta Sigma Fleece Navy Small,http://www.arco.co.uk/products/10E1000,26.81,Regatta Sigma Fleece Navy
10P7705,Timberland ProSrs 105 Wproof Jkt Blk L,http://www.arco.co.uk/products/10P7700,67.60,Timberland PRO105 Waterproof Jacket
10P7707,Timberland ProSrs 105 Wproof Jkt Blk XXL,http://www.arco.co.uk/products/10P7700,67.60,Timberland PRO105 Waterproof Jacket
10PR105,Regatta TRW425 Coniston Jacket Royal/Seal Large,http://www.arco.co.uk/products/10PR100,32.99,Regatta TRW425 Coniston Jacket
10R3205,Regatta Chandler Overtrousers Navy Large Regular Leg,http://www.arco.co.uk/textsearch?event=textsearch&searchTerms=10R3205,34.09,Regatta Chandler Overtrouser Navy
10R6605,Regatta TRA642 Uproar Soft Shell Jacket Black L,http://www.arco.co.uk/products/10R6600,34.56,Regatta Men's Uproar Soft-Shell Jacket Black
10R6905,Regatta TRF532 Thor III Fleece Navy Size L,http://www.arco.co.uk/products/10R6900,19.99,Regatta Thor  Fleece Navy
10R7705,Regatta TRA301 Hudson Jacket Black L,http://www.arco.co.uk/products/10R7700,39.05,Regatta Men's Hudson Jacket Black
10R8105,Regatta TRF532 Thor III Fleece Black L,http://www.arco.co.uk/products/10R8100,19.99,Regatta Thor  Fleece Black
10R8905,Regatta TRW423 Vertex II Jacket Navy Large,http://www.arco.co.uk/products/10R8900,55.25,Regatta Vertex II Jacket Navy
10R9205,Regatta TRA301 Hudson Jacket Navy L,http://www.arco.co.uk/products/10R9200,39.05,Regatta Men's Hudson Jacket Navy
10R9612,Regatta TRA645 Women's Uproar SftShell Blk 12,http://www.arco.co.uk/products/10R9600,34.56,Regatta Uproar Soft-Shell Jacket Black
10RA205,Regatta TRF532 Thor III Fleece Seal Grey L,http://www.arco.co.uk/products/10RA200,19.99,Regatta Thor III Fleece Seal Grey
10RA300,Regatta Thinsulate? Knit Hat Black One Size,http://www.arco.co.uk/products/26R1000,4.95,Regatta Thinsulate&trade; Knit Hat
10RB305,Regatta Vertex II Jacket Black L,http://www.arco.co.uk/products/10RB300,55.25,Regatta Vertex II Jacket Black
10RB605,Regatta TRA522 Defiant II Fleece Navy/Black Large,http://www.arco.co.uk/products/10RB600,28.00,Regatta Defiant II Fleece Navy/Black
10RB705,Regatta TRA522 Defiant II Fleece Black Large,http://www.arco.co.uk/products/10RB700,28.00,Regatta Defiant II Fleece Black
10RB805,Regatta TRA130 DefenderIII Jacket Navy/Black Large,http://www.arco.co.uk/products/10RB800,46.73,Regatta Men's Defender 3-in-1 Jacket
10RB905,Regatta TRA130 Defender III Jacket Black Large,http://www.arco.co.uk/products/10RB900,46.73,Regatta Men's Defender 3-in-1 Jacket
10RC705,Regatta Sanders 3in1 Jacket Blue/Grey L,http://www.arco.co.uk/products/10RC700,79.00,Regatta Sanders 3in1
10RC805,Regatta Sanders 3in1 Jkt Black/Raven L,http://www.arco.co.uk/products/10RC800,79.00,Regatta Sanders 3in1 Black/Raven
10RD305,Regatta Freebase Jacket Black L,http://www.arco.co.uk/textsearch?event=textsearch&searchTerms=10RD305,58.33,Regatta Freebase Jacket Black
10RD405,Regatta Freebase Jacket Seal Grey L,http://www.arco.co.uk/textsearch?event=textsearch&searchTerms=10RD405,58.33,Freebase Jacket Seal Grey
10RD605,Regatta Hereford 3-in-1 Jacket Black L,http://www.arco.co.uk/products/10RD600,108.32,Regatta Hereford 3-in-1 Jacket Black
10RD814,Regatta Ladies Defender 3-in-1 Jacket Navy/Black 14,http://www.arco.co.uk/products/10RD800,46.73,Regatta Women's Defender 3-in-1 Jacket
10RE005,Regatta Fabian 3-in-1 Jacket Seal/Black L,http://www.arco.co.uk/products/10RE000,74.99,Regatta Fabian 3-in-1 Jacket
10RE105,Regatta Omicron II Fleece Navy L,http://www.arco.co.uk/products/10RE100,45.99,Regatta Omicron II Fleece
10RX105,Regatta TRW297 Dover Jacket Navy L,http://www.arco.co.uk/textsearch?event=textsearch&searchTerms=10RX105,26.78,Regatta TRW297 Dover Jacket Navy
10RX506,Regatta TRA361 Beauford Jacket Black XL,http://www.arco.co.uk/textsearch?event=textsearch&searchTerms=10RX506,33.99,Regatta TRA361 Beauford Jacket
10S4405,Sprayway GORE-TEX Compact Jacket Black Large,http://www.arco.co.uk/products/10S4400,99.99,Sprayway GORE-TEX&reg; Compact Jacket Black
10S8205,Sprayway 1953 Griffin Combi Jkt Black L,http://www.arco.co.uk/textsearch?event=textsearch&searchTerms=10S8205,99.99,Sprayway Griffin Combi 3-in-1 Jacket Black
10SA105,Sprayway Santiago Fleece Pullover Navy L,http://www.arco.co.uk/textsearch?event=textsearch&searchTerms=10SA105,29.17,Sprayway Santiago Fleece Pullover Navy
10SA804,Snickers 1212 Men's Soft Shell Jacket Black M,http://www.arco.co.uk/products/10SA800,73.17,Snickers&reg; 1212 Soft-Shell Jacket Black
10SB105,Sprayway Santiago Jacket Cobalt L,http://www.arco.co.uk/textsearch?event=textsearch&searchTerms=10SB105,58.33,Sprayway Santiago Jacket Cobalt
10SB205,Sprayway Walking Rainpant Black Large,http://www.arco.co.uk/textsearch?event=textsearch&searchTerms=10SB205,49.99,Sprayway Walking Rainpant Black
10SB905,Sprayway Griffin 3-in-1 Jacket Forest Green L,http://www.arco.co.uk/textsearch?event=textsearch&searchTerms=10SB905,99.99,Sprayway Griffin 3-in-1 Jacket Forest Green
10SC005,Sprayway Gore-Tex Mountain Rainpant Black L,http://www.arco.co.uk/textsearch?event=textsearch&searchTerms=10SC005,91.67,Sprayway GORE-TEX Mountain Rainpant Black
10SC405,Sprayway Dakota Insulated Jacket Navy/Charcoal L,http://www.arco.co.uk/textsearch?event=textsearch&searchTerms=10SC405,79.99,Sprayway Dakota Insulated Jacket Navy/Charcoal
10SC505,Sprayway Dakota Insulated Jacket Black/Charcoal L,http://www.arco.co.uk/textsearch?event=textsearch&searchTerms=10SC505,79.99,Sprayway Dakota Insulated Jacket Black/Charcoal
10SC805,Sprayway Santiago Fleece Jacket Navy L,http://www.arco.co.uk/textsearch?event=textsearch&searchTerms=10SC805,33.33,Sprayway Santiago Fleece Jacket Navy
10SC905,Sprayway Gist Windstopper Black/Graphite L,http://www.arco.co.uk/textsearch?event=textsearch&searchTerms=10SC905,99.99,Sprayway Gist WINDSTOPPER Jacket Black/Graphite
10SD505,Sprayway GORETEX Compact Jacket Black L,http://www.arco.co.uk/textsearch?event=textsearch&searchTerms=10SD505,99.99,Sprayway GORE-TEX Compact Jacket
10T9605,Timberland Pro 325 Soft-Shell Black Large,http://www.arco.co.uk/products/10T9600,97.84,Timberland PRO&reg; 325 Soft-Shell Black
10T9704,Regatta TRF530 Asguard II Fleece Navy M,http://www.arco.co.uk/products/10T9700,22.22,Regatta TRF530 Asguard 11 Fleece Navy
11C1000,Tork Advanced Toilet Paper Jumbo Roll 2-Ply 3 inch Core 340 metre (Case of 6 Rolls),http://www.arco.co.uk/products/11C1100,29.15,Tork Advanced Jumbo Toilet Rolls
11C1020,Tork Universal Wiper 320 Centrefeed Roll 2-Ply White 21 cm 160m (Case of 6 Rolls),http://www.arco.co.uk/products/11C5200,42.95,Tork Universal Wiper 320 Centrefeed Rolls
11C1025,Tork Universal Wiper 320 Centrefeed Roll 2-Ply Blue 20 cm 150m (Box of 6 Rolls),http://www.arco.co.uk/products/11C1025,23.09,Tork Universal Wiper 320  Centrefeed Rolls
11C1030,Tork Universal Wiper 310 Centrefeed Roll 1-Ply White 21 cm 300m (Case of 6 Rolls),http://www.arco.co.uk/products/11C1030,48.18,Tork Universal Wiper 310 Centrefeed Rolls
11C1035,Tork Universal Wiper 320 Centrefeed Roll 2-Ply White 20 cm 150 metres (Box of 6 Rolls),http://www.arco.co.uk/products/11C1025,23.09,Tork Universal Wiper 320  Centrefeed Rolls
11C1140,Velvet Toilet Roll White (Case of 24 Rolls),http://www.arco.co.uk/products/11C1140,26.05,Velvet Toilet Rolls
11C5700,Tork Premium Toilet Paper Jumbo Roll Soft 2-Ply 21/4 inch Core 360 metre (Case of 6),http://www.arco.co.uk/products/11C4100,35.75,Tork Premium Toilet Paper Jumbo Rolls
11C5800,Tork Universal Wiper 320 Combi Roll 2-Ply White 340 metre (Case of 2 Rolls),http://www.arco.co.uk/products/11C5800,27.95,Tork Universal Wiper 320 Combi Rolls
11C5900,Tork Advanced Toilet Paper Jumbo Roll 2-Ply 21/4 inch 360 metre 120257 (Case of 6 Rolls),http://www.arco.co.uk/products/1132600,29.95,Tork Advanced Toilet Paper Jumbo Rolls
11C6200,Tork Advanced Wiper 415 Mini Centrefeed Roll 1-Ply White 120 metre (Case of 12),http://www.arco.co.uk/products/1136100,64.25,Tork Advanced Wiper 415 Mini Centrefeed Rolls
11C6300,Tork Advanced Wiper 420 Mini Centrefeed Roll 2-Ply White 75 metre (Case of 12),http://www.arco.co.uk/products/1136700,69.23,Tork Advanced Wiper 420 Mini Centrefeed Rolls
11C6500,Tork Advanced Toilet Paper Mini Jumbo Roll 1-Ply 21/4 inch 170 metre (Case of 12),http://www.arco.co.uk/products/11C6500,29.80,Tork Advanced Toilet Paper Mini Jumbo Rolls 2-Ply
11C6600,Tork Premium Toilet Paper Mini Jumbo Roll Soft 2-Ply 21/4in Core 170 metre (Case of 12 Rolls),http://www.arco.co.uk/products/1138200,35.35,Tork Premium Toilet Paper Mini Jumbo Rolls
11C6700,Tork Toilet Plus Toilet Roll 2-Ply 320 Sheets (Case of 36 Rolls),http://www.arco.co.uk/products/1138300,20.55,Tork Toilet Rolls
11C6800,Tork Toilet Plus Toilet Roll 2-Ply 200 Sheets (Case of 36 Rolls),http://www.arco.co.uk/products/1138300,13.83,Tork Toilet Rolls
11C7000,Bundle of 160 Tork Universal Hand Towels C-Fold 1-Ply Green (Case of 20),http://www.arco.co.uk/products/1144400,38.15,Tork Universal Hand Towels C-Fold
11C7200,Bundle of 150 Tork Universal Hand Towels C-Fold 1-Ply Blue (Case of 20),http://www.arco.co.uk/products/1144400,37.15,Tork Universal Hand Towels C-Fold
11C7350,Bundle of 120 Tork Advanced Hand Towels C-Fold 2-Ply White 25 cm x 31 cm (Case of 20),http://www.arco.co.uk/products/11C7350,44.65,Tork Advanced Hand Towels C-Fold
11C7700,Bundle of 200 Tork Universal Hand Towels Zig Zag Fold 1-Ply Green (Case of 20),http://www.arco.co.uk/products/11C7700,41.23,Tork Universal Hand Towels Zigzag Fold
11C7900,Bundle of 252 Sheets Tork Premium Toilet Paper Folded Extra Soft 2-Ply (Case of 30),http://www.arco.co.uk/products/11C5100,33.70,Tork Premium Toilet Paper Folded Soft
11C8000,Bundle of 136 Tork Advanced Hand Towels Interfold 2-Ply 4-Panel White (Case of 21),http://www.arco.co.uk/textsearch?event=textsearch&searchTerms=11C8000,69.13,Tork Advanced Hand Towels Interfold Soft
11C8100,Bundle of 150 Tork Premium Hand Towels Interfold 2-Ply 3 Panel White (Case of 21),http://www.arco.co.uk/products/11C8100,63.80,Tork Premium Hand Towels Interfold
11C8200,Bundle of 180 Tork Advanced Hand Towels Interfold 2-Ply 3-Panel White (Case of 21),http://www.arco.co.uk/products/11C8000,68.35,Tork Advanced Hand Towels Interfold Soft
11C8300,Bundle of 110 Tork Premium Towels Interfold Soft 2-Ply 4 Panel (Case of 21),http://www.arco.co.uk/products/1150500,61.98,Tork Premium Hand Towels Interfold Soft
11C8400,Case of 6 Tork Advanced Wiper 420 Centrefeed Roll 2-Ply White 160 metre,http://www.arco.co.uk/products/11C8400,53.50,Tork Advanced Wiper 420 Centrefeed Rolls
11C8500,Tork Advanced Wiper 415 Centrefeed Roll 1-Ply White 20.0 cm 275 metre (Case of 6),http://www.arco.co.uk/products/11C8500,64.20,Tork Advanced Wiper 415 Centrefeed Rolls
11C8700,Tork Universal Wiper 310 Mini Centrefeed Roll 1-Ply White 120 metre (Case of 11),http://www.arco.co.uk/products/1155300,51.55,Tork Universal Wiper 310 Mini Centrefeed Rolls
11C8800,Box of 100 Sheets Tork Premium Facial Tissues Extra Soft (Case of 36),http://www.arco.co.uk/products/11C8800,52.88,Tork Premium Facial Tissues Extra Soft
11C9100,Tork Advanced Hand Towel Roll 2-Ply White 150 metre (Case of 6),http://www.arco.co.uk/products/11C0100,82.05,Tork Advanced Hand Towel Rolls
11C9105,Tork Advanced Hand Towel Roll 2-Ply Blue 150 metre (Case of 6),http://www.arco.co.uk/products/11C0100,76.68,Tork Advanced Hand Towel Rolls
11C9200,Tork Advanced Hand Towel Roll 2-Ply Green 150 metre (Case of 6),http://www.arco.co.uk/products/11C0100,66.70,Tork Advanced Hand Towel Rolls
11C9450,Elevation Hand Towel Dispenser White 551000,http://www.arco.co.uk/products/11C9450,74.95,Tork Elevation Hand Towel Dispenser
11C9500,Tork Premium Hand Towel Roll Soft 2-Ply White 100 metre (Case of 6 Rolls),http://www.arco.co.uk/products/11C0400,71.98,Tork Premium Hand Towel Rolls Soft
11C9900,Bundle of 100 Tork Premium Towels Interfold ExtraSoft 2-Ply 4 Panel (Case of 21 Bundles),http://www.arco.co.uk/products/11C9900,63.48,Tork Premium Hand Towels Interfold Extra Soft
11D1150,Tork Elevation Centrefeed Dispenser White,http://www.arco.co.uk/products/11D1150,28.80,Tork Elevation Centrefeed Wiper M1 & M2 Dispensers
11D2150,Tork Elevation Hand Towel H3 Dispenser ZigZag Fold White 553000,http://www.arco.co.uk/products/11D2150,28.80,Elevation Dispenser for Hand Towels
11D4150,Tork Elevation T1-Jumbo Toilet Roll Dispenser White,http://www.arco.co.uk/products/11D4150,20.71,Tork Elevation Jumbo Toilet Roll Dispenser
11D4250,Tork Elevation T2-Mini Jumbo Toilet Roll Dispenser White,http://www.arco.co.uk/products/11D4150,20.71,Tork Elevation Jumbo Toilet Roll Dispenser
11D4500,TorkPerfCombiRoll W1 Flr Stand Red/Smoke,http://www.arco.co.uk/products/11D4500,92.75,Tork Performance Combi Roll W1 Floor Stand
11D7000,27 Tork Premium Compact Toilet Roll 2 Ply White,http://www.arco.co.uk/products/11D7000,51.75,Tork Premium Compact Toilet Roll
11D7530,27 Tork Advanced Toilet Roll 2-ply Compact White 127530,http://www.arco.co.uk/products/11D7530,47.85,Tork Advanced Compact Toilet Roll
11D7540,27 Tork Universal Toilet Roll 1-ply Compact White 127540,http://www.arco.co.uk/products/11D7540,43.08,Tork Universal Compact Toilet Roll
11M0014,Case of 36 3M Scotch-Brite No.86 Heavy Duty Scouring Pads,http://www.arco.co.uk/products/11M0014,57.25,3M Scotch-Brite No.86 Heavy Duty Scouring Pad
11M0015,Case of 60 3M Scotch-Brite No.96 General Purpose Scouring Pads,http://www.arco.co.uk/products/11M0015,60.82,3M Scotch-Brite No.96 GP Scouring Pad
11M0017,Case of 500 3M Utility Scouring Pads,http://www.arco.co.uk/products/11M0017,118.96,3M Utility Scouring Pad
11M0018,20 3M Scotch-Brite No.2000 Power Pads 139 mm x 99 mm,http://www.arco.co.uk/products/11M0018,9.66,3M Scotch-Brite Power Pad
11P6100,Jumbo Toilet Roll 2-Ply 60 mm Core 400 metre (Pack of 6 Rolls),http://www.arco.co.uk/products/11P6100,24.15,Jumbo Toilet Rolls 2-ply with Core
11T6015,20x200TorkUniHandTwlZigZagBlu1-ply290145,http://www.arco.co.uk/products/11C7700,44.98,Tork Universal Hand Towels Zigzag Fold
11T8408,Pack of 2 Tork Universal Wiper 320 Blue 340 metre 128408,http://www.arco.co.uk/textsearch?event=textsearch&searchTerms=11T8408,51.58,Tork Universal Wiper 320 Combi Rolls
14A3600,Neptune Kevlar 10 inch Sleeve 70-110 Single,http://www.arco.co.uk/products/14A3600,4.47,Ansell Neptune Kevlar&reg; Sleeves Single
14A3700,Neptune Kevlar 14 inch Sleeve 70-114 Single,http://www.arco.co.uk/products/14A3600,6.22,Ansell Neptune Kevlar&reg; Sleeves Single
14G0110,Showa 660 Blue PVC Gauntlets Size 10,http://www.arco.co.uk/products/14G0100,3.82,Showa 660 PVC Gauntlet
14G0210,Showa 660 ESD Anti-Static PVC Gauntlets Size 10,http://www.arco.co.uk/products/14G0200,4.65,Showa 660ESD Antistatic PVC Gauntlet
14G0909,Showa 370 Nitrile Palm Fit Gloves S.9,http://www.arco.co.uk/products/14G0900,4.10,Showa 370 Assembly Grip Gloves Grey
14G1005,Showa 350R Nitrile Grip Gloves Large,http://www.arco.co.uk/products/14G1000,3.72,Showa 350R Green Nitrile Grip Glove
14G1105,Showa Nitrile Kevlar? Green Grip Glove Large,http://www.arco.co.uk/products/14G1100,12.29,Showa Nitrile Kevlar&reg; Green Grip Glove
14G1206,Showa 720 Blue Nitrile Gauntlet XLarge,http://www.arco.co.uk/products/14G1200,4.91,Showa 720 Nitrile Gauntlet Blue
14G2210,Showa 660 14in Blue PVC Glove 10,http://www.arco.co.uk/products/14G2200,4.90,Showa 660/36 PVC Gauntlet 14in
14G2309,Showa 690 24in Extended PVC Gauntlet 9,http://www.arco.co.uk/products/14G2300,15.89,Showa 690 PVC Gauntlet 24in
14G2408,Showa 265 Nitrile Lite Palm Fit Glove 8,http://www.arco.co.uk/textsearch?event=textsearch&searchTerms=14G2408,4.31,Showa 265 NBR Glove
14G2505,Showa Thermogrip 451 Insulated Glove Large,http://www.arco.co.uk/products/14G2500,5.28,Showa Thermogrip 451 Insulated Glove
14G2609,Showa 305 Grip Xtra Latex Glove 9,http://www.arco.co.uk/products/14G2600,3.86,Showa 305 Grip Extra Glove
14G2709,Showa 541 Dyneema Plus PU Gloves 9,http://www.arco.co.uk/products/14G2700,12.27,Showa 541 Cut-Resistant Grip Glove
14G3305,Showa 330 Reinforced Grip Glove Large,http://www.arco.co.uk/products/14G3300,4.56,Showa 330 Latex Reinforced Grip Grip Gloves
14G3909,Showa KV3 Cut Resistant Latex Glove 9,http://www.arco.co.uk/products/14G3900,15.12,Showa KV3 Cut-Resistant Latex Gloves
14G4006,Showa 540X Cut Resistant Dyneema Glv 6,http://www.arco.co.uk/textsearch?event=textsearch&searchTerms=14G4006,10.07,Showa 540X Cut-Resistant Gloves
14G4109,Skytec Ohio Palm Coated Gloves 9,http://www.arco.co.uk/products/14G4100,3.33,Skytec&reg; Ohio FCT Palm Coated Gloves
14G4209,Skytec Idaho 3/4 Coated Glove 9,http://www.arco.co.uk/products/14G4200,3.66,Skytec&reg; Idaho FCT 3/4 Coated Gloves
14G4305,Showa 377 Foam Coated Nitrile Glove Large,http://www.arco.co.uk/products/14G4300,5.41,Showa 377 Foam Coated Nitrile Gloves
14G4408,Showa 370 Nitrile Assembly Grip Gloves Black 8,http://www.arco.co.uk/products/14G4400,4.10,Showa 370 Nitrile Assembly Grip Glove Blk
14G4608,Showa 380 Foam Nitrile Glove 8,http://www.arco.co.uk/products/14G4600,4.80,Showa 380 Foam Nitrile Gloves
14G4809,Skytec Argon Thermal Glove 9,http://www.arco.co.uk/products/14G4800,5.79,Skytec&reg; Argon Thermal Gloves
14G4909,Skytec Tungsten ICR Nitrile Gauntlet,http://www.arco.co.uk/textsearch?event=textsearch&searchTerms=14G4909,18.32,Skytec Tungsten ICR Nitrile Gauntlet
14G5005,Skytec Ninja X4 Glove Large,http://www.arco.co.uk/products/14G5000,10.01,Skytec Ninja X4 Gloves
14G5205,Showa Palm Fit Gloves BO500 Black L,http://www.arco.co.uk/products/14G5200,2.92,Showa Palm Fit Gloves BO500 Black
14G5409,Showa 317 Hi Vis Grip Glove 9,http://www.arco.co.uk/products/14G5400,3.93,Showa 317 Hi-Vis Grip Glove
14G5508,Showa 340 Grip Glove 8/L,http://www.arco.co.uk/products/14G5500,2.43,Showa 340 Grip Glove
14G5609,Skytec Ninja Knight P/C Glove 9/L,http://www.arco.co.uk/products/14G5600,11.60,Skytec&reg; Ninja Knight Palm Coated Glove
14G5709,Showa 376 Foam Coated Nitrile Glove L,http://www.arco.co.uk/products/14G5700,5.15,Showa 376 Foam Coated Nitrile Glove
17M1005,3M 4530+ FR/AR Coverall White Type 5/6 L,http://www.arco.co.uk/textsearch?event=textsearch&searchTerms=17M1005,6.28,3M 4530+ FR/AR Coverall White Type 5/6
18T0905,Nomex Comfort Ripstop 225g Coverall Orange Large,http://www.arco.co.uk/products/18T0900,193.20,Nomex&reg; Comfort Ripstop 225g/m Coverall Orange
18T0907,Nomex Comfort Ripstop 225g Coverall Orange XXLarge,http://www.arco.co.uk/products/18T0900,193.20,Nomex&reg; Comfort Ripstop 225g/m Coverall Orange
