Number,Code,Manufacturer,Description,Html Description,Specification,Part Number,Warranty,Measure,Section,Date Added,Price,Web Price,Web Expiry,Daily Offer,Available,Options,FFX,FFX
5,10030725,Everbuild,Everbuild Aqua Mate Sealant Translucent,<p> Everbuild Aqua Mate Sealant Translucent</p> <p> Aqua Mate Sealant is a high modulus acetic cure 100% silicone sealant and adhesive designed specifically for aquarium manufacture.</p> <p> 100% fish safe formula.</p> <p> Conforms to BS&nbsp5889 (B) and ISO 11600</p>,,AQUATR,,,Sealants and Adhesives,26-Oct-09,2.4,0,,,Yes,,http://www.ffx.co.uk/tools/product/Everbuild%20Evbaquatr%205029347120009%20Aqua%20Mate%20Silicone%20Transparent,
14,8391DWPETK,Makita,Makita 8391DWPETK 18V Combi Drill and 101 Piece Accessory Set,"<p> <span class=""main-title"" itemprop=""name""><strong>Makita 8391DWPETK </strong>18V Combi Drill and 101 Piece Accessory Set</span></p> <div class=""product-desc""> <span class=""main-title"" itemprop=""name"">Supplied complete with:</span></div> <ul> <li> <span class=""main-title"" itemprop=""name"">2 x 1.3Ah Ni-Cad batteries, </span></li> <li> <span class=""main-title"" itemprop=""name"">charger, </span></li> <li> <span class=""main-title"" itemprop=""name"">carrying case </span></li> <li> <span class=""main-title"" itemprop=""name"">101 piece accessory set. </span></li> </ul> <div class=""product-desc""> &nbsp</div> <div class=""product-desc""> <span class=""main-title"" itemprop=""name"">Max in Steel: 13mm . Max in Wood: 36mm . Max in Masonry: 13mm . No Load Speed: H:0-1,300 L:0-400rpm . Blows per minute: H: 0-19,500 L:0-6000 . Torque Settings S/H Nm: 16+ Drill . Max Torque: 27/42Nm . Net Weight: 2.3kg . </span></div>",,10109345,1 YEAR,,Power Tools Cordless / Cordless Drills and Screwdrivers / Combi Drills,31-Oct-11,135,0,16-Oct-15,,Yes,,http://www.ffx.co.uk/tools/product/Makita%208391Dwpetk%200088381098564%2018V%20Combi%20Drill%202%20X%201.3Ah%20And%20101%20Accessories,
26,9032,Makita,Makita 9032 Filing Sander,"<p> <strong>The Makita 9032 </strong>filing sander is ideal for use in confined areas, it takes a belt size of 9 x 533 mm. This filing sander weighs 1.5kg net weight and has an input wattage of 500w.</p> <p> <br /> <strong>The Makita 9032</strong> is Available in 110v and 240v.</p> <p> <span style=""font-family: arial, helvetica, sans-serif""><span style=""font-size: 12px""><strong>Features:</strong></span></span></p> <ul> <li> <span style=""font-family: arial, helvetica, sans-serif""><span style=""font-size: 12px"">Electronic Speed Control</span></span></li> <li> <span style=""font-family: arial, helvetica, sans-serif""><span style=""font-size: 12px"">Double Insulated for Safety</span></span></li> <li> <span style=""font-family: arial, helvetica, sans-serif""><span style=""font-size: 12px"">Perfect for accessing hard to reach places</span></span></li> <li> <span style=""font-family: arial, helvetica, sans-serif""><span style=""font-size: 12px"">Multi-position sanding arm pivots 100&deg.</span></span></li> </ul> <p> <span style=""font-family: arial, helvetica, sans-serif""><span style=""font-size: 12px""><strong>Specification:</strong></span></span></p> <ul> <li> <span style=""font-family: arial, helvetica, sans-serif""><span style=""font-size: 12px"">Belt Size - 9 x 533mm</span></span></li> <li> <span style=""font-family: arial, helvetica, sans-serif""><span style=""font-size: 12px"">Belt Speed - 300-1,700m/min</span></span></li> <li> <span style=""font-family: arial, helvetica, sans-serif""><span style=""font-size: 12px"">Input Wattage - 500w</span></span></li> <li> <span style=""font-family: arial, helvetica, sans-serif""><span style=""font-size: 12px"">Net Weight - 1.5kg</span></span></li> </ul>",,9032,1 Year,,Power Tools Mains / Sanders and Polishers,4-Sep-08,127,0,,,Yes,"[110V], [240V]",http://www.ffx.co.uk/tools/product/Makita%209032%200088381041355%20110V%209Mm%20Belt%20Filing%20Finger%20Sander,http://www.ffx.co.uk/tools/product/Makita%209032%200088381041348%20240V%209Mm%20Belt%20Filing%20Finger%20Sander
27,90564281,Black and Decker,Spool and Line for Black and Decker Strimmer STC1815 | 90564281,<p> 90564281</p> <p> Spool and Trimmer Line for Black and Decker Strimmer</p>,,90564281,,,New! Draper range / Power Tools and Accessories,20-May-15,5.5,0,,,Yes,,http://www.ffx.co.uk/tools/product/Black%20%20Decker%20B%20Da6481%205019977016230%20Spool%20And%20Line%20Suitable%20For%20Reflex%20Strimmer,
1,ALR 900,Bosch,Bosch ALR 900 Lawn Raker,"<p> <strong>Bosch ALR 900 </strong>Lawn Raker</p> <p> Your lawn will only flourish if you regulary free it from moss and leaves.&nbsp you can remove both of these using the Bosch Lawn Raker by setting its 20 spring steel tines to the corresponding height from -5mm to gently comb out the thatch out damaging the grass to +10mm to collect leaves.&nbsp The patented &quotJet-Collect&quot System creates an airflow to blast everything into the collection box, therefore preventing annoying blockages.</p> <p> &nbspFeatures:</p> <ul> <li> Compact storage - Double folding handle, stackable collection box</li> <li> Large 50-Litre collection box - means less stopping and time to empty it</li> <li> &quotJet-Collect&quot System - Innovative drum with spring steel tines and airflow inlets quickly and completely removes thatch and moss</li> </ul> <p> Specification:</p> <ul> <li> Motor Power - 900W</li> <li> Drum System - 10 double steel tines</li> <li> &quotJet-Collection&quot System</li> <li> Working width - 32cm</li> <li> Working Height - +10/+5/0/-5mm</li> <li> Working height settings - 4</li> <li> Collection Box capacity - 50 litres</li> <li> Weight - 9.4kg</li> </ul>",,060088A070,,,Outdoor Power Tools / Scarifiers,2-Sep-09,100,0,,,Yes,,,
12,AXT25TC,Bosch,Bosch AXT 25 TC Quiet Shredder,"<p> Bosch AXT 25 TC Quiet Shredder</p> <p> Ideal for all types of wood and green material.</p> <p> Do you want to shread your garden waste without having to separate green material from wood?&nbsp Bosch has a quiet shredder with &quotTurbine-Cut&quot System for all types of wood and green material.&nbsp You also get your work finished more quickly due to the patented fast feed hopper and automatic feed for fast material throughput.&nbsp And the removable hopper fits exactly in the collection box to ensure space-saving storage.</p> <p> Features:</p> <ul> <li> Automatic feed and low noise levels - for extremely convenient shredding</li> <li> Cutting capacity - of up to 45mm for powerful shredding</li> <li> Practical collection box - 53-litre capacity for easier collection of the shredded material</li> <li> Patented, removable hopper - for easy filling and safe release of blockages</li> <li> Shielded cutting mechanism - for greater user safety</li> <li> &quotTurbine-Cut&quot System - Innovative cutting system with motor power of 2500 Watts</li> <li> Patented safety function of the collection box - the tool only works when the collection box is in position</li> </ul> <p> Specification:</p> <ul> <li> Cutting System - Turbine-cut</li> <li> Motor Power - 2500W</li> <li> Cutting capacity - 45mm diameter</li> <li> Material throughput rate - approx. 230kg/h</li> <li> Cutting Speed - 41rpm</li> <li> Torque - approx 650Nm</li> <li> LWA Noise Emission Level - approx 89bd (A)</li> <li> Voltage - 230V</li> <li> Weight - 30.5kg</li> <li> Automatic Feed</li> <li> Collection Box - 53 Litres</li> </ul>",,600803370,,,Outdoor Power Tools / Shredders,3-Sep-09,312.5,0,31-Oct-14,25-Jul-15,Yes,,,
34,B-03006,Makita,Makita Nylon Head B-03006,"<p> Makita Nylon Head B-03006</p> <p> A replacement petrol grass trimmer nylon cutting head to fit Makita grass trimmer models UM3830, RST200, RST210 &amp RST250</p> <p> 2 Line Super Auto (4x) M8 x 1.25R</p>",,B-03006,,,Makita Power Tool Accessories / Makita Outdoor Power Tool Accessories,30-Mar-12,9.96,0,,,Yes,,,
17,BHX2501,Makita,Makita BHX2501 4-Stroke Petrol Powered Handheld Blower,"<p> <strong>Makita BHX2501 MM4 4-Stroke Hand Held Blower</strong></p> <p> Take the hard work out of cleaning leaves and garden debris. Compact and lightweight machine with slim body for comfortable handling.</p> <ul> <li> air flow : 10.1m3/min</li> <li> engine : 4-stroke OHV</li> <li> cubic capacity : 24.5cc</li> <li> fuel : unleaded</li> <li> net weight 4.4kg</li> </ul> <p> This tool comes with:</p> <p> harness, hose clamp, flexible pipe, pipe 1 and 2, end pipe, tool kit</p>",,BHX2501,1 Year,,Outdoor Power Tools / Blowers,17-Feb-12,190.3,0,30-Apr-16,,Yes,,,
36,DHP453RFX,Makita,"Makita DHP453RFX 18V Li-Ion Cordless Combi Drill, Fast Charger","<p> <u>Makita DHP453 RFX 18 Volt Lithium ion Combi Drill </u></p> <p> <u><br /> </u>All metal 2 speed gearbox, a battery and charger which delivers a full charge in approximately 22 minutes. <br /> The drill has an ergonomically designed rubberised grip which provides more control whilst minimising fatigue and strain. <br /> This all rounder also has 16 different torque settings to choose from.</p> <p> <br /> <u>Features</u>:</p> <ul> <li> Single sleeve keyless drill chuck for easy bit installation and removal</li> <li> Compact and lightweight design for easy handling</li> <li> High comfort grips - Non slip even in wet conditions</li> <li> 2 Speed gearbox - high / low speed change lever</li> <li> All metal gears - for added life and durability</li> <li> Electronic brake control</li> <li> Forward/reverse</li> <li> Variable speed trigger</li> </ul> <p> <br /> <u>Technical Spec</u>:</p> <ul> <li> Max in Steel: 13mm</li> <li> Max. in Wood: 36mm</li> <li> Max in Masonry: 13</li> <li> Torque Settings S/H Nm: 16+ drill</li> <li> Max Torque: 27/42Nm</li> <li> Blows per minute: H:0-19,5000ipm L:0-6,000bpm</li> <li> No Load Speed: H:0-1,300rpm L:0-400rpm</li> <li> Net Weight: 3kgs</li> <li> Power: 18 volts</li> </ul> <p> <u><br /> Comes with:</u></p> <ul> <li> 1 x 3Ah li-ion battery</li> <li> Fast Charger</li> <li> Aluminium case</li> </ul>",,DHP453RFX,1 Year,,Power Tools Cordless / Cordless Drills and Screwdrivers / Combi Drills,15-Jan-15,141.49,0,31-May-15,,Yes,,,
22,DMR104,Makita,Makita DAB Job Site Radio DMR104,<p> Makita DAB Job Site Radio &nbsp DMR104</p> <p> Features:</p> <ul> <li> Bumpers and metal pipes protect against rough handling</li> <li> Shower Proof</li> <li> Dual Power Sources</li> <li> Digital quartz display</li> <li> Auto-scan and clock set button</li> <li> Headphone Jack</li> <li> AC Adapter Jack Timer set button</li> <li> Sound volume and Manual tuning button</li> <li> Digital quartz display with backlight</li> <li> Power on-off and Off-timer button</li> <li> Front Control Panel FM/AM band selection and Mono-stereo change button</li> <li> Carry Handle</li> <li> Soft grip swivels 90 degrees</li> <li> Shower Proof withstands up to 5 minute exposure to rain</li> <li> Max. Output Power 5W x 2 (24V Battery)</li> <li> AC or Makita batteries</li> </ul> <p> Specification:</p> <ul> <li> Power Supply: DC 9.6v-24v battery</li> <li> Frequency: FM 87.5-108Mhz</li> <li> Frequency: DAB 5A-BF</li> <li> Dimensions (LxWxH): 263x166x305mm</li> <li> Includes:</li> <li> AC power adapter</li> <li> aux MP3 player input</li> </ul>,,DMR104,1 Year,,Radios,30-Jul-13,92,0,31-Mar-16,,Yes,,,
31,EK6100,Makita,Makita EK6100 305mm Petrol Disc Cutter,"<p> <strong>Makita Petrol Disc&nbspcutter </strong>305mm (12&quot)&nbsp EK6100 is&nbspequipped with 61cm&sup3 2-stroke engine with stratified scavenging system.</p> <p> Makita has updated the DPC6430 12&quot stone cutting saw and this machine is a worthy rival to the Stihl TS410.</p> <p> The new model has the following advantages:</p> <ul> <li> Lightweight 1.2kg (2.6lbs) lighter than DPC6430</li> <li> Enhanced air filtration cyclone pre-separation system effectively removes dust particles away from intake air and reduces dust stuck on the filter.</li> </ul> <p> Includes:</p> <ul> <li> Tool Kit</li> <li> Dust suppression kit</li> </ul> <p class=""product_item_info_main_content""> Features:</p> <ul class=""userbenefits""> <li> Rapid start pull force required to start the machine is drastically reduced with spring-assisted recoil starter.</li> <li> Touch and Stop Switch</li> <li> Fuel primer for easy starting.</li> <li> High quality driving belt does not require tensioning once the proper tension is adjusted.</li> <li> Enhanced Air Filtration</li> <li> Developed in compliance with all known exhaust emission regulations</li> <li> Lightweight 1.2kg (2.6lbs) lighter than DPC6430</li> <li> Water supply with intake filter and fine adjustment for adequate dust protection.</li> </ul>",,EK6100,1 Year,,Outdoor Power Tools / Disc Cutters,18-Jan-13,455,0,1-Dec-16,,Yes,,,
13,GA5030,Makita,Makita 125mm Angle Grinder GA5030,"<p> Makita 125mm Angle Grinder&nbsp&nbsp GA5030</p> <p> Small diameter Angle grinders with ergonomically best possible barrel grip. Regardless of whether the user grips motor housing or rear cover, the extra-ergonomic barrel grip fits any users palm and fingers perfectly, and provides easy and comfortable handling while minimizing hand fatigue and pain.</p> <div class=""product_item_info_main_content""> <ul class=""userbenefits""> <li> Machined bevel gears.</li> <li> Small gear housing for easy handling and manoeuvrability.</li> <li> Powerful 720W motor with excellent heat-resistance.</li> <li> Ergonomic 20 degree side grip angle.</li> </ul> </div> <div class=""techspec_titel""> Bore Diameter&nbsp -&nbsp 22.23mm</div> <div class=""techspec_holder""> <div class=""techspec_titel""> Wheel Size -&nbsp 125mm</div> <div class=""techspec_titel""> Input Wattage&nbsp -&nbsp 720w</div> </div> <div class=""techspec_holder""> <div class=""techspec_titel""> No Load Speed&nbsp -&nbsp 11000rpm</div> <div class=""techspec_titel""> Net weight&nbsp&nbsp -&nbsp 1.8kg</div> </div>",,GA5030,1 Year (3yrs if registered online),,Power Tools Mains / Grinders,10-Jan-13,35,0,3-Feb-15,,Yes,"[110V], [240V]",,
7,GA9020S,Makita,Makita GA9020S 230mm Angle Grinder with Soft Start (9inch),"<p> <strong>Makita GA9020 </strong>230mm Angle Grinder with Soft Start (9inch)</p> <p> <span itemprop=""deion"">The updated replacement to the&nbsphugely popular 9069 grinder from Makita.</span></p> <p> <span itemprop=""deion"">The <strong>Makita GA9020 </strong>single speed 230mm 2000w angle grinder has been adopted by the construction industry, when fitted with a diamond blade the Makita GA9020 will cut anything from roof tiles to paving slabs, fitted with a superior anti dust structure device to protect the armature and weighing a mere 5.8kg,</span></p> <p> <span itemprop=""deion"">A</span><span itemprop=""deion"">&nbsplighter option to a petrol cutter which can be heavy and cumbersome and difficult to start. The<strong> Makita GA9020 </strong>is fitted with a 2 stage on/off switch which requires the user to push the switch forward then pull up and a soft grip rear handle for user comfort and added grip. The front side handle has 3 positions, either side of the gear box for user comfort, or on the top of the gear box which is a position favoured for cutting.<br /> </span></p> <p> <strong>Features:</strong></p> <ul> <li> Latest model Makita 9inch angle grinder</li> <li> Spindle Lock for fast and easy disc change</li> <li> Double Insulated</li> <li> Soft Start</li> <li> Available in 110V &amp 240V</li> </ul> <p> <strong>Specification:</strong></p> <ul> <li> Wheel Size: 230mm</li> <li> Bore Size: 22mm</li> <li> Spindle size: M14 x 2mm</li> <li> Wire Cup Brush: 110mm</li> <li> No Load Speed 6,600rpm</li> <li> Input Wattage 2,000W</li> <li> Net Weight 4.7kg</li> </ul> <p> <strong>Includes:</strong></p> <ul> <li> Lock Nut Wrench</li> <li> Side Handle</li> <li> Wheel Guard</li> </ul>",,GA9020S,1 Year,,Power Tools Mains / Grinders,4-Sep-08,65,0,,,Yes,"[110V], [240V]",,
30,GEX150AC,Bosch,Bosch GEX 150AC Random Orbit Sander,"<p> <strong>Bosch GEX 150AC Random Orbit Sander</strong></p> <p> The random orbit motion plus rotation ensures the finest sanding with high sanding performance. With aluminium bearing flange for long service life and high running smoothness, control Electronic and speed preselection, i.e. the right speed for every application and even the sanding plate brake prevents damage (scoring) on workpiece! Bosch&#39s very own Micro-filter System means perfect mobile extraction. With velcro-type fastening for rapid, convenient sanding sheet changes. Best for sanding and polishing wood, metal and plastic, paint and varnish, even on curved surfaces. Also suitable for left-handers!</p> <p> <strong>Specification:</strong></p> <ul> <li> Power Input - 340W</li> <li> No Load Orbit Rate - 4500-12000/min</li> <li> Base Plate Size - 150mm Dia.</li> <li> Weight - 2.1kg</li> </ul>",,GEX 150AC,1 Year,,Power Tools Mains / Sanders and Polishers,4-Sep-08,135,0,30-Nov-16,,Yes,"[240V], [110V]",,
18,HR2630,Makita,Makita HR2630 Rotary Hammer,"<p> The <strong>Makita HR2630 </strong>SDS+ rotary hammer drill features compact and lightweight tool design, ergonomic handle and many other features designed for more comfort and better control.</p> <p> 3 modes: Rotation only/Rotation with hammering/Hammering only.</p> <p> <strong>Makita HR2630 </strong>Rotary Hammer</p> <p> <strong>Features:</strong></p> <ul> <li> Forward/reverse rotation</li> <li> Torque Limiter</li> <li> Job Light</li> </ul> <p> <strong>Specification:</strong></p> <ul> <li> Max in concrete: Drill - 26mm</li> <li> Max in concrete: Core - 80mm</li> <li> Max in Steel - 13mm</li> <li> Max in Wood - 32mm</li> <li> Joules - 2.9</li> <li> Vibration - 15.5m/sec</li> <li> Blows per minute - 0-4,600bpm</li> <li> No load speed - 0-1,200rpm</li> <li> Input Wattage - 800w</li> <li> Net Weight - 2.9kg</li> </ul> <p> <strong>Includes:</strong></p> <ul> <li> Side Handle</li> <li> Depth Stop</li> <li> Case</li> </ul>",,HR2630,1 Year,,Power Tools Mains / Drills / Hammer Drills - SDS Plus,21-Jan-09,81.67,0,,,Yes,"[110V], [240V]",,
9,HW101,Makita,Makita HW101 Compact Pressure Washer,"<p> The Makita HW101 Compact Power Washer is ideal for domestic use on driveways or patios.</p> <p> The lance features an adjustable nozzle for accurate cleaning and there is an adjustable detergent bottle that allows you to apply solutions depending on the job.</p> <p> It has a universal electric motor with wobble plate pump and an aluminium pump head. Features a Total Stop System (TSS) which switches the motor on and off when the lance trigger is operated, prolonging the motor life. The stainless steel pistons provide increased working life and more reliability.</p> <p> <strong>Specification:</strong></p> <ul> <li> Max pressure: 100 bar</li> <li> Max flow: 360 L/hr</li> <li> Input wattage: 1.3kw</li> <li> Motor type: induction</li> <li> Pump: Triplex with wobble plate</li> <li> Net Weight: 6.5kg</li> </ul> <p> <b>Comes with:</b></p> <ul> <li> 3meter HP hose</li> <li> Gun and lance (Fan head)</li> <li> Detergent bottle</li> </ul>",,HW101,1 year,,Outdoor Power Tools / Power Washers,4-Sep-08,41.6,0,,,Yes,,,
6,LB1200F,Makita,Makita LB1200F 305mm Band Saw 240v,"<p> <strong>Makita</strong>&nbsp<strong>BAND SAW</strong> 305mm LB1200 240V is a High efficiency band saw with casters for easy mobility.</p> <ul> <li> cutting speed : L/6.7m/sec&nbsp&nbsp H/13.3m/sec</li> <li> cutting capacities : H/165mm&nbsp&nbsp W/305mm</li> <li> Blade size : 2240mm/6.13-16mm</li> <li> 2 speeds</li> <li> net weight : 81kg</li> <li> table tilt range : 2-45</li> <li> table size : 560x400mm</li> <li> table height : 1m</li> <li> wattage : 900w</li> <li> 240v</li> </ul> <p> Comes with :</p> <ul> <li> Rip fence,</li> <li> Push stick,</li> <li> Stand,</li> <li> Hex wrenches,</li> <li> 4x blades (13mm wood, 16mm wood, 16mm metal, 6mm scrolling)</li> </ul>",,LB1200,1 year,,Power Tools Mains / Mains Saws / Band Saws,14-Feb-12,385,0,,,Yes,,,
3,LCT204W,Makita,LCT204W 2 Piece Cordless 10.8v Kit,"<p> Makita LCT204W - 2 Piece 10.8V Impact Driver &amp Drill Driver in Aluminium Case</p> <p class=""deion""> 10.8V Twin Impact and Drill Driver in Aluminium Case - LCT204W</p> <p class=""deion""> <strong>DF330D&nbsp- Drill Driver</strong></p> <ul> <li> Conveniently located push button for forward and reverse.</li> <li> High comfort grips.</li> <li> Ideal for applications in tight spaces.</li> <li> Two speed gear box.</li> <li> LED job light.</li> <li> Key-less 3 jaw chuck for use with your existing accessories.</li> </ul> <p> <strong>TD090D - Impact Driver</strong></p> <ul> <li> Conveniently located push button for forward and reverse.</li> <li> High comfort grips.</li> <li> Ideal for applications in tight spaces.</li> <li> Keyless single sleeve hex chuck.</li> <li> LED job light.</li> <li> Lithium-ion batteries have greater life spans than their Ni-MH or Ni-Cad counterparts giving 430% greater run time.</li> <li> Minimal pressure required from the operator.</li> </ul> <p class=""deion""> <strong>Includes</strong>:</p> <ul> <li> DF330D - Drill Driver</li> <li> TD090D - Impact Driver</li> <li> DC10WA - Charger</li> <li> BL1013 - Batteries x 2 - 1.3Ah Li-ion</li> <li> Aluminum Case</li> </ul>",,LCT204W,1 Year,,Power Tools Cordless / Cordless Combo Packs,5-Dec-08,103,0,31-Dec-15,26-Jul-15,Yes,,,
25,MLS100,Makita,Makita MLS100 Mitre Saw 255mm,"<p> <span class=""Apple-style-span""><strong>Makita</strong> <strong>MLS100 </strong>Mitre Saw 255mm </span></p> <p> <span class=""Apple-style-span"">The MLS100 Mitre saw has a compact and robust construction for more accurate cuts.</span></p> <p> <span class=""Apple-style-span"">Power input: 1500w</span></p> <p> Blade Diameter: 255 x 30mm<br /> Max. cut (90&ordm): 75mm<br /> Max. bevel range: 45&ordm-45&ordm<br /> No Load Speed: 4,200rpm<br /> Weight: 14.7kg</p> <p> Entry level mitre saw<br /> Positive mitre stops</p> <p> <strong>Supplied with:</strong></p> <ul> <li> TCT saw blade</li> <li> Dust bag</li> <li> Extension arms</li> <li> Vertical clamp</li> </ul> <p> <span style=""color: #f00"">&nbsp</span></p>",,MLS100,1 Year,,Power Tools Mains / Mains Saws / Mitre Saws,16-Mar-09,120.49,0,,,Yes,"[110V], [240V]",,
15,MLT100,Makita,Makita MLT100 Table Saw,"<p> <strong>The MLT100 Table Saw includes as standard: TCT blade, Rip fence, Push stick, Mitre guage with vise, Wrenches and Triangular rule!!<br /> <br /> </strong></p> <p> Features :</p> <p> Electronic brake</p> <p> Double insulated</p> <p> Available in 110V &amp 240V</p> <p> &nbsp</p> <p> Specification :</p> <p> Blade Diameter: 260mm</p> <p> Bore Diameter: 30mm</p> <p> Table length (with sub-tables - included): 590mm main 790mm with sub tables</p> <p> Table width (with sub-tables - included): 610mm main 760mm with sub table</p> <p> No Load Speed: 4500rpm</p> <p> Input wattage: 1500w</p> <p> Net Weight: 38kg</p>",,MLT100,1 Year,,Power Tools Mains / Mains Saws / Table Saws,5-Dec-08,350,0,31-Jan-16,,Yes,"[110V], [240V]",,
11,PLM5121,Makita,Makita PLM5121 Petrol Lawn Mower - 51cm,"<p> <strong>Makita PLM5121 </strong>Petrol Lawn Mower - 51cm</p> <p> The <strong>Makita PLM5121</strong> has a specially shaped blade that holds the grass clippings in the deck of the mower so it can cut them into fine pieces, the clippings then settle on the lawn quickly decomposing adding in the growth and overall health of the lawn<br /> &nbsp</p> <p> <strong>Features:</strong></p> <ul> <li> Steel deck</li> <li> Briggs &amp Stratton 675 series engine</li> <li> 1 speed gearbox</li> <li> Recommended for Lawns of up to 2,200sq m.&nbsp</li> </ul> <p> <strong>Specification:</strong></p> <ul> <li> Engine Type - 4-stroke</li> <li> Cubic Capacity - 190cc&nbsp</li> <li> Cutting Width - 51cm</li> <li> Cutting Heights -&nbsp25/70cm</li> <li> Weight - 31.7kg</li> <li> Self Propelled</li> <li> Aluminium steel lined deck</li> </ul> <p> <span style=""color: #ff0000""><span style=""font-size: larger""><strong>*May require some assembly*</strong></span></span></p>",,PLM5121,1 Year,,Outdoor Power Tools / Lawn Mowers,4-Sep-08,309.99,0,,,Yes,,,
19,PW5000C,Makita,Makita PW5000C Wet Stone Polisher 110V ONLY,"<h4> <strong>Makita</strong> PW5000C <strong>Wet Stone Polisher </strong>110V ONLY</h4> <p> This Makita power tool is&nbspideal for <strong>effective stone polishing.&nbsp</strong></p> <p> <strong>Makita Wet Stone Polisher&nbsp</strong>-&nbspelectronic with speed control by pre-setting dial, soft start and overload protection 3 water supply holes evenly feed water to every channel of the polishing pad, protecting the pad from overheating and getting clogged with dust Ergonomically designed tool head provides comfortable grip.</p> <h4> <strong>Comes as standard with a <a href=""http://www.powertools2u.co.uk/Makita-Polishing/Makita-743080-0-M14-Rubber-backing-pad-for-use-with-PW5000C.htm""><strong>Makita</strong>&nbspRubber&nbspBacking Pad&nbsp - 743080-0</a>&nbsp</strong></h4> <p> <strong>Features:</strong></p> <ul> <li> Speed control dial for setting the optimum speed for application.</li> <li> Three water supply holes evenly wet every channel of polishing pad, protecting from overheating and getting clogged with dust.</li> <li> Ergonomically designed tool head provides comfortable grip.</li> <li> Conveniently located valve allows easy water flow control in your hand.</li> <li> Double Insulated</li> <li> Constant Speed Under Load</li> <li> Soft StartComes With:</li> <li> Rubber Pad</li> <li> Side Grip</li> <li> Wrench</li> </ul> <p> <strong>Specification:</strong></p> <ul> <li> Pad Size: 100mm</li> <li> Arbor: 12mm</li> <li> No load Speed: 2,000-4,000rpm</li> <li> Input wattage: 900w</li> <li> Net Weight: 2.2kg</li> </ul>",,PW5000C,1 year,,Power Tools Mains / Sanders and Polishers,4-Sep-08,201.99,0,,,Yes,,,
