Code,Description,Spicer_Code
EP20118,Epson Styl3000 Inkjet Cart Blk S020118,449062
EP20130,Epson Styl3000 Inkjet Cart Cyan S020130,449070
EP20126,Epson Styl3000 Inkjet Cart Mag S020126,449089
EP20122,Epson Styl3000 Inkjet Cart Ylw S020122,449097
SGL90099,Sigel Notebook Lined 213x295x20mm Black,449645
SGL90090,Sigel Notebook Lined 148x213x20mm Blk,449653
SGL89362,Sigel Notebook Lined 187x270x13mm Black,449661
SGL89329,Sigel Notebook Lined 135x210x13mm Blk,449686
SGL89447,Sigel Pencil Cup Eye Style White SA100,449694
SGL89445,Sigel Paper Clip Disp Eye Style White,449701
SGL89257,Sigel Sticky Note Box Eye Style White,449718
SGL89443,Sigel Hole Puncher Eye Style White SA103,449726
SGL89441,Sigel Stapler Eye Style White SA104,449734
SGL88774,Sigel Mag Glass Board 480x480 Blk Gl110,449742
SGL88773,Sigel Mag Glass Board 480x480 Wht Gl111,449750
SGL88770,Sigel Mag Glass Board 480x480 Red Gl114,449768
SGL88766,Sigel Mag Glass Board 780x480 Blk Gl130,449775
SGL88765,Sigel Mag Glass Board 780x480 Wht Gl131,449783
SGL88763,Sigel Mag Glass Board 1000x650 Wht Gl141,449808
SGL88755,Sigel xstrong Mag Cube 10x10x10mm Pk4,449815
SGL88798,Sigel 3C Name Badge 1day/1way 64x90 P8,449823
SGL88796,Sigel 3C Name Badge 1day/1way 50x75 P6,449831
HT02823,Rapesco Spare Punching Brd 2200/4400 Pk4,450930
BC04692,Bic Drywipe Marker Bullet Black 701099,452078
BC03784,Bic Drywipe Marker Bullet Blue 701068,452086
BC06222,Bic Drywipe Marker Bullet Red 701037,452094
BC06218,Bic Drywipe Marker Bullet Green 701020,452108
BY01729,Ff Bisley Card Fil Cab 9X6In Grey Bcf96,454064
CO29396,Canon Gls Photo Ppr 10x15cm Pk100 GP501,454580
BA62788,Brother InkCart Black LC900BK,454622
BA62789,Brother InkCart Cyan LC900C,454630
BA62790,Brother InkCart Magenta LC900M,454649
BA62791,Brother InkCart Yellow LC900Y,454657
IBE250A11E,Lexmark RP Toner Black E250A11E,454954
HPQ8691A,HP Adv Glsy Pht Ppr 250g 10x15cm Pk25,456205
HPQ8692A,HP Adv Glsy Pht Ppr 250g 10x15cm Pk100,456289
HPQ8696A,HP Glossy Pht Ppr Borderless 13x18 Pk25,456328
HPQ5456A,HP Adv Glsy Pht Ppr 250g A4 Pk25 Q5456A,456352
HPQ8698A,HP Adv Glsy Pht Ppr 250g A4 Pk50 Q8698A,456360
HPQ8697A,HP Adv Glsy Pht Ppr 250g A3 Pk20 Q8697A,456378
HPQ5461A,Hp Advancd Glsy Pht Ppr 250G A3+ Pk25,456386
CO29392,Canon Glossy Photo Paper A4 Pk100 GP501,456433
GB21933,GBC 6mm 250g ThrmCvr Lthr Clr/RBlu P100,456526
XR8R00672,Xerox Solid Ink 6 Sticks 8500/8550 Black,457404
OK03209,Oki Image Drum Cyan 43460207,457527
OK03210,Oki Image Drum Black 43460208,457551
OK03208,Oki Image Drum Magenta 43460206,457577
OK03207,Oki Image Drum Yellow 43460205,457585
OK03198,Oki Belt Unit 43378002,457593
HPQ7570A,HP Laser Tnr Black Q7570A,458394
HPQ7516A,HP No16A Laser Tnr Blk Q7516A,458409
IB18C1428E,Lexmark RP No28 IJ Cart Black 018C1428E,458417
IB18C1429E,Lexmark RP No29 IJ Cart Colour 018C1429E,458425
IB18YX143E,Lexmark No43 HY Ink Cart Col 018YX143E,458433
CO27067,Canon Toner Cartridge CRG-708 Black,458459
CO32224,Canon Toner Cartridge CRG-710 Black,458467
SZ75620,Sony AIT-3 150Gb/390Gb Chip SD3X150CN,458742
HPC9360AE,HP No102 Photo IJet Cart Gry C9360AE,458962
HPC9365AE,HP No101 Photo IJet Cart Blu C9365AE,459014
HPQ5920C,HP Toner Cartridge Black Q5920C 9850MFP,459056
HPQ5922C,HP Toner Cart Yellow Q5922C 9850MFP,459072
HPQ3682C,HP Toner Cartridge Black Q3682C,459103
HPQ5702C,HP Toner Cartridge Black Q5702C,459111
RX02055,Rexel Wizard Battery Stapler 02055,459778
BRT10333,Pepsi Max 330ml Can Pk24 3387,460295
BRT00109,7Up 330ml Can Pk24 3388,460317
BRT12030,Tango Orange 330ml Can Pk24 3391,460325
CPD81140,Maxima Budget Drinking Cup Wht Pk1000,460562
OK3410,Oki Ribbon Black Ml3410 4816,460899
HP51642B,Hp Matte Film 914Mmx36M 101Micron 51642B,461494
KC00965,Kleenex Ult Toilet Tissue Roll 2Ply Pk2,462091
LO25354,Loctite Super Attak 5Gm,462261
HK9150,Loctite Super Glue With Brush 5G 9150,46227X
HPCB400A,HP Toner Cartridge Black CB400A,462544
HPCB401A,HP Toner Cartridge Cyan CB401A,462552
HPCB402A,HP Toner Cartridge Yellow CB402A,462560
HPCB403A,HP Toner Cartridge Magenta CB403A,462578
IBC7700KH,Lexmark RP C770 HY Tnr Black 0C7700KH,462586
IBC7700CH,Lexmark RP C770 HY Tnr Cyan 0C770CH,462609
IBC7700MH,Lexmark RP C770 HY Tnr Magenta 0C7700MH,462641
IBC7700YH,Lexmark RP C770 HY Tnr Yellow 0C7700YH,462764
AFI50017,AF Foamclene 300ml Surface Cleaner,462806
AFI50063,AF Sprayduster 200ml Invertible Non Flam,462865
AFI50026,AF Sprayduster 400g Nonflammable,462873
AFI50050,AF Ultraclene 10Duo Wet/Dry Keybrd Wipes,462903
AFI50018,AF Screen-Clene Duo 20 Wet/Dry Wipes,462946
IBE450A11E,Lexmark RP Toner Black E450A11E,463426
CS18509,Casio Scientific Calculator FX-83GTPLUS,463437
CSMS120T,Casio Calc Desktop 12Digit Ms120Te,463445
IB0C500X27,Lexmark C500 Waste Tnr Bottle 0C500X27G,463450
KF02643,Q-Connect Magnet 25mm Assorted Pk10,464033
KF01339,Q Connect Things To Do Today Book,464165
KF01518,Q Connect Index 1-5 Board Reinf Multicol,464289
KF01519,Q Connect Index 1-10 Brd Reinf Multicol,464297
KF01520,Q Connect Index 1-15 Brd Reinf Multicol,464300
KF01521,Q Connect Index 1-20 Brd Reinf Multicol,464319
KF01522,Q Connect Index 1-31 Brd Reinf Multicol,464327
KF01523,Q Connect Index A-Z Brd Reinf Multicol,464335
KF01525,Q Connect Index 5Pt Board Reinf Multicol,464343
KF01526,Q Connect Index 10Pt Brd Reinf Multicol,464351
KF01528,Q Connect Index 1-10 Board Reinf White,464408
KF01530,Q Connect Index 1-15 Board Reinf White,464416
KF01531,Q Connect Index 1-20 Board Reinf White,464424
KF01936,Q-Connect A4 Index 1-31 White Board,464432
KF01532,Q Connect Index A-Z 20Pt Brd Reinf White,464440
KF26011,Q Connect Index A-Z A4 20Part Buff,464475
KF04102,Q Connect Boxfile Polypropylene Black,464521
KF04104,Q Connect Boxfile Polypropylene Red,464548
KF04103,Q Connect Boxfile Polypropylene Blue,464556
KF04105,Q Connect Boxfile Polypropylene Grey,464564
KF21682,Q-Connect Book Rack Black,464572
KF21683,Q-Connect Book Rack Blue,464580
KF21684,Q-Connect Book Rack Red,464599
KF01121,Q Connect Punched Pkt Glass Clear Pk100,464718
KF27013,Q Connect Easytear Pp Tape 19Mmx33M,464866
KF27014,Q Connect Easytear Pp Tape 24Mmx33M,464874
DW37318,Danone Tof 50Cl Lemon And Lime Orig Pk24,464934
IB8Y0340E,Lexmark No40 Photo Ink Cart CYMK,464942
IB8Y0144E,Lexmark No44 HY Ink Cart Blk 018Y0144E,464950
KF04552,Q Connect Surface Whiteboard Clnr 250Ml,465152
PE07212,Pentel Recy Exp Doc File Organ 13Pkt Blk,465311
HPCB331EE,HP No338 Inkjet Cart Black Pk2 CB331EE,465450
HPCB332EE,HP No343 Inkjet Cart 3Col Pk2 CB332EE,465468
3M11737,Imation 4Mm Datacart Dds125 12Gb 11737,466026
3M11776,Imation Tape Cart Dlt Iv 40/80Gb 11776,466034
OL26001,Olivetti Inkjet Cart FPJ20 Black B0384,466700
PH720T,Philips Transcription Kit Lfh720T,467072
PH725D,Philips Dictation/Transcription Kit 725D,467080
PH730T,Philips Transcription Kit 730T,467102
SZ49038,Sony 8Mm/170M Tape Cart Qgd-170Me,467366
AM6901,Apple Colour Printer Ink Cartridge Bk,467412
CO12934,Canon Np3050 Toner Cart Black Npg5,46751X
CO12943,Canon Toner Cartridge Black Pk2 Np3825,467528
CO12933,Canon Np4050/4080 Toner Cart Black Npg4,467536
CO12938,Canon Np6012 Toner Cart Black Npg11,467560
CO12935,Canon Np6025/6030 Toner Cart Black Npg7,467579
CO12932,Canon Np6060 Toner Cart Black Npg3,467595
KN00072,Konica Minolta 1015 Copier Toner Blk,467609
KN00075,Konica Mnlta Tnr Blk 1122/1115/1512/1518,467617
KN00178,Konica Minolta Toner Blk 2125/3135/4145,467625
MT12935,Konica Minolta Copier Laser Toner Blk,467633
MT12931,Konica Minolta Toner Blk Ep3120/3150,467641
MIN10365,Konica Minolta Copier Toner Blk Ep2120,46765X
MT00132,Mita Copier Toner Black Dc1415/1435/1455,467757
TE00051,Toshiba Toner Copier T1710 Black 122018B,467889
TE10141,Toshiba Copier Toner Cart Black T1350E,467943
TE00048,Toshiba Toner Copier T2510 Blk 1222019B,467951
DG40,Digital Ribbon Black La40R-Ka La400/450,467994
BT35037,Bt Image Fax 350/370 Print Ribbon Pk2,468043
CO15191,Canon Fax Toner Cartridge Fx4,468051
PZ3313,Panasonic Toner Cartridge Unit Ug3313,468221
SGM90211,Sagem Ink Film Roll TTR900,46823X
HPC5141A,Hp C5141A Dlt Tape Iii Xt,468310
HPC5141F,Hp Dlt Tape 4000/7000 C5141F,468329
EP14402,Epson Photo Qlty Ij Ppr A4 Pk100 S041061,468582
CO14401,Canon Toner Cart Lbp460 1465/660,46868X
HPC4127X,Hp 27X Black Laserjet Toner Cartridge,468698
HPC4127A,Hp 27A Black Laserjet Toner Cartridge,468701
KETK16H,Kyocera FS800 Toner HY Black TK16H,46871X
IB698256,Lexmark Optra E Tnr Cart Blk 69G8256 3K,468736
IB698257,Lexmark Optra E Photoconductor 69G8257,468744
29226,Xerox Pro 7041 Toner Cartridge Blk,468825
GE01001,Genicom Rbn 3800 Standard Blk 3A0100B02,468922
GE50701,Genicom Rbn 4000 Weld Sensor 507014G08,468949
GE00061,Genicom Rbn 4800 Re-Ink 50M 4A0040B02,468957
HPC1806A,Hp D/Jet Cp Ink System 410Ml Blk C1806A,469162
HPC1807A,Hp D/Jet Cp Ink System 410Ml Cyan C1807A,469170
HPC1808A,Hp D/Jet Cp Ink System 410Ml Mag C1808A,469189
HPC1809A,Hp D/Jet Cp Ink System 410Ml Ylw C1809A,469197
MA99463,Postal Tube 1140Mm Pk12 Pt-102-15,469280
RM31635,Rexel Shredder Bag Autoplus 250 P20,469524
RM31634,Rexel Shredder Bag Autoplus 500,469532
OBCE255A,OB HP Laser Toner Black CE255A,469621
HPC6036A,Hp Bright White Inkjet Ppr 914Mm 45Mtr,469685
HPC6050A,Hp Iron-On Transfer A4 Pk12 C6050A 170G,469707
DU03792,Duracell Battery Ultra Pk4 AA 75051955,469715
DU03794,Duracell Battery Ultra Pk4 AAA 75051959,469723
HP51631D,Hp Special Ijet Ppr 90G 610Mmx45M 51631D,469766
EP41068,Epson Photo Qlty Ij Ppr A3 Pk100 S041068,469790
PLR01034,Plantronics HL10 Telephone Lifter,469808
KS16230,Kenco Really Smooth Frze Drd Coffee 750G,469863
KS16235,Kenco Decaff Freeze Dried Coffee 500G,469871
NL72756,Nescafe Orig One Cup Stick Pk200,469898
AU06232,Cadburys Chocolate Break 2Kg A00669,46991X
CPD75061,CPD Paper Plate 7in Wht Pk100 KBLRY1641,470003
CPD75081,CPD Paper Plate 9in Wht Pk100 KBLRY1642,470011
DB7211,Durable Desk Mat World Map 40X53Xm 7211,470321
SE05144,Sellotape Golden Tape 24mm x50M 1443266,470456
SE04993,Sellotape Golden Tape 18mm x25M 1443169,470464
LZ96382,Leitz L Drawer Cab Allura 6Drawer Blk,470545
LZ96375,Leitz L Drawer Cab Allura 4Drawer Blk,470553
FX10899,Filofax Calculator Large Black 134011,470674
IBC52025X,Lexmark Waste Toner Box Colour,470883
IBC53034X,Lexmark C53X Photocon Unit 00C53034X Pk4,470891
CO27296,Canon Inkjet Cart CLI-8 Red 0626B001,470906
CO27299,Canon Inkjet Cart CLI-8 Green 0627B001,470914
HID52553,HiDist 2KW Upright Fan Heater Wht,470976
PHT00110,Aluminium Frame A4 Styrene Paafa4B,471157
PHT00111,Aluminium Frame Styrene Front A3 Paafa3B,471165
PHT00113,Aluminium Frame Styrene Front A2 Paafa2B,471173
PHT00115,Aluminium Frame Styrene 50X70Cm Paaf5070,471181
BA69814,Brother Colour Ijet MFC Blk DCPJ925DW,471338
OM03613,Olympus VN7700 2Gb Non PC Model Inc Case,471370
SE4543,Sellotape Sticky Hook Pads Pk96 4543,471408
SE4544,Sellotape Sticky Loop Pads Pk96 4544,471416
SE2264,Sellotape Sticky Hook 25Mmx12M 2264,471424
SE2265,Sellotape Sticky Loop 25Mmx12M 2265,471432
SE4100,Sello Sticky Hook And Loop 6M Strip 4100,471440
BT30441,BT Decor 2100 Corded Analogue Telephone,471443
BT30442,BT Decor 2200 Corded Analogue Telephone,471451
SE4098,Sellotape Sticky Hook Spots Pk125 4098,471459
SE4099,Sellotape Sticky Loop Spots Pk125 4099,471467
BT63248,BT Decor 2500 Corded Analogue Telephone,471468
BT61478,BT Div 7100 Plus Sngl DECT Handset Blk,471476
MY12910,Avery Trimmer A4 Blue A4Tr,471491
BT61474,BT Div 7150 Plus Single DECT Phone Blk,471492
MY12911,Avery Trimmer A3 Blue A3Tr,471505
BT61480,BT Div 7400 Plus Single DECT Handset Blk,471508
AV14028,Avery A4 Guillotine GUA4,471513
BT61477,BT Div 7460 Plus Single DECT Phone Blk,471532
BT61481,BT Inspire 1500 Sng Cless DECT Phone Blk,471558
BB63241,Fellowes 72CT Cross Cut Shredder 4672201,471565
AVJ8162,Avery Ijet Lbl Addr 99.1X33.9 P100 J8162,471572
AVJ8165,Avery Ijet Lbl Pcl 99.1X67.7 Pk100 J8165,471580
AVJ8167,Avery Ink Lbl Shp 199.6X289.1 P100 J8167,471599
AVJ8168,Avery Ink Lbl Shp 199.6X143.5 P100 J8168,471602
DB50460,Durable Powerclean Std AirDuster 400ml,471605
DB50462,Durable Powerclean Invertible AirDuster,471613
HPCB335EE,HP No350 Inkjet Cart Black CB335EE,471634
DB57168,Durable Superclean Foam 400ml 5739/02,471638
DB57002,Durable Superclean Wipe 5708/02 Tub100,471646
WS20891,Clipper Indicator Pin Lge Ast Pk10 20891,471653
WS20791,Clipper Indicator Pin Sml Ast Pk20 20791,471661
DB50344,Durable Superclean Wipe 5788/02 Pk50,471662
KF14679,Q-Connect X-Band 100G 100x11mm Astd,471688
DB50150,Durable Screenclean Duo 5721 Pk10,471702
DB57099,Durable Screenclean Wipe 5736/02 Tub100,471710
DB50101,Durable Screenclean Set 5707/00,471735
DB50097,Durable PC Clean Kit 5718,471751
DB50586,Durable Laptop Cleaning Kit 5863/00,471808
AR1346,Xstamper Faxed Red 1346,47198X
HPCB336EE,HP No350 XL Inkjet Cart HY Black CB336EE,472126
HPCB337EE,HP No351 Inkjet Cart 3-Colour CB337EE,472134
HPCB338EE,HP No351 XL Inkjet Cart HY 3Col CB338EE,472176
HPC6656GE,HP No56 Inkjet Cart Blk C6656GE#ABB,472215
AL6583661,Durable Filing Trolley Grey 3097/10,472411
AV03709,Idxmaker Div 6Pt A4 01638061 FPC,47256X
ES68737,Esselte 4Rbndr A3 25Mm Black 68737,472861
ES68735,Esselte 4Rbndr A3 25Mm Blue 68735,47287X
ES60596,Esselte 4D Rbndr A3 Portrait Blue 60596,472896
HPC6657GE,HP No57 Inkjet Cart 3Col C6657GE,472906
JT77901,Concord Index 20Part Extra Wide 77901/79,473158
JT77801,Concord Index 10Part Xtra Wide 77801/78,473166
JT77701,Concord Index Pchd Pkt 5Part 77701/77,473174
JT75701,Concord Index Unpnchd A4 5Pt Wht 75701,473182
JT75201,Concord Index Unpnchd A4 1-10 Wht 75201,473190
JT75801,Concord Index Unpnchd A4 10Pt Wht 75801,473204
JT75101,Concord Index Unpunched A4 1-5 Wht 75101,473212
JT75401,Concord Index Unpnchd A4 1-20 Wht 75401,473220
JT75999,Concord Index Unpnchd A4 5Pt Ast 75999,473239
JT76099,Concord Index Unpnchd A4 10Pt Ast 76099,473247
JT75301,Concord Index Unpnchd A4 1-12 Wht 75301,473255
JT75601,Concord Index Unpnchd 26Pt A-Z Wht 75601,473263
JT75501,Concord Index Unpnchd A4 1-31 Wht 75501,473271
JT70699,Concord Index 6Part A4 70699/J6,473301
XX94646,Xerox Colotech Plus Paper A4 100Gsm Wht,47359X
GH3158,Europa Portfolio Asstd Pk10 3158,473786
GH4509,Guildhall Ergonomic Binder A4 Blue,473794
GH11954,Guildhall Accident Injury Book T44,473816
GH4860,Europa Notemaker A4 Side Bound Pk10 4860,473824
GH3154,Europa Notemaker A4 Side Pk10 Asst 3154,473832
GH4850,Europa Notemaker A5 Side Bound Pk10 4850,473867
GH3155,Europa Notemaker A5 Side Pk10 Asst 3155,473875
GH4920,Europa Minor Pad Assorted Pk20 4920,473883
GH3151,Europa Minor Pad Asstd Pk20 3151,473891
GH01953,Guildhall Vehicle Mileage Log Book T43,473921
CO45404,Canon Inkjet Cartridge Black PG-37,474184
CO45405,Canon Inkjet Cartridge Colour CL-38C,474223
LC02609,Logitech Wireless Mouse M325 Dark Silver,475036
LC02688,Logitech Wless Dtop Mk260 Blk 920-002997,475044
MSF25279,Microsoft Wless Desktop 2000 Blk,475100
MSF28288,Microsoft Comfort Curve Keybd 3000 Blk,475118
KD95236,Kodak Ink Cartridge 30BXL Black 3952363,475936
KD95235,Kodak Combo Ink Cartridge 30B/30C CKMY,475944
KD89803,Kodak Inkjet Cartridge 30CL Col 8898033,475952
KD95233,Kodak Inkjet Cartridge 30B Black 3952330,475960
KF50169,FF Jemini Medium Back Chair Charcoal,476006
KF50171,FF Jemini Medium Back Chair Royal Blue,476014
XX94647,Xerox Colotech Plus Paper A3 100Gsm Wht,476898
DB57167,Durable Powerclean AirDuster 400ml 5738,477724
DB50342,Durable Screenclean Wipe 5787/02 Pk50,477732
DB50339,Durable Telephone Clean 5785/02 Pk50,477740
DB50612,Durable Digital Camera Cleaning Kit,477773
DU02484,Duracell 3Hour Charger Black 81296700,477846
DU02596,Duracell 5Hour Charger Black 81299558,477854
DU02210,Duracell 15 Minute Charger 81285682,477862
DU02206,Duracell Speedy Charger 81285698,477870
DU09994,Duracell Lithium Battery AA Pk4 81291959,477888
VM39011,Verbatim Clip-It USB 2.0 4Gb BLK 43901,477928
VM39424,Verbatim Netbook USB2 32Gb Black 43942,477943
EP48994,Epson Stylus BX635FWD Inkjet MFC Fax Blk,478403
EP48395,Epson Stylus Off WF7015 Inkjet Prntr Blk,478411
EP49024,Epson Stylus BX935FWD Inkjet MFC Fax Blk,478428
EP49051,Epson Workforce Wp4025Dw Inkjet MFC Blk,478460
EP49019,Epson Wkforce WP4535DWF Ijet MFC Fax Blk,478478
EP49043,Epson Wforce PWP4545DTWF Ijet MFC Fx Blk,478485
AC31071,Kensington Slimtype Kbrd Black K72357UK,478518
CO78490,Canon Pixma MG3150 Inkjet MFC Black,478566
CO78544,Canon Pixma MG6250 Inkjet MFC Black,478582
CO78562,Canon Pixma MG8250 Inkjet Mfc Black,478590
CO78532,Canon Pixma MG5350 Inkjet MFC Black,478606
BA69924,Brother PT-1005BTS Label Machine,478793
TE00039,Toshiba Toner Fax Tk12 Black P2 3222008B,480360
MQ23844,MailLite Plus Oyster 240x330mm Pk50,480516
EP1119,Epson Fabric Ribbon Black Lq150 S015060,480735
MQ23843,MailLite Plus Oyster 220x330mm Pk50,480808
MQ23845,MailLite Plus Oyster 270x360mm Pk50,480824
ST33040,Staedtler Marsgraphic Liner 0.1 308-01-9,481391
ST33042,Staedtler Marsgraphic Liner 0.3 308-03-9,481408
ST33044,Staedtler Marsgraphic Liner 0.5 308-05-9,481415
PA90870,Parker Im Prem Gun Metal Rball Gift Box,481423
TX27717,Tippex Soft Grip Correction Tape 895933,481448
PA90953,Parker Quinkflow Bp Rfl Fn Blk Blist X1,481480
PA90954,Parker Quinkflow Bpen Rfl Fn Bl Blist X1,481504
PA90955,Parker Quinkflow Bpen Rfl Med Bk Blistx1,481512
PA90958,Parker Quinkflow Bpen Rfl Med Bl Blistx1,481520
GL95712,Papermate Inkjoy 100 Stick Ball Pen Blk,481538
GL95713,Papermate Inkjoy 100 Stick Ball Pen Blue,481545
GL95714,Papermate Inkjoy 100 Stick Ball Pen Red,481553
PA93986,Parker Jotter Ss Ball Pen Blister X1 Blk,481601
GL94572,Sharpie Metal Perm Marker Sml Bullet Blk,481618
GL94573,Sharpie Metal Perm Marker Sml Bullet Blu,481626
GL94574,Sharpie Metal Perm Marker Sml Bullet Red,481634
GL94575,Sharpie Metal Perm Marker Sml Bullet Grn,481642
GL94577,Sharpie Metal Perm Marker Sml Chisel Blk,481650
GL94578,Sharpie Metal Perm Marker Sml Chisel Blu,481708
GL94579,Sharpie Metal Perm Marker Sml Chisel Red,481715
GL94580,Sharpie Metal Perm Marker Sml Chisel Grn,481723
GL94982,Sharpie Metal Perm Marker Lrg Chisel Blk,481731
GL94983,Sharpie Metal Perm Marker Lrg Chisel Blu,481798
GL94984,Sharpie Metal Perm Marker Lrg Chisel Red,481804
GL94985,Sharpie Metal Perm Marker XL Chisel Blk,481812
GL94986,Sharpie Metal Perm Marker XL Chisel Blu,481820
AG06509,Addis President Pump Pot 3Ltr Chrome,481850
GL94987,Sharpie Metal Perm Marker XL Chisel Red,481878
PA70557,Parker Jotter Ss Mech Pencil Gift Box,481968
PA70566,Parker Jotter Spec Blk Ball Pen Gift Box,481975
PA70567,Parker Jotter Black Mech Pencil Gift Box,481983
PA70561,Parker Jotter Spec Blu Ball Pen Gift Box,481991
BC27824,Bic Cristal Me Bpen Value Pack Black,482005
BC27823,Bic Cristal Med Bpen Value Pack Blue,482095
BC27820,Bic Cristal Gel Value Pack Black,482102
BC27819,Bic Cristal Gel Value Pack Blue,482110
BC27210,Bic Cristal Lge Bpen 1.6mm Asst 895793,482128
DH25299,Dahle Trimmer Blue 00505,482135
DH24394,Dahle Professional Trimmer A3 442,482176
DH24396,Dahle Professional Trimmer A2 444,482184
DH24398,Dahle Professional Trimmer A1 446,482192
DH01552,Dahle Prem Rotary Trimmer 510mm A3 552,482216
DH00554,Dahle Prem Rotary Trimmer 720mm A2 554,482224
DH30533,Dahle Guillotine 340mm A4 533,482240
PI05935,Pilot V5 Rball Black P12 FOC Frixion Pk2,48247X
PI05936,Pilot V5 Rball Blue P12 FOC Frixion Pk2,48262X
PI05937,Pilot Frixion Pro Blk P12 FOC Frixion P2,48275X
VM90616,Verbatim Pinstripe USB Drv 4Gb Blk 49061,482881
PI05938,Pilot Frixion Pro Blu P12 FOC Frixion P2,48288X
VM90623,Verbatim Pinstripe USB Drv 8Gb Blk 49062,482898
VM90630,Verbatim Pinstripe USB Drv 16G Blk 49063,482938
VM90647,Verbatim Pinstripe USB Drv 32G Blk 49064,482946
CO29823,Canon Bp1200-Dts Prt Calc Gry 0850B001AA,482970
CO53846,Canon Mini Printing Calculator P23-DTSC,482988
CO53854,Canon Mini Printing Calculator P1-DTSC,482995
CO66535,Canon Desktop Calculator LS-80TEG,483000
SH03197,Sharp Ink Film Ribbon Fo15Cr Fo1460W,483510
BC10061,Bic Clic Medium Blue 901218,48463X
BC10062,Bic Clic Medium Black 901256,484648
BC91434,Bic Soft Feel Retr Ballpen Blue 914346,484656
BC91436,Bic Soft Feel Retr Ballpen Black 914360,484664
AV05272,Avery QR Code Label Square 35x35,484694
KC01203,Ripple Midi Jumbo Non Stop Disp Gry 6968,484699
AV05274,Avery QR Code Label Square 45x45,484718
AV05276,Avery QR Code Label Rectangular 80x35,484726
EP41069,Epson Photo Qlty Ij Ppr A3Plus Pk100,485384
DH00846,Dahle H/Duty Cutter 846 00846,48552X
DH00842,Dahle Guillotine Heavy Duty 00842,485538
PHT00117,Aluminium Frame Styrene A1 Paafa1B,485575
PI41742,Pilot Frixion Clicker 0.5mm Black,487453
PI41743,Pilot Frixion Clicker 0.5mm Red,487461
PI41744,Pilot Frixion Clicker 0.5mm Blue,487478
PI41756,Pilot Frixion Clicker 0.7mm Black,487486
PI41757,Pilot Frixion Clicker 0.7mm Red,487494
PI41758,Pilot Frixion Clicker 0.7mm Blue,487501
PI37519,Pilot Frixion Highlighter Ylw 467101205,487518
PI37520,Pilot Frixion Highlighter Grn 467101204,487526
PI37517,Pilot Frixion Highlighter Pink 467101209,487534
OL29246,Olivetti Inkjet Cart HiCap Blk IN702,488635
MI04100,Uni UB-150 Micro Black With 2 Free Pens,48870X
DH30534,Dahle Guillotine 460mm A3 534,489096
3M25551,3M Postit 102X152Mm Feint Rbow Pk6 660N,489130
3M87121,3M PostIt Energetic Rbow Pk12 38x51mm,489149
3M06269,3M Postit Index 1 Inch Sign Here 680-9,489238
MI04101,Uni UB-150 Micro Blue With 2 Free Pens,48928X
MI01395,Uni Posca PC3M Fine Marker Ast Pk6,489444
OL29257,Olivetti Inkjet Cart HiCap Colour IN704,489525
OL29258,Olivetti Inkjet Cartridge HiCap Photo,489533
EP14408,Epson Photoconductor Epl5500 S051029,489572
3M07137,Scotch 810 MagicTape 19x33 Pk12/2 FOC,489583
HPCB435AD,HP Laser Smart Print Cart Blk P2 CB435AD,489590
EP61540,Epson T061 Quad Inkjet Cartridge,489591
AO40618,Aurora 10Digit Scientific Calc SC582,489630
HPQ2612AD,HP Laser Ultra Print Cart Blk P2 Q2612AD,489655
EP48384,Epson Stylus Off WF7515 IJ MFC/Fax Blk,489663
EP544100,Epson Stylus Pro9600 Photo Black,489915
HPC5095A,HP No90 Inkjet Cart Black Pk3 C5095A,490241
HPC9390A,HP No70 IJet Cart LtCyan C9390A,490259
HPC9448A,HP No70 IJet Cart Blk C9448A,490267
HPC9449A,HP No70 IJet Cart Blk C9449A,490275
HPC9450A,HP No70 IJet Cart Grey C9450A,490283
HPC9451A,HP No70 IJet Cart LtGrey C9451A,490291
HPC9452A,HP No70 IJet Cart Cyan C9452A,490306
HPC9453A,HP No70 IJet Cart Magenta C9453A,490314
HPC9454A,HP No70 IJet Cart Ylw C9454A,490322
HPC9455A,HP No70 IJet Cart LtMagenta C9455A,490330
HPC9456A,HP No70 IJet Cart Red C9456A,490356
HPC9457A,HP No70 IJet Cart Grn C9457A,490364
HPC9458A,HP No70 IJet Cart Blue C9458A,490372
IB64016HE,Lexmark RP HY Toner Blk 0064016HE,490380
IB80D2954,Lexmark No17 Twin Pack Black 0080D2954,490411
IB80D2952,Lexmark No17/No27 Ink Cart Black/Col,490429
IB80D2126,Lexmark No16/26 Ink Cart Blk/Col 80D2126,490437
IB80D2956,Lexmark No32 Twin Pack Black 0080D2956,490487
BC01095,Bic Marker Perm Bullet Tip Black 2000092,490502
BC01099,Bic Marker Perm Chisel Tip Black 300093,490537
IC58978,Ibico Lamg Pch A2 80Mic Pk100 Ib589782,490553
RX29734,Rexel A3 Landscp Eco Pocket 2102578 Pk30,490554
IC58979,Ibico Lamg Pch A2 125Mic Pk100 Ib589799,490561
RX29733,Rexel A5 Eco Pocket 2102579 Pk30,490562
PI18249,Pilot Gel Ink Rollerball Black 051101201,49060X
IB80D2951,Lexmark No32/No33 Combo Pack Black/Col,490631
NB05262,Nobo 7 Day TCard Kit 29110,490901
NB38864,Nobo 12 Month Tcard Kit 32Slot 38864,49091X
NB38900,Nobo Tcard Size2 Wht Pk100 38900,490928
NB38911,Nobo Tcard Size3 Wht Pk100 38911,490936
NB38922,Nobo Tcard Size4 Wht Pk100 38922,490944
NB38908,Nobo Tcard Size2 Lblu Pk100 38908,490987
NB38919,Nobo Tcard Size3 Lblu Pk100 38919,490995
NB38902,Nobo Tcard Size2 Lgrn Pk100 38902,491044
NB38913,Nobo Tcard Size3 Lgrn Pk100 38913,491052
NB38924,Nobo Tcard Size4 Lgrn Pk100 38924,491060
NB38906,Nobo Tcard Size2 Red Pk100 38906,491109
NB38917,Nobo Tcard Size3 Red Pk100 38917,491117
NB38905,Nobo Tcard Size2 Pnk Pk100 38905,491133
NB38916,Nobo Tcard Size3 Pnk Pk100 38916,491141
NB38927,Nobo Tcard Size4 Pnk Pk100 38927,49115X
NB38904,Nobo Tcard Size2 Ylw Pk100 38904,491192
NB38915,Nobo Tcard Size3 Ylw Pk100 38915,491206
NB38926,Nobo Tcard Size4 Ylw Pk100 38926,491214
NB38879,Nobo Tcard Panel 24Slot Size2 33879,491265
NB38882,Nobo Tcard Panel 24Slot Size3 38882,491273
NB38885,Nobo Tcard Panel 24Slot Size4 38885,491281
NB38880,Nobo Tcard Panel 32Slot Size2 38880,491303
NB38883,Nobo Tcard Panel 32Slot Size3 32938883,491311
NB38886,Nobo Tcard Panel 32Slot Size4 32938886,49132X
NB38881,Nobo Tcard Panel 54Slot Size2 38881,491346
NB38884,Nobo Tcard Panel 54Slot Size3 38884,491354
NB38887,Nobo Tcard Panel 54Slot Size4 38887,491362
NB38888,Nobo Tcard Track 288Mm 38888,491370
NB38889,Nobo Tcard Track 772Mm 38889,491389
BT61326,BT Response 75+ Phone TAM Grey 045208,491524
BC25014,Bic Miss Bic For Her Ballpen Black,491630
BC25013,Bic Miss Bic For Her Ballpen Blue,491688
GE00400,Genicom Ribbon 4800I 4900I Blk 4A0040B05,491753
IB13405,Lexmark Optra K 1220 Lsr Tnr Blk 12A4605,491834
IB13076,Lexmark Optra K 1220 Tnr Blk Pk2 11A4097,491842
IB13075,Lexmark Optra K 1220 Print Unit 11A4096,491850
BA54409,Brother Thermal Transfer Ribbon Pc301,491885
OK5129,Oki Ep Cartridge Op10I 5129,491931
MI04102,Uni UB-157 Fine Black With 2 Free Pens,49226X
ES78445,Dymo Label Manager 210D S0784450,492584
ES18764,Dymo Tape ID1-12-1120 White,492631
ES18904,Dymo Rhino Perm Poly 9Mm Blk/Wht Pk5,492657
ES45811,Dymo 2000/5500 Tape 19Mm Wht/Blk 45811,492673
RM24727,Rexel Style Shredder 2101942,492704
RM24730,Rexel Style Plus Shredder 2101946,492712
RM19848,Rexel Prostyle Shredder 2101808,492720
RM24802,Rexel Oil Sheets 2101948 Pk12,492754
RM24803,Rexel Oil Sheets 2101949 Pk20,492762
VP79913,Versapak LightWt Security Pouch A3 Blue,492966
SS37649,Stabilo Executive Highlighter Yellow,493149
SS37652,Stabilo Executive Highlighter Green,493157
SS01986,Stabilo Exec Highlighter Wlt4 Assorted,493181
SS35486,Stabilo Mini Boss Astd Pk4 07/04-01,493199
DEL00208,Dell 2130CN Cart HY 2.5K Blk 593-10312,493816
DEL00210,Dell 2130CN Cart HY 2.5K Mag 593-10315,493824
DEL00211,Dell 2130CN Cart HY 2.5K Ylw 593-10314,493832
DEL00209,Dell 2130CN Cart HY 2.5K Cyn 593-10313,493840
