Code,Description,Spicer_Code
GB03077,Acco Slotted Lugg Card Pouch 125mic P100,000531
HX26834,Helix Metric/Imperial Metre Rule X82040,000825
JTCS75,Concord Index 5Part A5 Cs75,000884
JTCS70,Concord Index 1-5 A5 White Cs70,000906
JT02801,Concord Professional Index A4 Tax Year,000914
JT50799,Concord Bright Divider A4 6Pt Asst 50799,001030
JT50999,Concord Bright Divider A4 12Pt Ass 50999,001049
JT74099,Concord Subj Dvdr A4 20Pt Ast 74099/J40,001065
JT71190,Concord Divider 5Part A4 Multi 5Sets,001081
JT72090,Concord Divider 10Part A4 Multipac J20M,00109X
JT60199,Concord Bright Tel/Add Book A-Z Astd Pk5,001189
JT37202,Concord Dbl Pocket Wlt Buff 37202/372,001375
JT37203,Concord Dbl Pocket Wlt Blue 37203/372,001383
JT37204,Concord Dbl Pocket Wlt Green 37204/372,001391
JT37206,Concord Dbl Pocket Wlt Orange 37206/372,001413
JT37208,Concord Dbl Pocket Wlt Red 37208/372,00143X
JT37209,Concord Dbl Pocket Wlt Ylw 37209/372,001448
JT22202,Concord Transfer File 275G Buf 22202/222,001456
JT22203,Concord Transfr File 275G Blue 22203/222,001480
JT22204,Concord Transfer File 275G Grn 22204/222,001499
JT22205,Concord Transfer File 275G Gry 22205/222,001502
JT22206,Concord Transfer File 275G Org 22206/222,001510
JT22207,Concord Transfer File 275G Pnk 22207/222,001529
JT22208,Concord Transfer File 275G Red 22208/222,001537
JT22209,Concord Transfer File 275G Ylw 22209/222,001545
JT27202,Concord Tfr Pkt File 315G Buff 27202/272,001634
JT27203,Concord Tfr Pkt Files 315G Blu 27203/272,001642
JT27204,Concord Tfr Pkt File 315G Grn 27204/272,001650
JT27205,Concord Tfr Pkt File 315G Gry 27205/272,001669
JT27206,Concord Tfr Pkt File 315G Org 27206/272,001677
JT27207,Concord Tfr Pkt File 315G Pnk 27207/272,001685
JT27208,Concord Tfr Pkt File 315G Red 27208/272,001693
JT27505,Concord Tfr Pkt File 450G Gry 27505/275,001731
JT27506,Concord Tfr Pkt File 450G Org 27506/275,00174X
JT27508,Concord Tfr Pkt File 450G Red 27508/275,001766
JT27509,Concord Tfr Pkt File 450G Ylw 27509/275,001774
JT19099,Concord Nine Part File Fcap Asst Pk10,001863
JT43202,Concord Sqcut Fldr 270Gm Buff 43202/432,001871
JT43203,Concord Sqcut Fldr 270Gm Blue 43203/432,00188X
JT43204,Concord Sqcut Fldr 270Gm Grn 43204/432,001898
JT43205,Concord Sqcut Fldr 270Gm Gry 43205/432,001901
JT43206,Concord Sqcut Fldr 270Gm Org 43206/432,00191X
JT43207,Concord Sqcut Fldr 270Gm Pink 43207/432,001928
JT43208,Concord Sqcut Fldr 270Gm Red 43208/432,001936
JT43209,Concord Sqcut Fldr 270Gm Ylw 43209/432,001944
TX801296,Tippex Rapid Fluid 8012969,00215X
EL67208,Rolodex Vip V Business Card Tray Blk,002664
CO20171,Canon Toner Cartridge Black EP27,002924
SAM33327,Samsung Drum Unit SCX-6320R2/SEE,003034
SAM33322,Samsung TnrCart Black SCX-6320D8/SEE,003092
PEXZL31W,Pentel Micro Correct White Xzl31W,003171
SAM36286,Samsung TnrCart HY Black CLP-510D7K,003343
SAM36290,Samsung TnrCart Std Black CLP510D3K,003377
PI27974,Pilot V5 Grip Liquid Ink Rollerball Red,003392
PI27982,Pilot V7 Grip Liquid Ink Rollerball Red,003406
PI13290,Pilot Ballpen Fine Black Bpsgp01,003414
PI13291,Pilot Ballpen Fine Red 203101202,003422
PI13292,Pilot Ballpen Fine Blue Bpsgp03,003430
PIG105R,Pilot Gel Ink Rollerball 0.5Mm Rd G10502,003449
PI15892,Pilot Rball Grip Pen Gel Fine Red,003465
PISCGF,Pilot Gold Marker Bullet Fine Scgf,003473
PISCGM,Pilot Gold Marker Bullet Medium Scgm,003481
PISCSF,Pilot Silver Marker Bullet Fine Scsf,00349X
PISCSM,Pilot Silver Marker Bullet Med Scsm,003511
PIV5GN,Pilot Hitecpoint Ultra 0.3 Green Bxv5,003546
RE03015,Calcroll 44X57Mm Roltech R15A,003686
SAM36287,Samsung TnrCart HY Cyan CLP-510D5C,003806
SAM36147,Samsung TnrCart Std Cyan CLP510D2C,003911
SW02061,Footrest Black Wedo Mp50,003988
SAM36288,Samsung TnrCart HY Magenta CLP-510D5M,004021
EP15077,Epson Ribbon Colour Lq300 S015077,004583
BY00406,Bisley Cardindex 8X5In Single C/C Fcb15,004754
BY00427,Bisley Cardindex 6X4In Double C/C Fcb24,004770
BY00436,Bisley Cardindex 8X5In Double C/C Fcb25,004789
HPC5019A,HP No84 PHead Blk C5019A,004931
GHT253,Guildhall Company Visitors Book T253,005067
GH3152,Europa Major Pad Asstd Pk10 3152,005172
GH4510,Guildhall Ergonomic Binder A4 Red,005199
GH4511,Guildhall Ergonomic Binder A4 Yellow,005202
GH4785,Europa A3 Wallet 32Mmcap Dark Blue 4785,005288
GH4823,Europa Squarecut Fldr Fcp Green 4823,005342
GH4825,Europa Squarecut Fldr Fcp Dark Bu 4825,005350
GH4828,Europa Squarecut Fldr Fcp Red 4828,005377
GH4880,Europa Major Pad Assorted Pk10 4880,00544X
GH4953,Europa Cash Book A4 4Cash Green 4953,005466
GH4976,Europa Cash Book A4 6Cash Yellow 4976,005482
GH4984,Europa Cash Book A4 14Cash Lilac 4984,005490
GH06044,Business Card Binder 128 Dlx Bu Dbcb4/Bl,005520
GH06078,Business Card Binder 9Pkt A4 Blue,005539
GH06057,Guildhall Address Book Rfl Fnt A4 Ga4/R,005563
GH06056,Guildhall Address Book Rfl Fnt A5 Ga5/R,005571
GH06061,Business Card Refill Clear Pk5 Gbc/R,00558X
GH06079,Business Card Binder Ref A4 Gbc9/R Pk5,005598
GH01951,Guildhall Visitor Bk Loose Lcape Blu T40,005601
GH01952,Guildhall Visitor Bk Refill A4 T40/R,00561X
CH2026,Chartwell Survey Bk 5X8In Field 2026,005628
CH2242,Chartwell Survey Bk 4X6.5In Dimensn 2242,005644
CHCVDR1,Chartwell Vehicle Defect Report Pad,005660
GH65011,Goldline Colour Board 450X640Mm Pk10 Wht,005741
GH65012,Goldline Colour Board 450X640Mm Pk10 Blk,00575X
BY00381,Bisley Cardindex 5X3In Single Grey Fcb13,005857
BY00393,Bisley Cardindex 6X4In Single Grey Fcb14,005881
BY00415,Bisley Cardindex 8X5In Single Grey Fcb15,005911
BY00423,Bisley Cardindex 5X3In Double Grey Fcb23,005946
BY00431,Bisley Cardindex 6X4In Double Grey Fcb24,005970
GH06010,Business Card Holder 128 Classic Black,005989
GH06128,Goldline Bus Card Holder 3 Up Black,005997
BY00442,Bisley Cardindex 8X5In Double Grey Fcb25,006003
BY00031,Lock For Card Index Drawer Fcb21A,006011
GH06133,Goldline Bus Card Holder 64 Pocket Blk,006062
RSCHR,Royal Sov Chinagraph Pencil Red 52785,006089
SAM36291,Samsung TnrCart Std Magenta CLP510D2M,006110
EA49215,El Rigid Storage Case Xdeep 5In 49215,006135
RSCHBK,Royal Sov Chinagraph Pencil Black 52563,006151
EA30115,El Classic Boxfile Locksprng Fc Bk 30115,006208
EA30145,El Classic Boxfile Locksprng A4 Bk 30145,006216
SAM36289,Samsung TnrCart HY Yellow CLP-510D5Y,006225
SAM36295,Samsung TnrCart Std Yellow CLP510D2,006233
SAM36297,Samsung Drum Unit CLP-510RB/SEE,006241
RSCHY,Royal Sov Chinagraph Pencil Yellow 52595,006348
RSCHW,Royal Sov Chinagraph Pencil White 52305,006399
SAM36296,Samsung Image Transfer Belt CLP510,006411
EA28143,El Colorado 80 L/Arch A4 Blue 28143,006445
EA28144,El Colorado 80 L/Arch A4 Green 28144,00647X
EA28148,El Colorado 80 L/Arch A4 Red 28148,006526
EA28149,El Colorado 80 L/Arch A4 Yellow 28149,006534
EA28113,El Colorado 80 L/Arch Fc Blue 28113,006623
EA26115,Eastlight Classic70 L/Arch Fc Rado 26115,00664X
EA26145,Eastlight Classic70 L/Arch A4 Rado 26145,006658
EA26615,Eastlight Standard 75 L/Arch Fc 26615,006682
EA26645,Eastlight Classic 75 L/Arch A4 26645,006690
BX00145,Elba A4 25mm 4D Ring Pres Binder White,007327
BX00160,Elba A4 40mm 4D Ring Pres Binder White,007378
BX05110,Elba A4 50mm 4D Ring Pres Binder White,007440
BX05111,Elba A4 50mm 4D Ring Pres Binder Red,007459
BX130101,Bantex 4R Binder Pvc A4 Blue 100080876,007599
BX130109,Bantex 4R Binder Pvc A4 Red 100080880,007610
BX130110,Bantex 4R Binder Pvc A4 Blk 100080881,007629
CO25247,Canon Photo Album c/w 13x18cm Ppr Pk10,007937
EP48B40,Epson Inkjet Multi Pack T048B40 LC/LM/Y,007979
EA43212,Eastlight Jiffex File Fcp Buff 43212,008322
EA43213,Eastlight Jiffex File Fcp Blue 43213,008330
EA43214,Eastlight Jiffex File Fcp Green 43214,008349
EA43217,Eastlight Jiffex File Fcp Pink 43217,008365
RX12153,Nyrex Folder A4 Pvc Flush Clear P25 Fca4,008705
RX12265,Copyking Pocket Poly Ckp/A4 Pk100,008772
EP48C40,Epson Inkjet Multi Pack T048C40 C/M/BK,008788
EP44140BA,Epson Durabrite Quad Pack T044140BA,009199
HPC4871A,Hp No80 Inkjet Cart 350Ml Black C4871A,009270
HPC4846A,Hp No80 Inkjet Cart 350Ml Cyan C4846A,009289
HPC4847A,Hp No80 Inkjet Cart 350Ml Magenta C4847A,009297
HPC4848A,Hp No80 Inkjet Cart 350Ml Yellow C4848A,009300
HPC4820A,Hp No80 Phead Cleaner Blk C4820A,009343
HPC4821A,Hp No80 Phead Cleaner Cyn C4821A,009351
HPC4822A,Hp No80 Phead Cleaner Mag C4822A,009378
HPC4823A,Hp No80 Phead Cleaner Ylw C4823A,009386
EP55640BA,Epson IJ Cart Photo Quad Pk C13T055640BA,009644
RX13045BU,Nyrex80 Projectfile A4 Blue Pk5 13045Bu,009719
RX13045R,Nyrex80 Projectfile A4 Red Pk5 13045R,009743
RX13035BU,Nyrex80 Boardroom File A4 Blue Pk5 Brfa4,009816
RX13035R,Nyrex80 Boardroom File A4 Red Pk5 Brfa4,009859
EP08403,Epson Inkjet Twin Pack T008403 Colour,009995
EA28243,El Colorado 50 Miniarch A4 Blue 28243,010007
EP09402,Epson Inkjet Twin Pack T009402 Colour,010221
EA30443,Colorado Boxfile Lockspring A4 Bu 30443,010325
EP27403,Epson Inkjet Twin Pack T027403 Colour,010344
EA30448,Colorado Boxfile Lockspring A4 Red 30448,01035X
EA30413,Colorado Boxfile Lockspring Fc Bu 30413,010376
HPQ6591A,HP Superior Matt 180 IJet Ppr A3 Q6591A,010548
HPQ6592A,HP Superior Matt 180 IJet Ppr A4 Q6592A,010572
BI2350,Note Block Refill 700Sheet White Bi2350,010635
BI2351,Note Block Refill 700Sheet Col Bi2351,010643
BI1012,Fluorescent Copier Ppr A4 Ast Pk100 1012,010848
BI1020,Duo Tone Fluor Paper A4 Ast Pk100 1020,010856
PA03063,Quink Cartridges R/Blue Washable Pk5,011045
RF216081,Blotter Commercial Demy Blk 216081,01107X
RF215981,Blotter Commercial H/Demy Blk 215981,011118
RF211281,Blotter Military End Demy Blk 211281,011150
RF215881,Blotter Military End H/Demy Blk 215881,011193
HPQ6593A,HP Prof Inkjet Ppr 120g Matt A4 Pk200,011585
ED41255,Uhu White Tack 42196,011592
HPQ6594A,HP Prof Inkjet Ppr 120g Matt A3 Q6594A,011632
HPQ5942A,HP Laser Tnr LsrJet Smart Blk Q5942A,011690
ED45611,Uhu Stick 21G 45611,011738
ED45621,Uhu Stick 40G 45621,011746
PB24242,Postsafe Env S/S 240X320Mm Clr Pk100 P24,011819
PB25252,Postsafe Env S/S 240X320Mm Opq Pk100 P25,011827
PB26262,Postsafe Env S/S 440X320Mm Opq Pk100 P26,011835
PB27272,Postsafe Env S/S 430X400Mm Opq Pk100 P27,011843
PB28282,Postsafe Env S/S 460X430Mm Opq Pk100 P28,011851
PB29100,Postsafe XS Peel 595x430/60mm Opq P100,01186X
PB30303,Postsafe Env S/S 440X320Mm Clr Pk100 P30,011878
PB32324,Postsafe Env S/S 335X430Mm Opq Pk100 P32,011886
PB33333,Postsafe Env Tamper 220X305Mm Pk100 P33,011894
PB36363,Postsafe Env Tamper 165X260Mm Pk100 P36,011916
SK11151,Snopake Polyfile Fcp Blue 11151,012024
SK11154,Snopake Polyfile Fcp Clear 11154X,012032
SK02692,Snopake Poly Ring Bndr A4 25Mm Blu 10180,012075
SK02701,Snopake Poly Ring Bndr A4 25Mm Clr 10183,012083
SK03115,Snopake Clampbinder Superline Clr 12772,012113
SK02597,Snopake Polyfile Fcp Plus Pink 11163,01213X
SK02651,Snopake Polyfile Fcp Plus Purp 11162,012148
SK02603,Snopake Polyfile Fcp Plus Electra Turq,012156
SK02921,Snopake Polyfile Fcp Electra Blue 11164,012164
SK02633,Snopake Polyfile Fcp Plus Emerald Green,012172
SK10088,Snopake P/File Plus Fc Electra Ast Pk5,012180
SK11355,Snopake Polyfile A5 Electra Ast P5 11355,012199
SK03060,Snopake A4 Disp Book 10Pckt Asstd Pk10,012253
HPQ5942X,HP Laserjet Smart HY Cart Q5942X Blk,012271
SK03100,Snopake A4 Disp Book 24Pckt Asstd Pk10,012288
SK03902,Snopake A4 2RBinder 25mm Electra Purp,01230X
SK03894,Snopake A4 2RBinder 25mm Electra Blue,012334
SK10165,Snopake 2R Electra A4 25Mm P10 Ast 10165,012350
HPQ5949A,HP LaserJet Smart Cartridge Q5949A Black,012459
HPQ5949X,HP LaserJet Smart Cart Hi Cap Q5949X Blk,012475
SK02813,Snopake Clamp Binder Asst 12790 Pk10,012520
SK11756,Polyplus Wlt Electra A4 Asst Pk5 11756,012555
PA03164,Parker Vector Rball Black 03164,012687
SK12565,Snopake Polyfile Id Bright Ast Pk5 12565,012695
SK11892,Snopake Organiser 6Part Dark Blue 11892,012717
MIUB155BK,Uniball Micro Deluxe 0.2Mm Black 155,013062
MIUB155BU,Uniball Micro Deluxe 0.2Mm Blue 155,013070
MI150BK,Uniball Micro Eye 0.2Mm Black Ub150,013089
MI150BU,Uniball Micro Eye 0.2Mm Blue Ub150,013097
MI157BK,Unieye Fine Rollerball Black Ub157,013100
ST33170,Staedtler Lumocolor Sf Perm Black 313-9,013143
ST33165,Staedtler Lumocolor Sf Perm Blue 313-3,013151
ST33164,Staedtler Lumocolor Sf Perm Red 313-2,01316X
MI157BU,Unieye Fine Rollerball Blue Ub157,013178
PA03062,Quink Cartridges Perm Blue Pk5,013208
ST33192,Staedtler Lumocolor M Wbase Black 315-9,013259
ST33187,Staedtler Lumocolor M Wbase Blue 315-3,013267
MI92894,Uniball Gel Grip Rollerball Black,013283
MI92895,Uniball Gel Grip Rollerball Blue,013291
PA9302,Parker Rollerball Refill Medium Blue,013305
MI92826,Uniball Gel Impact Rollerball Black,013313
PA03123,Parker Vector Fpen Black Medium 67407,013321
ST33222,Staedtler Lumocolor M Perm Black 317-9,013364
ST33217,Staedtler Lumocolor M Perm Blue 317-3,013372
ST33216,Staedtler Lumocolor M Perm Red 317-2,013380
MI92827,Uniball Gel Impact Rollerball Blue,013399
AR83025,Artline Pen 0.4Mm Tip Black 200,013402
AR83026,Artline Pen 0.4Mm Tip Blue 200,013410
AR83027,Artline Pen 0.4Mm Tip Red 200,013429
ST33212,Staedtler Lumocolor F Wbase Black 316-9,013496
ST33200,Staedtler Lumocolor F Wbase Blue 316-3,01350X
ST33247,Staedtler Lumocolor F Perm Black 318-9,013542
ST33231,Staedtler Lumocolor F Perm Blue 318-3,013550
ST33227,Staedtler Lumocolor F Perm Red 318-2,013569
AR80151,Artline Marker Black 70,013585
HM13201,Monolith Lrg Whled Nylon Pilots Case Blk,013836
HM2271,Monolith Pilots Case Bonded Leather Blk,013844
HM50090,Masters Nylon Laptop Workstn Case Black,013852
HM2765BK,Monolith Briefcase Softsided Black 2765,013879
ED500BK,Edding Permanent Marker Black 500,01405X
BC13672,Bic Atlantis Retract Bpen Red 1199013672,014084
CO86855,Canon High Res Ppr A3 Pk100 Hr-101A3,01419X
CLEAB1,Collins Account Book Essential Eab1,014203
CL76752,Collins Ideal Book Double Cash 192pp,01436X
CL76751,Collins Ideal Book 11.75x6 Feint 192pp,014416
CL76743,Collins Ideal Book A5 Feint 192pp 468R,014424
CL76744,Collins Ideal Book A6 Feint 192pp 418R,014475
CL76742,Collins Ideal Book A4 Feint 192pp 6428R,014483
JFBW,Jiffy Bubblefilm Roll 750Mmx75M Sl20,01470X
ES26900,Orgarex Lat Insert Wht Org Tip Pk10x25,014718
ES21630,Orgarex 50mm Lateralfile A4 21630 P25,014742
PI15492,Pilot Supergrip Bpoint Pen Red 215101202,014831
PA03061,Quink Cartridges Perm Black Pk5,015071
PA9301,Parker Rollerball Refill Medium Black,015101
AG15772,Addis President Pump Pot 2Lt Chrome,01511X
BR67964,Berol ToughPoint Marker Bullet Blk,015209
AG17514,Addis Neo 8 Cup Cafetiere Black 1235089,015292
PA03065,Quink Cartridges Perm Blue/Black Pk5,015306
AG813417,Addis 48Ltr Rolltop Bin Metallic,015373
AG813411,Addis Dustbin Round 90Litre Grey,015462
SEC00331,Standard Uv Lamp Red/Black Pssuvl,015691
ED49814,Edding 751 Paint Marker Silver 751-054,015713
AL17391,Durable 14.7Ltr Cylinder Metal Bin Silv,015950
PE99859,Pentel Pencil Sharplet-2 0.5Mm Blk A125A,015993
SS7058,Stabilo Boss Pen Lilac 70/58/10,016050
SS7024,Stabilo Boss Pen Yellow 70/24/10,016069
SS7033,Stabilo Boss Pen Green 70/33/10,016077
SS7054,Stabilo Boss Pen Orange 70/54/10,016085
SS7056,Stabilo Boss Pen Pink 70/56/10,016093
SS7031,Stabilo Boss Pen Blue 70/31/10,016107
BB85332,Fellowes 64 Capacity CD Wallet Black,016132
PE04026,Pentel Clutch Pencil 0.9Mm P209,016212
PE04025,Pentel Clutch Pencil 0.7Mm P207,016220
PE04024,Pentel Clutch Pencil 0.5Mm P205,016239
PE100HB,Pentel Leads 0.5Mm Tube12 Hb C505-Hb,016263
PE50HB,Pentel Leads 0.7Mm Tube12 Hb 50,016271
PEPPSHB,Pentel Leads 0.9Mm Tube15 Hb 50/Hb9,01628X
PEX100W,Pentel Valve Marker Bullet White X100W,016441
PEM180BK,Pentel Marker Chisel Tip Black M180/6-A,01645X
PEM180BU,Pentel Marker Chisel Tip Blue M180/6-C,016468
PEM180R,Pentel Marker Chisel Tip Red M180/6-B,016476
PEN50BK,Pentel Marker Bullet Tip Black N50-A,016506
PEN50R,Pentel Marker Bullet Tip Red N50-B,016514
PEN50BU,Pentel Marker Bullet Tip Blue N50-C,016522
PEN50GN,Pentel Marker Bullet Tip Green N50-D,016530
MK9795,Igenix 4Slice S/Steel Toaster Ig3204,016557
PES520BK,Pentel Signpen Fibretip Black S520-A,01659X
PES520R,Pentel Signpen Fibretip Red S520-B,016603
PES520BU,Pentel Signpen Fibretip Blue S520-C,016611
HM23580,Monolith Deluxe Laptop Case Blk 2358,016727
PEF50BK,Pentel Marker Chisel Tip Black F50-A,016832
PER50BK,Pentel Ballpentel Fine Black R50-A,016956
PER50BU,Pentel Ballpentel Fine Blue R50-C,016964
PER50R,Pentel Ballpentel Fine Red R50-B,016972
HM10181,Mesh Paper Clip Pot Black 10181,016980
PES570BK,Pentel Ultrafine Pen Black S570-A,017005
PES570BU,Pentel Ultrafine Pen Blue S570-C,017013
PES570R,Pentel Ultrafine Pen Red S570-B,017021
PES570GN,Pentel Ultrafine Pen Green S570-D,01703X
PE05151,Pentel Fpen Marble Barrel Black Jm20Mb-A,017129
AR80254,Artline Marker Black 90,017498
BR30126,Berol Colourfine Black Cf01,017501
UP20031,FF Vision Panoramic Print Fga119,017811
PEN60BK,Pentel Marker Chisel Tip Black N60-A,018078
PEN60BU,Pentel Marker Chisel Tip Blue N60-C,018086
PE1002B,Pentel Leads 0.5Mm Tube12 2B C505,018132
PE100H,Pentel Leads 0.5Mm Tube12 H C505,018140
PE1002H,Pentel Leads 0.5Mm Tube12 2H C505,018159
ST52450,Staedtler Mars Plastic Eraser 526-50,018221
ST10980,Staedtler Noris Pencil 2B 120-2B,018256
ST10982,Staedtler Noris Pencil Hb 120-Hb,018272
ST10987,Staedtler Noris Pencil 2H 120-2H,018299
ST41079,Staedtler Stick Bpen Fine Black 430-F9,018302
ST41067,Staedtler Stick Bpen Fine Blue 430-F3,018310
ST41061,Staedtler Stick Bpen Fine Red 430-F2,018337
ST41095,Staedtler Stick Bpen Med Black 430-M9,018353
ST41089,Staedtler Stick Bpen Med Blue 430-M3,018361
ST41086,Staedtler Stick Bpen Med Red 430-M2,01837X
DF47201,Deflecto Wall Sign Hldr A3 Portrait Clr,018868
DF46901,Deflecto Wall Sign Hldr A4 Landscape Clr,018876
DF47001,Deflecto Wall Sign Hldr A4 Portrait Clr,018884
ED180001BK,Edding Profipen 0.1 Black 1800,018914
ED180003BK,Edding Profipen 0.3 Black 1800,018922
ED180005BK,Edding Profipen 0.5 Black 1800,018930
DF47401,Deflecto Slanted Sign Holder A4 Clear,018949
DF47501,Deflecto Slanted Sign Holder A5 Clear,018957
DF47701,Deflecto Stand Up Sign Hldr A4 Lscp Clr,018965
DF47801,Deflecto Stand Up Sign Hldr A4 Port Clr,018973
DF47901,Deflecto Stand Up Sign Hldr A5 Port Clr,018981
DF48601,Deflecto Tent Sign Holder A4 Clear 48601,01899X
DF55501,Deflecto Stand Tall Lit Rack A4 55501,019030
GL03119,Sharpie China Marker Bullet Blk S0305071,019103
DF77501,Deflecto Lit Holder 1/3 A4 Clear 77501,01912X
DF74901,Deflecto Lit Holder A5 Clear 74901,019146
GL03218,Sharpie China Marker Bullet Red S0305081,019154
GL03515,Sharpie China Marker Bullet Ylw S0305101,019170
DF77001,Deflecto Lit Holder A4 Clear 77001,019189
CO94523,Canon Blk/Col Ink Tank and GP401 4x6 FOC,01918X
DF74501,Deflecto Lit Holder 2X1/3 A4 Clear 74501,019197
DF70101,Deflecto Business Card Holder 70101,019200
DF77701,Deflecto Lit Holder Dl 4 Tier Clr 77701,019219
DF77901,Deflecto Lit Holder A5 4 Tier Clr 77901,019227
DF77301,Deflecto Lit Holder A4 3 Tier Clr 77301,019235
DF52209,Deflecto Lit Holder A4 8Pckt Gry/Clear,019251
DF53009,Deflecto Lit Holder A5 4Pckt Gry/Clear,019308
DF76091,Deflecto Flat Back Lit Hldr 1/3 A4,019340
DF76391,Deflecto Literature Holder A5 Flat Back,019359
DF76491,Deflecto Literature Holder A4 Flat Back,019375
DF70801,Business Card Holder Desk 8P Clear 70801,019413
RH98112,Hp Office Paper A4 Wht Pk500 80G Hpf0317,019537
GL10701,Papermate Pencil Non-Stop Hb 10701,019626
PE17848,Pentel Clic Eraser With Rubber Grip,020054
MA99313,Mailing Box 270X190X80Mm Pk25 57Fp03,020097
MA99314,Mailing Box 330X270X80Mm Pk25 57Fp07,020100
BX03218,Elba Bright Square Cut Fldr FCap Purp,02136X
BX03220,Elba Bright Square Cut Fldr FCap Blue,021378
BX03226,Elba Bright Square Cut Fldr FCap Ylw,021408
AV03216,Elba SqCut Fldr Fcap Bright Astd P25,021416
BC74106,Bic Velleda Whiteboard Marker Blue,021555
BC41098,Bic Velleda DWipe Marker Black 1741,021563
EL67236,Rolodex Business File Black 400Cap 67236,02167X
EL67237,Rolodex Clas 200 Rot BusCard File Chrm,021688
EL67691,Rolodex BusCard Sleeves Clr Pk40,021718
AV98896,Avery Lsr 60Mm Boxfile Lbl 12Tv Pk25 Wht,022055
DW05501,Danone Evian Water 50cl A0103912 P24,022071
RX12010,Nyrex Cardholder 3.75X2.5 Pk25 Pgc321,02211X
RX12020,Nyrex Cardholder 5X3 Pk25 Pgc531,022128
RX12060,Nyrex Cardholder A5 Pk25 Pgca5,022160
DW06301,Danone Evian Water 33cl A0106212  P24,022179
RX12081,Nyrex Cardholder A4 Short Pk25 Pgca41,022187
RX12121,Nyrex Cutback Fldr Clr Pvc P25 12121,022225
DW11164,Volvic Water 50cl 11080022 P24,022322
RX12233,Nyrex Pocket Pvc Opentop Clear P25 Npra4,022462
RX12253,Nyrex Pocket Pvc Opedge Clear Pk25 Pra4L,022489
RX12263,Nyrex Pocket Pvc Opedge Clear Pk25 R149L,022497
CPD01890,Parozone Bleach 750ml KJEYSPB,022608
CPD54850,Finish Dishwasher Cleaner 250ml,022772
QM01829,Konica Magicolor 330 Toner Cartridge Blk,023433
QM01830,Konica Magicolor 330 Toner Cartridge Cyn,023441
QM01832,Konica Magicolor 330 Toner Cartridge Mag,02345X
QM01831,Konica Magicolor 330 Toner Cartridge Ylw,023468
SS14646,Write-4-All Pen Perm Blk Med 1Mm 146/46,023662
ST53063,Staedtler Rasoplast Eraser 526-B30,023700
BZ91080,Knorr In Cup Chicken Soup Pk25 A06091,023859
SS13467,Stabilo Swing Cool Hltr Yellow 275/24,023875
OL80805,Olivetti Liftoff Tape Etcart 80805A,024498
BK00181,Bostik Blu-Tack Handy Pack 60Gm,024552
HK1033,Pritt Stick Standard 11G 1478529,024900
HK1034,Pritt Stick Medium 20G 1034/1734 2002,024927
HK1035,Pritt Stk 43G Db 24X3 Uk,024935
SE0244,Sellotape Case Sealing Tape 38Mmx66M,025000
SE0246,Sellotape Case Sealing Tape 50Mmx66M,025019
HK20752,Pritt Sticky Tac White 841737,025086
SE2280,Sellotape Doublesided Tape 12Mmx33M 2280,025108
SE2281,Sellotape Doublesided Tape 25Mmx33M,025116
SE2294,Sellotape Doublesided Tape 50Mmx33M 2294,025124
SE15501,Sellotape Doublesided Tape 15Mmx5M 5501,025132
SE0032,Sellotape Clear 18Mmx66M 0032,025566
3M66729,Scotch 810 Magic Tape 19Mmx33M,025701
3M66725,Scotch 810 Magic Tape 12Mmx66M,02571X
3M66726,Scotch 810 Magic Tape 19Mmx66M,025728
3M66740,Scotch 810 Magic Tape 25Mmx66M,025736
3M01401,3M Postit Note 38X51Mm Yellow 266,025833
3M01403,3M Postit Note 76X76Mm Yellow 654,025841
3M01417,3M Postit Note 76X127Mm Yellow 655,02585X
AVOML102,Avery Micro Lbl 102X37 1W Pk1000 Oml102,026677
AVOML103,Avery Micro Lbl 102X49 1W Pk750 Oml103,026693
AVOML14,Avery Wp Lbl 98X38 A4/14 1400 Oml14,026707
AVDPS16W,Avery Copier Lbl 105X37 Wht Pk100 Dps16,026731
AVDPS08W,Avery Copier Lbl 105X71 Wht Pk100 Dps08,02674X
AV52001,Avery Franking Lbl Dbl All MC Wht AVFL01,026758
WV6500P,Legal Tape 6Mmx500M Pink,027281
WV00070,Pink Tape 3/8In 500 Metre Reel,02729X
JT23603,Concord Computer File 413X11 Blue 23603,027338
JT23503,Concord Computer File 394X11 Blue 23503,027362
LX10730,Scalerule Triangular 100-500 30Cm 312,027842
LX10175,Scalerule Triangular 500-2500 30Cm 314,027850
LX10178,Scalerule Triangular 1-15-100 30Cm 318,027869
LX19342,Template Combi And Ink Bosses Gn 11705,027877
EP50033,Epson Aculaser C2000 Toner Black,028414
EP41332,Epson Premium S/Gls Photo Ppr A4 Pk20,028430
EP41334,Epson Premium S/Gls Photo Ppr A3 P20,028481
EP41342,Epson A4 Archival Matte Paper Pk50,02849X
EP15073,Epson Ribbon Colour Lx300 S015073,028503
BA54416,Brother Therm Rbn Refill Blk Pk2 Pc302Rf,028724
BA54423,Brother Therm Rbn Refill Blk Pk4 Pc304,028732
BRT10879,7Up Diet 330ml Can Pk24 3389,028740
BRT12423,Britvic Orange Juice Can 330ml Pk24,028767
SE04529,Sellotape Bench Dispenser Chrome Small,029029
3M39784,Postit Index Millenium Disp 3 Bright Col,031625
3M39781,3M Postit Znote Millenium Disp 1 Ylw Pad,031633
RE07004,Calculator Roll 57X57Mm 2Ply R7Cl2,034001
RE04001,Cashrolls 44X80Mm White Cr1,034060
RE04004,Cashrolls 37.5X70Mm White Cr4,034095
CPD70014,Duster Yellow Pk10,034729
RE03008,Calculator Roll 57X57Mm Roltech R7A,035104
DB80026,Durable Sec Badge No Clip 60x90 Pk20,036134
DB80009,Durable Textile Necklc 20mm Blk P10 8137,036150
DB80013,Durable Textile Necklc 20mm Blu P10 8137,036177
DB80022,Durable Combi Name Badge Set 54x90 Ast,036215
RE05003,Telex Roll 214X120Mm 3Ply White Tr83,036975
MA14574,Kraft Paper Roll 600X250 Nat Ikr-070-060,037636
MA14575,Kraft Paper Roll 750X250 Nat Ikr-070-075,037865
EV707SD,Evrite Account Book Trader Week 707Sd,037911
EV701SD,Evrite Analysis Book Trader Week 701Sd,03792X
WS22781,Clipper Foldback Clip 25mm Black P100,038283
AR1001,Xstamper Air Mail Red 1001,038704
AR1005,Xstamper Paid Blue 1005,038712
AR1006,Xstamper Copy Blue 1006,038739
AR1038,Xstamper Checked Red 1038,038771
AR1071,Xstamper File Copy Red 1071,03881X
AR1103,Xstamper Urgent Red 1103,038836
AR1130,Xstamper Confidential Red 1130,038887
AR2004,Xstamper Account Overdue Blue-Red 2004,038895
AR2010,Xstamper Private And Confid Blue-Red,038909
HK30043,Pritt GlueDots Pk64 Clear 1444964,039147
GH42159,Europa 13 Pocket Expanding File Assorted,039244
NB17089,Nobo Shark Easel 1901918,040245
MA76451,Polypropylene Twine 2.25Kg White,040359
JT79701,Concord Divider A4 10Part White 79701/97,041923
BP88001,Blotting Paper White H/Demy 445x285 Pk25,042007
HPQ2519A,HP Prem Glsy Photo Ppr A4 240gsm Pk20,042635
3M51839,3M Spraymount Adhesive 400Ml 3M,043002
3M50773,3M Photomount Adhesive 400Ml 3M,043010
3M50786,3M Photomount Adhesive 200Ml 3M,043029
3M50754,3M Spraymount Adhesive 200Ml 3M,043037
HG58167,Folio L/Tray Wire/Plastic A4 Red 580067,043134
HG58169,Folio L/Tray Wire/Plastic A4 Grey 580069,043142
MY44CH,Avery Systemtray Charcoal Black 44Ch,043975
MYW44BU,Avery Lettertray Wide Blue W44,044822
BB725,Fellowes R-Kive Prem Presto Stor Box Wgn,045526
BB00531,Fellowes R-Kive Prem Trans File WoodGrn,045534
WAC10649,WAC Micro Rack of 3 1044158,04578X
PE19759,Pentel Energel XM Metal Tip Rball Black,046643
PE19762,Pentel Energel XM Metal Tip Rball Red,046651
PE19765,Pentel Energel XM Metal Tip Rball Blue,046669
EP50268,Epson Alc1100/Cx11 Series Econ Toner Pk4,046732
RX02030,Rexel Giant Stapler (66) 02030,04708X
BA63367,Brother Laser MF Fax Machine MFC7225N,047436
SK70721,Swordfish Scalpel Bld No10 Pk100 43800,047470
SK70724,Swordfish Scalpel Bld No10A Pk100 43802,047489
SK70722,Swordfish Scalpel Bld No11 Pk100 43801,047497
MA20490,Jiffy Bubble Film Bag 230x280x40 Pk300,047680
MA20491,Jiffy Bubble Film Bag 280x375x50 Pk150,047698
