Code,Description,Spicer_Code
DEL10294,Dell Photo 966 Ink Cart StdCap Blk DH828,234560
PA02045,Quink 2Oz Permanent Black Ink 02166,234566
DEL83326,Dell 720/A920 Inkjet Cart Black T0529,234578
PA06633,Rollerball Refill Medium Black 06633,234582
DEL99867,Dell A922 Inkjet Cartridge HY 380pg Blk,234593
DEL81530,Dell Ink Cartridge HiCap Colour M4646,234600
SK11382,Snopake Polyfile A5 Clear 11382,234620
BA66943,Brother Col IJet Multi Prntr DCP195CZU1,234625
BA67050,Brother Mono Lsr Multi Prnt DCP8070DZU1,234682
BA66606,Brother HL3040CN Colour Laser Printer,234714
BA66607,Brother HL3070CW Colour Laser Printer,234722
BA67005,Brother Laser Colour MFC DCP-9010CN,234730
BA67006,Brother MFC9120CN MFC Machine,234748
BA67007,Brother MFC9320CW MFC Machine,234755
CO63813,Canon Pixma iX7000 Colour Inkjet Printer,235038
SAM45862,Samsung CLX-6220FX Colour Laser MFP,235045
SAM45863,Samsung Colour Laser Printer CLP-670ND,235101
CO53363,Canon Camera Powershot D10 Blue/Silver,235150
CO54079,Canon Ixus 120Is Camera Silver,235191
3M18644,Imation CD-R 700Mb/80min Pk10 18644,235208
ES90496,Dymo Label Writer 4XL S0904960,235468
ES90498,Dymo XL Shipping Lbl S0904980,235475
PQ28314,Philips Laser Fax Machine LPF 5125,235556
HPC9299A,HP OfficeJet 7000 Printer C9299A,235598
OM02062,Olympus Dig Camera Midnight Blk Mju 9000,235750
3M70688,3M Postit Index Red 1Inch 680-1,235855
3M70755,3M Postit Index Yellow 1Inch 680-5,235871
3M70689,3M Postit Index Blue 1Inch 680-2,235901
CHJ6Q4B,Chartwell Graph Pad A4 5Mm Quad J6Q4B,235936
HPCE830C,HP Col LJ Tnr Blk CE830C,236405
MY1132BK,Avery Myers Duet Lettertray Black 1132,236438
KC00224,Kleenex Freq HandClean Unperf 1Ltr,236818
OB83364,OB HP Toner Black Q5949A,237129
OB10220,OB HP Toner HC Black Q5949X,237137
OBQ6511A,OB HP Toner Black Q6511A,237145
OBQ5942A,OB HP Toner Black Q5942A,237153
OB10910,OB HP Toner HC Black Q5942X,237161
CO57199,Canon Lsr Tnr Cart 8.5K Ylw 2641B002AA,237978
CO57203,Canon Lsr Tnr Cart 8.5K Mag 2642B002AA,237985
CO57206,Canon Lsr Tnr Cart 5K Black 2644B002AA,237993
CO57208,Canon Lsr Tnr Cart 10K Black 2645B002AA,238008
HPC7982A,HP Cleaning Cartridge Super DLT C7982A,238027
HPQ2020A,HP Super DLT 2 Tape 600Gb Q2020A,238043
HPC8010A,HP DAT72 4mm Data Cart 72Gb C8010A,238051
CO57205,Canon Lsr Tnr Cart 8.5K Cyan 2643B002AA,238161
HPCE255A,HP LaserJet Toner Black CE255A,238698
HPCE255X,HP LaserJet Toner HY Black CE255X,238704
OB00478,OB HP Toner Black HY Q6511X,238776
AV23776,Avery DVD Case Insert White Pk25,238912
SAM81202,Samsung CLP-770ND Tnr Cart 7K Blk,239035
XR8R00608,Xerox Phaser8400 Solid Ink Stick Blk Pk6,239072
OK04359,Oki MC860 Toner 10k Yellow 44059209,239076
XR8R00607,Xerox Phaser8400 Solid Ink Stick Ylw Pk3,239080
OK04360,Oki MC860 Toner 10k Magenta 44059210,239092
XR8R00606,Xerox Phaser8400 Solid Ink Stick Mag Pk3,239098
XR8R00605,Xerox Phaser8400 Solid Ink Stick Cyn Pk3,239103
OK04361,Oki MC860 Toner 10k Cyan 44059211,239108
OK04362,Oki MC860 Toner 9.5k Black 44059212,239116
SAM81208,Samsung CLP-770ND Tnr Cart 7K Cyn,239124
SAM81205,Samsung CLP-770ND Tnr Cart 7K Mag,239205
IB96703,Lexmark RP 100 InkCart Blk 014N0820E,239221
XR8R00664,Xerox Solid Ink 6 Sticks C2424 Black,239226
SAM81204,Samsung CLP-770ND Tnr Cart 7K Ylw,239238
XR8R00660,Xerox Solid Ink 3 Sticks C2424 Cyan,239242
XR8R00662,Xerox Solid Ink 3 Sticks C2424 Yellow,239250
SAM44826,Samsung CLP-620/CLP-670 Tnr Cart 2K Cyn,239254
SAM44815,Samsung CLP-620/CLP-670 Tnr Cart 4K Cyn,239262
XR8R00661,Xerox Solid Ink 3 Sticks C2424 Magenta,239268
SAM44825,Samsung CLP-620/CLP-670 Tnr Cart 2K Mag,239270
XR3R00663,Xerox Drum M15/Pro412 113R00663,239276
XR3R00606,Xerox Tnr Cart HiCap Black 013R00606,239284
XR3R00667,Xerox PE16 Toner Drum Black 113R00667,239292
SAM44813,Samsung CLP-620/CLP-670 Tnr Cart 4K Mag,239302
SAM44817,Samsung CLP-620/CLP-670 Tnr Cart 2K Ylw,239310
SAM44811,Samsung CLP-620/CLP-670 Tnr Cart 4K Ylw,239328
EP60751,Epson Toner Cartridge Black C13S050245,239496
EP60748,Epson Toner Cartridge Yellow C13S050242,239501
SAM44816,Samsung CLP-620/CLP-670 Tnr Crt 2.5K Blk,239513
EP60749,Epson Toner Cartridge Magenta C13S050243,239519
SAM44810,Samsung CLP-620/CLP-670 Tnr Cart 5K Blk,239521
EP60750,Epson Toner Cartridge Cyan C13S050244,239527
SZ61877,Sony LTO Uni Cleaning Cart Cartridge,239658
VM43522,Verbatim DVD-R 16X Spindle25 43522,239755
VM43543,Verbatim DVD-R 2Layer 4X 8.5Gb P5 43543,239763
VM43500,Verbatim DVDplusR 16X 4.7Gb Spindle25,239789
KE01317,Kyocera FSC5400DN Tnr 12K Ylw TK570Y,240534
OK04460,Oki Tnr HC 2.5K Blk 44250724,240656
OK04459,Oki Tnr HC 2.5K Cyan 44250723,240664
OK04458,Oki Tnr HC 2.5K Mag 44250722,240672
OK04457,Oki Tnr HC 2.5K Ylw 44250721,240680
OK03794,Oki C3520/3530MFP HY Toner Cyan,240704
OK03793,Oki C3520/3530MFP HY Toner Mag,240712
OK03792,Oki C3520/3530MFP HY Toner Ylw,240720
KE01329,Kyocera FSC5400DN Tnr 16K Blk TK570K,240778
BB56881,Fellowes Voyager A3 Laminator 5704201,240818
HPCE262A,HP LaserJet Toner Yellow CE262A,240875
HPCE263A,HP LaserJet Toner Magenta CE263A,240883
HPCE740A,HP LaserJet Toner Black CE740A,240891
HPCE741A,HP LaserJet Toner Cyan CE741A,240908
HPCE742A,HP LaserJet Toner Yellow CE742A,240915
HPCE743A,HP LaserJet Toner Magenta CE743A,240923
MA99671,Tensioning Tool 12Mm 892H21,241108
HPQ5950A,HP LsrJet 4700 Tnr Black Q5950A,241133
HPQ5951A,HP LsrJet 4700 Tnr Cyan Q5951A,241141
MA99672,Sealing Tool 12Mm 89212H35,241167
SAM43611,Samsung Drum 30K Blk CLX-R8385K/SEE,241181
HPQ5952A,HP LsrJet 4700 Tnr Yellow Q5952A,241206
HPQ5953A,HP LsrJet 4700 Tnr Mag Q5953A,241214
HPQ6460A,HP LsrJet 4730 Tnr Black Q6460A,241222
HPQ6461A,HP LsrJet 4730 Tnr Cyan Q6461A,241230
HPCE261A,HP LaserJet Toner Cyan CE261A,241238
HPCE260X,HP LaserJet Toner HY Black CE260X,241246
HPCE260A,HP LaserJet Toner Black CE260A,241254
HPQ6462A,HP LsrJet 4730 Tnr Yellow Q6462A,241303
HPQ6463A,HP LsrJet 4730 Tnr Mag Q6463A,241311
HPQ6470A,HP Tnr Cart LsrJet 3600/3800 Blk Q6470A,241599
XR27651,Xerox Ink Cartridge Black IC601,241651
XR27533,Xerox Toner Cartridge Black LC802,241668
HPQ6471A,HP Tnr Cart LsrJet 3600 Cyan Q6471A,241688
AR82021,Artline Marker Medium Point White 400,241701
HPQ6472A,HP Tnr Cart LsrJet 3600 Yellow Q6472A,241769
HPQ6473A,HP Tnr Cart LsrJet 3600 Mag Q6473A,241777
HPQ7581A,HP Tnr Cart LsrJet 3800 Cyan Q7581A,241785
HPQ7582A,HP Tnr Cart LsrJet 3800 Yellow Q7582A,241793
HPQ7583A,HP Tnr Cart LsrJet 3800 Mag Q7583A,241858
HPQ7560A,HP Toner Cartridge LaserJet 3000 Black,241866
HPQ7561A,HP Toner Cartridge LaserJet 3000 Cyan,241874
HPQ7562A,HP Toner Cartridge LaserJet 3000 Yellow,241890
BR30157,Berol Permanent Pen Black Pp01,241914
HPQ7563A,HP Toner Cartridge LaserJet 3000 Magenta,241939
EP66140,Epson Inkjet Cartridge Stylus C48 Black,241955
EP67040,Epson Inkjet Cartridge Stylus C48 Colour,241963
HG58269,Folio L/Tray Wire/Plastic A4 Blue 580070,241981
GH51714,Guildhall Account Book 80Pg 51/7-14,24212X
SZ34573,Sony DVD-R 8X IJ Prnt Pk10 10DMR47B-IP,242489
SZ93311,Sony DVD-RW 4.7Gb Jewel Case Pk10,242594
EP60620,Epson 4880 Ink Cart 220ml Cyn C13T606200,242950
EP60650,Epson Ink Cart 220ml Lt Cyn C13T606500,242976
EP60640,Epson 4880 Ink Cart 220ml Ylw C13T606400,242992
TX48004X,Tippex Rapid Fluid 20Ml White 887159,24315X
EP60690,Epson InkCart 220ml Lt Lt Blk C13T606900,243379
EP60660,Epson InkCart 220 Vivid LtMag C13T606600,243492
RX11000,Rexel Budget Pocket A4 Clear Pk100 11000,243885
RX12602BU,Rexel Report File A4 Blue Pk25 12602,243893
RX12182,Rexel Budget Folder Polyprop P10012182,243931
RX12092,Nyrex Cardholder A4 Clear Pk25 12092,243958
RX12093,Nyrex Cardholder A5 Clear Pk25 12093,243966
RX13422BK,Rexel Budget 2Rbndr A4 Black 13422Bk,244058
RX13422BU,Rexel Budget 2Rbndr A4 Blue 13422Bu,244066
RX10405BK,Rexel Clrview Dsp Bk A3 24Pkt Blk 10405,244201
SF16108,Sigma 3-Part Delivery Note Set Of 50,244309
SF16113,Sigma Personnel Wallet Green Pk50 G351R,24435X
SF401,Sigma Attendance Record Pk50 G401R,244368
BA63447,Brother Quick Labeller Black QL650TDZU1,244536
HP70644,HP LJet 4600/4650 Image Transfer Kit,244950
HPCE247A,HP Col Laserjet 220V Fuser Kit CE247A,245018
HPCE249A,HP Colour Laserjet Transfer Kit CE249A,245033
PP16170,Pukka A4 Jotta Pad Union Jack 6170-UJF,24565X
PP16171,Pukka A5 Jotta Pad Union Jack 6171-UJF,24576X
GB22068,GBC Lam Pouch A3 150mic Clr Pk100,245894
EP45121,Epson Aculaser M1200 Stdcap Tnr 1.8K Blk,246053
EP45163,Epson Aculaser M1200 Hi Cap Tnr 3.2K Blk,246061
AV81523,Avery Multi Lbl 14TV 100 Sht Wht 3653,246210
3M87135,3M PostIt Cube 76x76mm Pink 2028P,24627X
BA63670,Brother HL5240 TnrCart Black TN3130,246803
XR74726,Xerox Phsr6280 Toner HC Cyn 106R01392,246808
BA63661,Brother HL5240 HY Toner Cart Blk TN3170,246811
XR74727,Xerox Phsr6280 Toner HC Mag 106R01393,246815
XR74728,Xerox Phsr6280 Toner HC Ylw 106R01394,246823
BA63662,Brother HL5240/50/70/80 Drum Unit DR3100,246829
XR74729,Xerox Phsr6280 Toner HC Blk 106R01395,246831
RS14450,Bienfang Foambrd A1 Wht Pk10 Bf012571,246954
BY05288,Ff Bisley Cupboard 1Door 349X460X940 Gry,247003
BY04034,Ff Bisley Cupboard 1Door 349X460X670 Gry,24702X
RM41653,Laminator Pouch A5 150Mic Pk100 41653,247054
HPSD449EE,HP No 338/343 Combo Pack CMYK CE255XD,247162
HPQ7551XD,HP LJ Tnr Blk Twin Pack Q7551XD,247170
HPQ7553XD,HP LJ Tnr Blk Twin Pack Q7553XD,247188
IB96705,Lexmark RP 100 InkCart Cyan 014N0900E,247195
IB96707,Lexmark RP 100 InkCart Magenta 014N0901E,247202
IB96709,Lexmark RP 100 InkCart Ylw 014N0902E,247210
HPCG969A,HP Prof Gloss LsrPpr A3 120g P250 CG969A,247235
HPCG965A,HP Prof Gloss LsrPpr A4 150g P150 CG965A,247243
KETK01636,Kyocera TaskAlfa Tnr Cyn TK-875C,247251
KETK01612,Kyocera TaskAlfa Tnr Blk TK-875K,247268
KETK01628,Kyocera TaskAlfa Tnr Mag TK-875M,247276
KETK01620,Kyocera TaskAlfa Tnr Ylw TK-875Y,247284
HPCN637EE,HP No300 Inkjet Black/3-Colour CN637EE,247292
HPC9153A,HP Maint/Upgrade Kit LaserJet 9000,247868
DEL00258,Dell 3130CN Tnr Cart HY 9K Mag 593-10292,247876
DEL00259,Dell 3130CN Tnr Cart HY 9K Ylw 593-10291,247884
DEL00257,Dell 3130CN Tnr Cart HY 9K Cyn 593-10290,247892
DEL00256,Dell 3130CN Tnr Cart HY 9K Blk 593-10289,247958
PQ27106,Philips LPF 5100 Toner/Drum 3.3K PFA751,248255
HPCC364XD,HP LaserJet Toner Black TwinPack CC364XD,248263
KEMK880A,Kyocera FS-C8500DN Maint Kit MK-880A,248271
KETK01704,Kyocera FS-C8500DN Toner 18K Cyn TK-880C,248303
KETK01700,Kyocera FS-C8500DN Toner 25K Blk TK-880K,248311
KETK01708,Kyocera FS-C8500DN Toner 18K Mag TK-880M,248328
KETK01712,Kyocera FS-C8500DN Toner 18K Ylw TK-880Y,248336
SZ77709,Sony DataCart DAT 320Gb DGDAT320N,248344
OK04591,Oki C610 Image Drum 20K Yellow 44315105,248360
OK04583,Oki C610 Toner Cartridge 6K Ylw 44315305,248400
OK04586,Oki C610 Toner Cartridge 8K Blk 44315308,248418
OK04585,Oki C610 Toner Cartridge 6K Cyn 44315307,248425
OK04584,Oki C610 Toner Cartridge 6K Mag 44315306,248433
OK04594,Oki C610 Image Drum 20K Black 44315108,248441
OK04593,Oki C610 Image Drum 20K Cyan 44315107,248506
OK04592,Oki C610 Image Drum 20K Magenta 44315106,248514
OK04581,Oki C610/710/711 Fuser 60K 44289103,248530
AVL7160,Avery Lsr Lbl Pk100 L7160-100 Fpc,248548
AVL7161,Avery Lsr Lbl Pk100 L7161-100 Fpc,248556
AVL7162,Avery Lsr Lbl Wht Pk100 L7162-100 Fpc,248564
AVL7163,Avery Lsr Lbl Pk100 L7163-100 Fpc,248572
AVL7164,Avery Lsr Lbl Wht Pk100 L7164-100 Fpc,248580
OK04138,Oki C710/711 Laser Toner Black 44318608,248588
OK04137,Oki C710/711 Laser Toner Cyan 44318607,248596
AVL7165,Avery Lsr Lbl Wht P100 L7165-100 Fpc,248599
AVL7166,Avery Lsr Lbl Wht P100 L7166-100 Fpc,248602
OK04136,Oki C710/711 Laser Toner Mag 44318606,248603
AVL7167,Avery Lsr Lbl Pk100 L7167-100 Fpc,248610
OK04135,Oki C710/711 Laser Toner Ylw 44318605,248611
OK04606,Oki C711 Image Drum 20K Black 44318508,248678
OK04605,Oki C711 Image Drum 20K Cyan 44318507,248685
OK04604,Oki C711 Image Drum 20K Magenta 44318506,248693
OK04603,Oki C711 Image Drum 20K Yellow 44318505,248700
OM02675,Olympus MJU5010 Digi Cam Silvr N3612492,249023
HPCE278A,HP LsrJet Toner Blk CE278A,249145
HPCE285AA,HP LsrJet Toner Blk CE285A,249153
CO65028,Canon Toner 2.1k Black CRG719,249161
CO65031,Canon Toner 6.4k Black CRG719H,249201
DEL00140,Dell 1320C Toner Cartridge P237C Black,249234
DEL00141,Dell 1320C Toner Cartridge P238C Cyan,249242
DEL00142,Dell 1320C Toner Cartridge P240C Mag,249250
RX04782,Rexel Gemini Stapler Hstrip Blk 2100029,24925X
CS66116,Casio Pocket Calc 8Digit SL-460L-S-UH,249306
DEL00143,Dell 1320C Toner Cartridge P239C Ylw,249308
DEL00252,Dell 3130Cn Toner Cartridge G910C Blk,249323
DEL00253,Dell 3130Cn Toner Cartridge G907C Cyn,249331
DEL00255,Dell 3130Cn Toner Cartridge G908C Ylw,249398
DEL00254,Dell 3130Cn Toner Cartridge G909C Mag,249404
DEL00244,Dell 5330 Use/Return Tnr HC Blk 59310331,249412
DEL00023,Dell 1720 Toner Cartridge Rp380 Blk,249478
GH4765,Europa Threefold File Dark Blue 4765,249497
GH4755,Europa Portfolio Dark Blue 4755,249527
PZ12043,Panasonic KXMB261/771 Drum Blk KX-FAD93X,249761
PZ48070,Panasonic Toner Cyan KXFATC506X,249786
PZ48071,Panasonic Toner Magenta KXFATM507X,249794
PZ48072,Panasonic Toner Yellow KXFATY508X,249818
PZ48073,Panasonic Toner Blk KXFATK509X,249826
ES93613,Pendaflex Latrl File A A4 Blu Pk25 93613,250036
ES93617,Pendaflex Latrl Fle A A4 Red Pk25 93617,250052
RS20752,Blick Address Label 50X80Mm Td5080,250281
RS20950,Blick Address Label 50X102Mm Td50102,25029X
RS21155,Blick Address Label 80X120Mm Td80120,250303
PA03130,Quink Cartridges Perm Blue/Blk Pk5 8102,250443
WS22470,Clipper Foldback Clip 19mm Blk 22471 P10,250737
WS23070,Clipper Foldback Clip 32mm Black P10,250753
WS23370,Clipper Foldback Clip 41mm Black P10,250761
WS23670,Clipper Foldback Clip 50mm Black P10,25077X
AV10064,Avery Original Magazine Rack Black 440SX,250931
AV10066,Avery Original Magazine Rack Blue 440SX,250958
HPCG966A,HP Prof Gloss LsrPpr A4 200g P100 CG966A,251056
MY403,Avery Plastic Riser Connectors Set4 403,251226
AV81592,Avery DTR Pen Pot Black DR450BLK,251234
AV81593,Avery DTR Pen Pot Blue DR450BLUE,251242
VM44048,Verbatim USB 2.0 4Gb Micro Hi-Speed Blk,251591
VM44049,Verbatim USB 2.0 8Gb Micro Hi-Speed Blk,251608
VM44050,Verbatim USB 2.0 16Gb Micro Hispeed Blk,251615
MY444BU,Avery Jumbo Rack Blue 444,251635
MY444BK,Avery Jumbo Rack Black 444,251651
VM39943,Verbtm Store/Go USB Drive 64Gb Blu 43994,251778
3M27672,Imation LTO 5 Ultrium Data Cartridge,251786
3M23795,Imation USB 2.0 Flash Drive Atom 8Gb,251801
3M24790,Imation Apollo Gen2 2.5 Identity 320Gb,251908
3M24783,Imation Apollo Gen2 2.5 Identity 500Gb,251915
DB50337,Durable Superclean Fluid 250ml 5781/19,251988
DB50335,Durable Screenclean Fluid 250ml 5782/19,251996
RM28583,Rexel Mercury REM723 Shred 2102564,252035
RM28572,Rexel Autoplus 100 Shred Blk 2102559,252068
RM28584,Rexel Pro Style Plus Shred 2102563,252092
RM28582,Rexel Mercury RDM1170 Shred 2102565,252116
RM28581,Rexel Mercury RDSM770 Shred 2102566,252132
MO00135,Datacopy Everyday A4 80G Wht Ream Fms,252304
MO00008,Datacopy A4 80G Punch 4H Wh Ream Fms,252320
RX04763,Rexel Gazelle Stapler Hstrip Blk 2100010,252444
RX04764,Rexel Gazelle Stapler Hstrip Silver/Blue,252452
RX04753,Rexel Matador Stapler Hstrip Blk 2100000,252487
RX04772,Rexel Meteor Stapler Hstrip Blk 2100019,252517
RX04757,Rexel Taurus Stapler Fstrip Blk 2100004,252525
RX04758,Rexel Taurus Stapler Fstrip Blu 2100005,252533
BA0288,Brother Liftoff Tape 9010 Pk6,25272X
FU1018,Fujitsu Fabric Ribbon Bk D30L-9001-0269,252770
F2334FN,Fujitsu Nylon Rbn 9001-0601 Black,252797
LND26222,Cello 22in HD Rdy Digital LED TV/DVD Blk,252805
LND26209,Cello 24 in Full HD Digi LED TV/DVD Blk,252813
BT61394,BT Graphite 2500 Phone Blk 051536,252846
BT61390,BT Graphite 2100 Phone Blk 051532,252854
3M21980,Imation DVD-R 16X Spindle50 21980,252859
BT61391,BT Graphite 2100 Phone Twin Blk 051533,252870
RX11640,Rexel 4 Hole Punch Silver P425 2100753,252883
BT61395,BT Graphite 2500 Phone Twin Blk 051537,252895
BY01242,Ff Bisley Sidefiler Cab 4Drw Grey,252932
BY01238,Ff Bisley Sidefiler Cab 3Drw Grey,252940
BY01233,Ff Bisley Sidefiler Cab 2Drw Grey,252959
PI32477,Pilot Begreen Rexgrip Retract Bpen Blk,252964
PI32479,Pilot Begreen Rexgrip Retract Bpen Blu,252980
DRO05601,Doro DECT Black FORMULA3,253022
DRO05602,Doro DECT Black Pk2 FORMULA3 DUO,253030
DRO05609,Doro DECT TAM Blk 15mins FORMULA5,253055
DRO05610,Doro DECT TAM Blk 15min Pk2 FORMULA5 DUO,253063
DRO05611,Doro DECT TAM Blk 15min P3 FORMULA5 TRIO,253071
PIBLVB5BK,Pilot Vball Rollerball Black Blvb5,25313X
PIBLVB5BU,Pilot Vball Rollerball Blue Blvb5,253148
PIBLVB5R,Pilot Vball Rollerball Red Blvb5,253156
PI32683,Pilot Begreen Supergel Pen 0.7mm Black,253278
PI32684,Pilot Begreen Supergel Pen 0.7mm Blue,253286
EP46611,Epson AIO Duplex WiFi Printer BX625FWD,253436
PLY03447,Polycom Soundstn 2 Ex Voice Conf Unit,253452
PLY70400,Polycom Soundstation 2 Ex Microphone Pk2,253460
PI24457,Pilot Jumbo Twin Marker Black,253684
3M24957,Imation USB 2.0 Pckt FlashDrv 4Gb i24957,253688
3M24958,Imation USB 2.0 Pckt FlashDrv 8Gb i24958,253696
SV43320,Silvine Cloakroom Ticket 1-500 5555,253849
SV43330,Silvine Cloakroom Ticket 1-1000 1000-T,253857
JT151989,Concord Guidecards 5X3 15198,253954
JT152986,Concord Guidecards 6X4 15298,253962
JT153983,Concord Guidecards 8X5 15398,253970
FX173008,Deskfax Ruled White Sheets 173008,254119
HPCH561EE,HP No301 Inkjet Black CH561EE,254278
HPCH562EE,HP No301 Inkjet Tri Colour CH562EE,254286
HPCH563EE,HP No301XL Inkjet Black CH563EE,254326
HPCH564EE,HP No301XL Inkjet Tri Colour CH564EE,254334
KETK170,Kyocera FS1320D Toner 7.2K Blk TK-170,254342
LC02211,Logitech M510 Wireless Mse Blk 910001825,254594
LC02390,Logitech Wireless Mouse M705 Silver Silv,254601
LC02517,Logitech Wireless Trackball M570 Black,254634
LC23191,Logitech K200 Busi Keybrd Blk 920002784,254642
LC21431,Logitech K120 Busi Keybrd Blk 920002524,254650
LC02060,Logitech Wired Deskset MK120 Black,254683
LC02263,Logitech MK520 Wls Deskset Blk 920002606,254691
LC02375,Logitech C270 HD WebCam Blk 960000582,254748
LC03991,Logitech S120 Speakers Black 980-000011,254764
LC02424,Logitech Z313 Spkrs Blk 980000447,254780
SAM06260,Samsung TnrCart Std Black MLT-D309S/ELS,254853
SAM06261,Samsung TnrCart HY Black MLT-309L/ELS,254861
HPCE310A,HP Col LsrJet Toner 126A Black CE310A,254901
HPCE311A,HP Col LsrJet Toner 126A Cyan CE311A,254918
HPCE312A,HP Col LsrJet Toner 126A Yellow CE312A,254926
HPCE313A,HP Col LsrJet Toner 126A Magenta CE313A,254934
HPCE320A,HP Col LsrJet Toner 128A Black CE320A,254942
HPCE321A,HP Col LsrJet Toner 128A Cyan CE321A,254950
HPCE322A,HP Col LsrJet Toner 128A Yellow CE322A,255005
HPCE323A,HP Col LsrJet Toner 128A Magenta CE323A,255013
SAM01742,Samsung ML1640 Tnr Blk Pk2 MLT-P1082A,255021
OK04798,Oki C310/330 Tnr 2K Cyan 44469706,255046
OK04862,Oki C510/C530 Tnr HY Cyan 44469724,255054
HPSA308AE,HP No45/78 IJ Cart Blk/3Col SA308AE Pk2,255058
OK04796,Oki C310/330 Tnr 2K Yellow 44469704,255062
OK04860,Oki C510/C530 Tnr HY Yellow 44469722,255070
HPSA310AE,HP No15/78 IJ Cart Blk/3Col SA310AE Pk2,255082
OK04797,Oki C310/330 Tnr 2K Magenta 44469705,255088
OK04861,Oki C510/C530 Tnr HY Magenta 44469723,255095
OK04894,Oki C310/330 Drum 44494202,255135
CO55257,Canon PG40/CL41 Inkjet Multi 0615B036AA,255151
OB4488960,OB Kyocera Laser Toner Black TK-17,255155
SAM01278,Samsung Tnr Blk Pk2 CLT-P4092B/ELS,255168
EP46271,Epson Acu C1600/CX16 PC Unit C13S051198,255176
EP46270,Epson Acu C1600 Tnr SC Cyn C13S050560,255192
EP46266,Epson Acu C1600 Tnr HC Cyn C13S050556,255208
EP46268,Epson Acu C1600 Tnr SC Ylw C13S050558,255216
EP46264,Epson Acu C1600 Tnr HC Ylw C13S050554,255224
EP46269,Epson Acu C1600 Tnr SC Mag C13S050559,255232
EP46265,Epson Acu C1600 Tnr HC Mag C13S050555,255240
EP46267,Epson Acu C1600 Tnr HC Blk C13S050557,255258
SAM74817,Samsung TnrCart Black K300A,255317
SAM74804,Samsung TnrCart Cyan C300A,255333
IBC736H1C,Lexmark RP Tnr 10K Cyan 0C736H1CG,255338
SAM74819,Samsung TnrCart Magenta M300A,255341
SAM74802,Samsung TnrCart Yellow Y300A,255367
IBC736H1Y,Lexmark RP Tnr 10K Ylw 0C736H1YG,255370
SAM74821,Samsung Imaging Unit CLP-R300A/ELS,255375
IBC736H1M,Lexmark RP Tnr 10K Mag 0C736H1MG,255410
IBC736H1K,Lexmark RP Tnr 12K Blk 0C736H1KG,255451
MSF16545,Microsoft WLss Desktop 800 Blk 2LF00021,255524
MSF89794,Microsoft Lifecam Cinema Webcam Grey,255558
PIK00912,Brita Maxtra Water Filter Cartridge Pk3,255600
PHT00002,Photo Corners White Pk250,25567X
BI01167,Bright Ideas Cellophane Clear BI2600,255969
IN40881,Integral USB Xpression Birds,255988
SB10088,Stanley Knife Retractable 10088,25598X
IN40883,Integral USB Xpression Stripes,256000
MQ23848,MailLite Plus Oyster 150x210mm Pk100,256012
HK30047,Pritt Glue Dots Repo Wlt64 Clear,256029
DB8102,Badge 54X90 Self Laminatng Clr Pk25 8102,256063
BA68280,Brother Toner Black 1.2K TN2210,256188
BA68286,Brother Toner Black 2.6K TN2220,256196
BA68292,Brother Drum Unit 12K DR2200,256203
BA67946,Brother DR320CL Drum Unit Colour,256211
BA67934,Brother Std Yield TnrCart Black TN320Bk,256228
BA67938,Brother TN325 Toner HY Blk TN325BK,256236
BA67935,Brother Std Yield TnrCart Cyan TN320C,256244
BA67936,Brother Std Yield TnrCart Mag TN320M,256252
BA67937,Brother Std Yield TnrCart Yellow TN320Y,256260
FL74498,Doortex Micro DstMat 900x1500 Storm Blu,256273
BA67939,Brother TN325 Toner HY Cyn TN325C,256278
BA67940,Brother TN325 Toner HY Mag TN325M,256285
BA67941,Brother TN325 Toner HY Ylw TN325Y,256293
LC01489,Logitech B110 OpMse USB Blk 910001246,256318
OK04962,Oki C801/821 Tnr 7K Black 44643004,256358
OK04961,Oki C801/821 Tnr 7.3K Cyan 44643003,256366
OK04960,Oki C801/821 Tnr 7.3K Magenta 44643002,256374
OK04959,Oki C801/821 Tnr 7.3K Yellow 44643001,256382
CO66731,Canon Canoscan Lide 110 Scanner,256390
CPD54146,Finish Dishwasher Tablet Pk15 KRCFINDAT1,256401
CO66745,Canon Canoscan Lide 210 Scanner,256406
SGM27106,Sagem CTR356 Black Toner/Drum Cart,256414
BZ05210,Dairycrest UHT S/Skim Milk 500ml P12,256419
ALB00865,FF Alba Festival Coat Stand Black,256477
SR71733,Fire Exit Keep Clear 15X45 S/A Ec08S/S,256809
SR71732,Fire Exit Keep Clear 15X45 Pvc Ec08S/R,256817
UP21359,Stewart Slide Sign Free Engagd Meet Room,256980
UP21360,Stewart Sliding Sign Meeting Room,256998
UP21361,Stewart Sliding Sign Do Not Disturb,257008
OB00540,OB HP Toner Black Q2670A,257309
OB2671A,OB HP Toner Cyan Q2671A,257317
OB2673A,OB HP Toner Magenta Q2673A,257325
OB2672A,OB HP Toner Yellow Q2672A,257333
OB83362,OB Brother Toner Black TN2000,257341
OB850007,OB Brother Drum Unit DR7000,257359
OB78500,OB Epson Stylus Cart Black T061140,257367
OB98500,OB Epson Stylus Cart Cyan T061240,257375
OB99500,OB Epson Stylus Cart Magenta T061340,257391
OB50600,OB Epson Stylus Cart Yellow T061440,257414
RN07833,Yearntree 210 Lit File Portrait Crystal,257545
DF73201,Deflecto Link Wall Pocket A4 Clear 73201,257553
CO55376,Canon i-Sensys MF4580Dn Mono Laser Mfc,257604
CO55362,Canon i-Sensys MF4430 Mono Laser MFC Blk,257620
CO55366,Canon i-Sensys MF4450 Mono Laser MFC Blk,257678
NL48043,Nestle Aero Hot Chocolate 1Kg 12164122,258003
DB80277,Durable Security Pass/Badge Pk10 8224/19,258045
DB80284,Durable Chrome Badge Reels Pk10 8225/23,258053
DB80305,Durable CombiClip Badge 54x90mm P25 8214,258079
ZB11651,Zebra Jimnie Classic Gel Rball Blk 11651,25818X
WAC80078,WAC Hypoallergenic Plasters Pk150,258215
WAC10857,WAC Saline Eye Pods 20ml Pk25,258223
3M50789,3M Displaymount Adhesive 400Ml 3M,258265
SB19216,Stanley 1992 Knife Blades 2-11-921 Pk 10,258320
ZB11652,Zebra Jimnie Classic Gel Rball Blu 11652,25833X
CO55398,Canon i-Sensys MF4550D Mono Laser Mfc,258568
CO55388,Canon i-Sensys MF4570Dn Mono Laser MFC,258576
CO66845,Canon iSensys LBP6200D Mono Laser Prntr,258592
CO55346,Canon i-Sensys LBP6750DN Laser Printer,258658
JDC80271,BASILDON DL WLT 100G ENVELOPAD WHT PK50,258948
JDL80273,BASILDON DL WLT WDW 100G ENVPAD WHT PK50,258956
JDD80276,Basildon Env DL Wdw Wlt 100g Wht D80276,258964
JT03201,Concord Index A4 Wht Multi Tab 1-31 Cs32,258986
JT62305,Concord Index Pvc A4 1-5 Grey 62305,258994
JT62405,Concord Index Pvc A4 1-10 Grey 62405,259000
JT62505,Concord Index Pvc A4 1-12 Grey 62505,259019
JT62605,Concord Index Pvc A4 1-15 Grey 62605,259027
JT62705,Concord Index Pvc A4 1-20 Grey 62705,259035
JT62805,Concord Index Pvc A4 1-31 Grey 62805,259043
JT62905,Concord Index Pvc A4 A-Z Grey 62905,259051
JT63005,Concord Index Pvc A4 Jan-Dec Grey 63005,25906X
JDL80281,Basildon Env C4 Wht Pckt 100g L80281,259074
JDB80293,Basildon Env C5 Manilla Pckt 90g B80293,259090
JDK80295,Basildon Env C4 Man PS Pk50 K80295,259113
BZ06500,Douwe Egberts Pure Gold Coffee 500g,259147
AU03901,Tetley Catering 1Cup TeaBag Pk1100,259202
BZ11835,Yorkshire Tea Bags Soft Water P480,259210
NL47798,Nescafe Partners Blend 500gm Catering,259252
SNG02330,Fair Trade White Sugar Cannister TB1090,259309
DB50346,Durable XL Cotton Bud Pk100 5789/02,259779
OK04868,Oki B411/431 Toner 3K Black 44574702,259848
OK04867,Oki B411/431 Image Drum 25K 44574302,259863
OK04799,Oki C310/330 Tnr 3.5K Black 44469803,259871
OK04800,Oki C510/C530 Tnr HY Black 44469804,259903
BA67942,Brother TN328 Toner SHY Blk TN328BK,259911
MQ23841,MailLite Plus Oyster 180x260mm Pk100,259914
MQ23842,MailLite Plus Oyster 220x260mm Pk100,259922
BA67943,Brother TN328 Toner SHY Cyn TN328C,259928
BA67944,Brother TN328 Toner SHY Mag TN328M,259936
BA67945,Brother TN328 Toner SHY Ylw TN328Y,259944
MQ23846,MailLite Plus Oyster 300x440mm Pk50,259965
MQ23847,MailLite Plus Oyster 350x470mm Pk50,259973
ES45010,Dymo 4500 Tape Black/Clear 45010,26030X
ES45011,Dymo 4500 Tape Blue/Clear 45011,260318
ES45012,Dymo 4500 Tape Red/Clear 45012,260326
ES45013,Dymo 4500 Tape Black/White 45013,260334
ES45014,Dymo 4500 Tape Blue/White 45014,260342
ES45015,Dymo 4500 Tape Red/White 45015,260350
ES45016,Dymo 4500 Tape Black/Blue 45016,260369
ES45017,Dymo 4500 Tape Black/Red 45017,260377
ES45018,Dymo 4500 Tape Black/Yellow 45018,260385
ES45019,Dymo 4500 Tape Black/Green 45019,260393
MO79228,Datacopy A4 90Gm Pk250 Gld Dcp2129090Go,260695
VIV33481,Vivitek D511 XGA Projector Silver D511,260713
VIV33509,Vivitek D330Mx XGA Projectr Black D330Mx,260721
MO00103,Datacopy A5 80Gm White Ream 79465 Fms,260733
VIV33510,Vivitek D330Wx WXGA Projector Blk D330Wx,260738
