Code,Description,Spicer_Code
AV12955,Avery Desktop Mag Rack Blu Dr200Blue,623813
AV12969,Avery Desktop Desktidy Black Dr400Blk,62383X
AV12970,Avery Desktop Desktidy Blue Dr400Blue,623848
AV12964,Avery Desktop Bookrack Black Dr300Blk,623864
AV12965,Avery Desktop Bookrack Blue Dr300Blue,623872
AV12979,Avery Desktop Wppr Bin 18Ltr Dr500Blk,623899
AV12980,Avery Desktop Wppr Bin 18Ltr Dr500Blue,623902
SE4542,Sellotape Sticky Hook And Loop Pad Wlt24,623937
HK1652,Copydex Adhesive 125Ml 45981652,623945
TX89209,Tippex Mini Pocket Mouse 89209,623996
ES99014,Dymo Shipping Lbl 54X101Mm Pk220 99014,624010
ES99015,Dymo Diskette Label 54X70Mm P320 99015,624029
AV98551,Avery Lsr Lbl 1 Page Wht Pk40 L7767-40,624088
AV98553,Avery Lsr Lbl 4 Page Wht Pk40 L7769-40,62410X
AV98554,Avery Lsr Lbl 8 Page Wht Pk40 L7765-40,624118
AV00205,Avery Lever Arch Lbl 4Sheet P25 J8171-25,624126
3M06334,Postit Index Format Arrows Ast 684Arr1,624177
3M31708,Postit Index Small Frmt Ast 683-5Cbindex,624185
RX37201,Rexel Swingline Staple Remover 37201,624231
EP81731,Epson Mini Printer Ribbon Erc09B Black,624444
MS78080,Multifile Lateralfile A4 Grn/Gry Pk50,624495
MS78008,Multifile Susp File Complete Pk50 78008,624509
EP41001,Epson Iron On Transfer Paper S041154 P10,624843
BB110,Fellowes Storage File A4/Fc Economy 110,624924
SAM13018,Samsung Fax InkCart Blk INK-M40V/ELS Pk2,62517X
EP50140,Epson Inkjet Cart Styl 400/440/500 Blk,625296
HPC6020B,Hp Coated Ppr 914Mmx45M Roll 98Gm C6020B,62530X
EP50142,Epson IJet Cart Styl 400/440/500 Blk Pk2,625318
JT89501,Concord Divider 20Part A-Z Fluor 89501,625458
LX25320,Labelholder 25X75Mm Pk12 25320,625539
LX25330,Labelholder 55X102Mm Pk6 25330,625555
EL66706,Rolodex Clas 500 Rot Open CardFile Chrm,625660
RT04010,Rotadex P/File Mod Cir Plat Rp24Modplat,625695
RT04012,Rotadex P/File Mod 5Star Bse Rp24Modbaca,625962
EP51140,Epson Inkjet Cart Styl C740/800/1520 Blk,625970
EP51142,Epson Inkjet Cart Styl C740/800 Blk Pk2,625989
EP52040,Epson Inkjet Cartridge 3 Stylus Col 400,625997
EP53040,Epson Inkjet Cart 5 Col Photo Ex700/750,626003
KC01092,Kleenex UltraSoft HandTowel 3Ply Wht P30,626755
RY01765,Le Cube Swing Bin Liners Pk200,626771
MQ90061,Aircap Handiroll Small Bubble 750mmx60M,626852
MQ80025,Aircap Handiroll Large Bubble 750mmx30M,626860
SH47942,Sharp Thermal Tfer Rbn Blk UX92CR Pk2,627130
DB293919,Durable Report Cvr A4 Folded Gls Opq P50,627173
DB811719,Durable Magnet Badge 54X90Mm P25 8117/19,627181
EP41175,Epson Cl Lsr Tran Epl-C8000 P100 S041175,627203
IC27004,Gbc Clickman Binding Machine Ca610000,627254
BX06624,Elba A4 Panorama 40Mm 2D Pres Binder Wht,627319
BC00875,Bicmatic Grip Mech Pencil 0.7Mm Ast Pk12,627777
ED751MW,Edding Paintmarker White 751,627823
ED780W,Edding Paintmarker Xfine White 780,627831
LX09320,Linex Scalerule Flat 1:20:500 30Cm 434,627939
PE05753,Pentel Hybrid Gelgrip Rbl Black K116E-A,628004
PE05755,Pentel Hybrid Gelgrip Rbl Blue K116E-C,628012
PI18245,Pilot Gel Ink Rball X-Fine Blk 050101201,628047
PI15891,Pilot Rball Grip Pen Gel Fine Black,628071
PI15893,Pilot Rball Grip Pen Gel Fine Blue,62808X
PI15562,Pilot Rollerball Gel Ink Metallic Gold,628098
PI15563,Pilot Rollerball Gel Ink Silver Blg107S,628101
SS7006,Stabilo Boss Tub 6 Assorted 7006,628233
TW13794,Crystal Flexi Tabs Clear Pk50 3000057,628241
TW13795,Crystal Flexi Tabs Inserts White Pk50,628268
PZ136,Panasonic Panafax Film Kxfa136X Pk2,628640
HPC4096A,Hp 96A Black Laserjet Toner Cartridge,628667
IB1361211,Lexmark Optra C Tnr Cart Cyan 1361211,628705
IB1361212,Lexmark Optra C Tnr Cart Mag 1361212,628713
SH03210,Sharp Developer Toner Fo4500W Fax Fo45Dc,628837
3M87719,3M PostIt SuperSticky 152x102 Rld Ylw,628969
EP48140,Epson Inkjet Cartridge Black R300 RX500,628985
EP48240,Epson Inkjet Cartridge Cyan R300 RX500,628993
EP48340,Epson Inkjet Cartridge Mag R300 RX500,629646
EP48440,Epson Inkjet Cartridge Yellow R300 RX500,629697
EP48540,Epson Inkjet Cart Light Cyan R300 RX500,629719
EP48640,Epson Inkjet Cart Light Mag R300 RX500,629743
ER32633,Energizer Hybrid Solar/Dynamo Light,630771
BY07255,FF Bisley Eurotambour 1980mm 4 Shlv Map,632612
BY07274,FF Bisley Eurotambour 1600mm 3 Shlv Map,632620
ER32629,Energizer Impact 2xAA Torch 632629,632629
ER32630,Energizer Impact 2xAAA Torch 632630,632630
BY07256,FF Bisley Eurotambour 1030mm 2 Shlv Map,632638
HM23410,Monolith Nyl 15.4in Compu Case Blk 2341,633701
HM23420,Monolith Nyl 17in Computer Case Blk 2342,633719
HM30030,Monolith Fwd Exec Laptop Case Blk 3003,633751
YC13702,Time Cards Gbl2010 For Olivetti Pk250,63436X
BA10359,Brother Mfc740 Ink Cart Blk Lc02Bk 10359,634483
BA10468,Brother Mp21C Cart Bk/Cy Lc03Bc 10468,634521
EP05011,Epson C900 Inkjet Cart Colour T005011,635152
EP03011,Epson C900 Inkjet Cart Black T003011,635160
HPC1823G,Hp No23 Inkjet Cart Colour 15Ml C1823G,635195
DU03848,Duracell Battery Ultra Pk2 D 75051964,636840
DU03801,Duracell Battery Ultra Pk2 C 7035031,636859
DU03807,Duracell Battery Ultra Pk1 9V 75051968,636867
DU02030,Duracell Batt Ultra Lithium Cr2 7032665,636875
HPC4182X,Hp 82X Black Laserjet Toner Cartridge,63720X
WX10100,Wb Leverarch File Fc 960130 26815East,638329
WX10102,Wb Leverarch File A4 960120 26845East,638337
WX20012,BoxFile Cloud Foolscap,638639
WX32001,Wb Memo Pad A4 Feint 80Lf 960040,638701
ES91200,Dymo Letratag Ppr Tape 12Mmx4M Pearl Wht,639111
ES91201,Dymo Letratag Plas Tape 12Mmx4M Prl Wht,63912X
ES91202,Dymo Letratag Plas Tape 12Mmx4M Hypr Ylw,639138
ES91203,Dymo Letratag Plas Tape 12Mmx4M Csmc Red,639146
ES91204,Dymo Letratag Plas Tape 12Mmx4Mm Dk Grn,639154
ES91205,Dymo Letratag Plas Tape 12Mmx4M Ultrablu,639162
ES91208,Dymo Letratag Met Tape 12Mmx4M Slvr,639200
PE13188,Pentel Refill Erasers Pk4 Z2-1N,639251
EP81595,Epson Colour Ink Cart Photo 1200 T001011,639421
HPC1823D,Hp No23 Inkjet Cart Colour 30Ml C1823De,639596
CO30537,Canon Toner Cartridge Magenta Clbp460,639650
CO1239,Canon Bjc600 Ink Cart Bk High Capacity,640151
DU03806,Duracell Battery Ultra Pk4 D 75051965,640909
DU03803,Duracell Battery Ultra Pk4 C 75051962,640917
DU03798,Duracell Battery Ultra P12 AA 75052877,640925
HPC4436A,Hp Colorado Mini Data Cart 14Gb C4436A,640933
OL82094,Flexicart Nylon Ribbon For Dm409 82094,64105X
SAM02144,Samsung Toner HY Black MLT-D205L,641305
OB00148,OB HP Toner Black C4096A,641806
HPC4911A,Hp No82 Inkjet Cart Cyan C4911A,642011
HPC4912A,Hp No82 Inkjet Cart Magenta C4912A,642038
BT30439,BT Converse 2300 Corded Phone Blk 040212,642136
GB22071,GBC Lam Pouch A3 250mic Clr Pk100,642306
BC13671,Bic Atlantis Retract Bpen Blk 1199013671,642357
BC13670,Bic Atlantis Retract Bpen Blu 1199013670,642365
HPC6029C,Hp Hwt Coated Paper 610X30.5M C6029C,642380
HPC6030C,Hp Hwt Coated Paper 914X30.5M C6030C,642399
MA14623,Kraft Paper Roll 500X25M Brn Ikr-070-050,642446
SB68010,Stanley Multibit Racheting Screwdriver,64273X
JT34506,Concord Full Wallet 14X10 Org 34506/345,642942
JT34507,Concord Full Wallet 14X10 Pink 34507/345,642950
JT34508,Concord Full Wallet 14X10 Red 34508/345,642969
JT27503,Concord Tfr Pkt File 450G Blu 27503/275,642977
BX03227,Elba Bright Document Wlt FCap Yellow,643107
BX03221,Elba Bright Document Wlt FCap Blue,643115
BX03223,Elba Bright Document Wlt FCap Green,643123
BX03225,Elba Bright Document Wlt FCap Orange,643131
AV03217,Elba Doc Wlt Fcap Astd P25 26610,64314X
AV02034,Idxmaker Div 5Pt Unpchd Wht L7416-5M Fpc,643158
AV02036,Idxmaker Div 10Pt Unpchd L741610M Fpc,643166
AV01863,Idxmaker Div 10Pt Pchd L7410-10Ew Fpc,643182
RH98221,Hp Printing Ppr A3 80Gm Pk500 Wh Hpt1017,643654
ST32280,Staedtler Perm Marker Chisel Black 350-9,646529
ST32288,Staedtler Perm Marker Bullet Black 352-9,646537
KF00705,Ff Jemini Folding Table 1500 Light Oak,649290
KF00707,Ff Jemini Folding Table 1800 Light Oak,649312
3M18645,Imation CD-R Slim Jewel Case Pk10 18645,649427
BT00701,Bt Paperjet 100/200 Ink Cart Blk 40Cc,650166
PQ301,Philips Ink Film Rbn Ppf241/271 Pfa301,650468
ML76042,Tally Fabric Rbn Black T2040 060426,650484
ML60425,Tally Fabric Rbn Black T2140 060425,650492
PZ181,Panasonic Kxp181 Blk Ribbon For Kxp3200,65151X
IB13L0034,Lexmark Fabric Rbn 4227/4227Plus,651528
PI27973,Pilot V5 Grip Liquid Ink Rollerball Blk,651927
PI27975,Pilot V5 Grip Liquid Ink Rollerball Blue,651935
PI27981,Pilot V7 Grip Liquid Ink Rollerball Blk,651943
PI27983,Pilot V7 Grip Liquid Ink Rollerball Blue,651951
HPC5718A,Hp Dds-4 150M 40Gb Tape C5718A,652140
HPC6614D,Hp Fax925Xi Inkjet Cart 28Ml Blk C6614De,652477
KC00676,Global Roll Control Dispenser Grey 7928,655481
CN06096,Bic Kids Colouring Pencils Wlt12 829029,655872
JDF27666,Newguard C4 Gusset Peel/Seal Env Pk25,657177
NB25023,Nobo P3 Page Point And Present Grey/Blue,657258
NB23619,Nobo Multi-Media Cabinet Grey/Silver,657290
NB25026,Nobo Wall Screen 2000x1513mm Grey/Blue,657355
NB25027,Nobo Wall Screen 2400x1813mm Grey/Blue,657371
NB25029,Nobo Tripod Screen 1750x1325mm 1902396,657460
NB25030,Nobo Tripod Screen 2000x1513mm 1902397,657478
NB25017,Nobo Barracuda Mobile Easel 1902386,657494
NB24689,Nobo Information Point 1902341,657517
CO81545,Canon Copier Toner Gp210/215/225/335,658186
TK14190,Xerox Phaser 550 Toner Cartridge Magenta,658410
XR87881,Xerox Inkjet Cartridge Blk Xj8C C20,658518
HPC6578E,Hp No78 Tricolour I/Jet Cart 19Ml C6578D,659211
IB12A1990,Lexmark Jetprnt P700 Hr Photo Ink Cart,659262
BA10546,Brother Toner Cart Black Tn6300 10546,659289
REG68769,Regent I Love Presents Med Bag Z317M,65929
BA10547,Brother Hl1030 Hy Toner Blk Tn6600 10547,659297
BA10548,Brother Hl1030 Drum Unit Dr6000 10548,659300
EP41256,Epson A4 Matte Paper Hwt Pk50 S041256,659580
EP41261,Epson A3 Matte Paper Hwt Pk50 S041261,659599
HPQ1991A,HP Prem Glsy Pht Ppr 10x15cm P20 Q1991A,659645
EP41264,Epson A3 Plus Matte Ppr Hwt Pk50 S041264,659653
HPC6578,Hp Tricolor Crt 78 38Ml Dj970Cxi C6578A,660065
GB23476,GBC W15 Compact Wire Binder Grey 4400402,660526
GB23474,GBC Surebind 500 Strip Binder 4400400,660534
AC93196,Masterlock Padlck Combi Brs 30Mm 630Eurd,66101X
GB23597,GBC Clickbind 15 Click Binder 4400416,661181
NU71560,Numatic Cleaner Bags Henry Basil Pk10,661478
RY61001,Scotchbrite WashUp Scouring Sponge Pk10,661532
SW03491,Seager Megaphone ALP 116B,661575
SB30486,Stanley Tape Measure 3M/10Ft Yellow,661672
SB30696,Stanley 5Mtr Bi-Material Tape 030696,661680
WAC10080,WAC Cameron 11-20 Person Refill,661745
NB33501,Noticebrd 1200X900Mm Visual Insert Grey,661885
DB81077,Durastar Table Presenter Land A4 8567/39,662082
DB81079,Durastar TblTop Presenter A3 LS 8569/39,662090
DB88930,Durable Textile Badge Necklace Grey Pk10,662104
GB22116,GBC 14mm 34R Wires Black Pk100,662260
GB22117,GBC 14mm 34R Wires White Pk100,662279
GL29711,Papermate Ballpen Eraser Max Black,662414
GL29731,Papermate Ballpen Eraser Max Blue,662422
LX00137,Suspension Tape A1 55X594 Pk100 Po4594,662481
LX00151,Suspension Tape A0 55X841 Pk100 Po4841,662503
PE71201,Pentel Superb Medium BallPen Black BK77M,662597
PE71202,Pentel Superb Medium BallPen Blue BK77M,662600
PI13619,Pilot Gtec Micro 0.4 Black Blgc4,662643
PI13621,Pilot Gtec Micro 0.4 Blue Blgc4,662651
PIG105BK,Pilot Gel Ink Rollerball 0.5Mm Blk G1050,662686
PIG105BU,Pilot Gel Ink Rollerball 0.5Mm Bl G10503,662694
GL81097,Sharpie Marker Fine Asstd Pk4 S0810970,662759
ST77950,Staedtler Mars Star L Pencil 0.5 77905,662872
IB125840,Lexmark Optra T610 Rp Cart 12A5840,663509
OK29303,Oki Ribbon 4410 40629303,663576
GB23481,GBC C210 Office Comb Binder 4400407,663589
GB23482,GBC T200 Thermal Binder Grey 4400408,663602
OL07897,Monoblock Artjet20 Prnthead Colour B0218,663630
OL07896,Monoblock Artjet20 Prnthead Black B0217,663649
OL20946,Olivetti XP03 High Cap Colour Phead,663657
PZ08759,Panasonic Kxp8410 Toner Cart Cyn Kxpdpc6,66369X
GB23640,GBC C340 Office Comb Binder Grey 4400420,663733
GB23641,GBC C450E Electric Comb Binder 4400421,663791
GB23646,Acco GBC W20 Office Wire Binder 4400426,664047
GB23647,Acco GBC W25E Elect Wire Binder 4400427,664055
GB24624,GBC Textured Comb 8mm Black Pk100,664089
GB24625,GBC Textured Comb 8mm Frost Clear Pk100,664102
GB24627,GBC Textured Comb 10mm Frost Clr Pk100,664128
SH03506,Sharp Developer Toner FO4700/5700 Fax,664148
XR965232,Xerox 7033 A4 Fax Imaging Cartridge 2Pk,664296
BA60541,Brother Plain Paper Fax MC FAX8360PU1,664350
BT30435,BT Converse 2100 Corded Phone Blk 040206,664431
BT30434,BT Converse 2100 Corded Phone Wht 040205,66444X
GB22466,Acco 10-Part Divider Astd 4400386,664607
CS19434,Casio Pocket Calc 8Digit Solar HS-85TE,664717
CS17840,Casio Desk Calc 12Digit JF-120TM,664725
GB09034,GBC Heatseal H425 A3 Laminator Silver,665343
GB09038,GBC Laminator Off Pro A3 H520 1702870,665369
GB05204,GBC Heatseal H65 Laminator 1701930,665377
GB05207,GBC H75 A3 Office Laminator Silver,665385
IB125740,Lexmark Optra T610 Print Cart 12A5740,66547X
IB125745,Lexmark Optra T610 Hy Cart 12A5745,665488
SH03514,Drum Unit For 2950 Multifunction Fax,665585
SH03507,Sharp Drum for FO4700/5700 Fax Machines,665593
XR13R553,Xerox Xe60 Drum Unit 3R95440 013R00553,665615
3M54163,Scotch Double Sided Tape 12Mmx33M,665660
3M54167,Scotch Double Sided Tape 25Mmx33M,665686
3M54169,Scotch Double Sided Tape 50Mmx33M,665694
CO83060,Canon Toner Cart LBP800 EP22CART,665704
SAM20215,Samsung TnrCart Fax SF-5100D3/ELS,665747
TK16780,Xerox Phaser 780 Toner Cartridge Clk,665828
LX00521,Cd Rom Pocket S/A P100 6832-100,665976
3M12115,Imation Data Cart Travan 20Gb Ns20 12115,666750
SGC11010,Sage Comp Wage Envelope Pk1000 Se45,666769
SZ55188,Sony AIT-2 DataCart 50/100Gb SDX2-50CN,666777
SZ54151,Sony AIT-1 DataCart 35/70Gb SDX1-35CN,666785
HG58203,Universal Stacking Cap Tray Blue 582003,667535
HG58303,Universal Storage Rack Blue 583003,66756X
BLO06914,Block Steelmaster Lge Delux Bookends Blk,667616
CPD00807,Maxima Insulated Cup Lid 7oz Pk100,667756
AU60723,Typhoo 1Cup TeaBag Pk440 A07006,667802
AU32080,Clingfilm 30Cmx300M Cutter Box Fp120,667845
AV11115,Avery Two Line Labeller Black HL0018,668107
AV11114,Avery Single Line Pricing Gun HL0008,668115
AVWR1626,Hand Labeller Label 2Line Wr1626,668123
AV11626,Avery 2Line Label Perm White WP1626,668131
AVYR1226,Hand Labeller Label 1Line Yellow Yr1226,66814X
AVWR1226,Hand Labeller Label 1Line White Wr1226,668158
AV11226,Avery 1Line Label Perm White WP1226,668166
AV10311,Tagging Gun Standard Markiii 01031,668174
AV05012,Avery Needles Standard (01002) 05012 Pk5,668204
BB52718,Fellowes Crystal Keyboard Wrist Rest Blk,668217
BB98731,Fellowes Crystal Gel Flex Rest Black,668225
BK00529,Bostik All Purpose Clear Glue 20ml Pk6,668239
AV11116,Avery Replacement Ink Roller Pk5 Black,668646
BB52717,Fellowes Crystal Mousepad/Wrist Rest Blk,669107
RY32064,RY SuperRigid Plate 9in 3864 Pk50,674381
RY32101,RY SuperRigid Bowl 12oz 3866 Pk50,674403
RY32088,RY SuperRigid Plate 7in 3685 Pk50,674411
JT50699,Concord Bright Divider A4 5Pt Asst 50699,675190
JT50899,Concord Bright Divider A4 10Pt Ass 50899,675204
JT04601,Concord Classic Index A3 1-10 Mylar Wht,675220
JT76101,Concord Index A4 Unpunched Myl 1-15 Wht,675239
JT27502,Concord Tfr Pkt File 450G Buff 27502/275,67531X
JT27504,Concord Tfr Pkt File 450G Grn 27504/275,675328
JT27507,Concord Tfr Pkt File 450G Pink 27507/275,675336
GH04542,Guildhall GLX Ergogrip Frost RBndr Cob,675441
GH04544,Guildhall GLX Ergogrip Frost RBndr Lilac,675468
RT04104,Rotadex Corner Unit 3Tier Ltoak Cu18 Fms,675565
RY92810,RY Nupik Water Cup 20cl Blue Pk1000,675840
PHT00600,Secure It Aluminium Frame A4 Silver,675913
PHT00602,Secure It Aluminium Frame A3 Silver,675921
OK12306,Okipage 8C Laser Toner Yellow 41012306,676854
EP41569,Epson Double Sided Matte Paper A4 Pk50,676927
WX01087,Wb Copier Paper A4 White,67696X
BY57825,FF Bisley A4 Homefiler 2Drw Goose Grey,677876
BY59269,FF Bisley A4 Homefiler 3Drw Goose Grey,677884
BY60318,FF Bisley A4 Homefiler 3Drw Black,67809X
BY59449,FF Bisley A4 Homefiler 2Drw Grey/Red,678103
BY61415,FF Bisley A4 Homefiler 3Drw Grey/Red,678111
BY58252,FF Bisley A4 Homefiler 2Drw Grey/Blue,67812X
BY59072,FF Bisley A4 Homefiler 3Drw Grey/Blue,678138
SS17658,Stabilo Luminator Hltr Pk4 Astd,678561
GH13010,Europa Pocket Spiral File Ast Pk25 3010Z,678596
GH14060,Guildhall Merstham Legal Wlt Buff 225Z,678685
JT22214,Concord Med Weight Trans File Fcp Mauve,678774
JT27214,Concord Transfer Pocketfile Fcp Mauve,678782
JT27514,Concord Trans Pckt Ex/Hweight Fcp Mauve,678804
JT43214,Concord Med Weight Square Cut Fcp Mauve,678812
KC01095,Kleenex UltraSoft HandTowel 2Ply Wht P15,678871
HPC6615D,Hp No15 Inkjet Cart Black C6615D,67891X
HPC6625AE,Hp No17 Inkjet Cart 15Ml Tri-Col C6625A,678928
EP07401,Epson Intellidge Ink Cart Black T007401,678944
EP60235,Epson 790 Inkjet Cart Black Pk2 T007402,678952
EP08401,Epson 790 Inkjet Cart 5 Colour T008401,678960
EP60224,Epson Intellidge Inkjet Colour T009401,678979
EP41287,Epson Prem Glsy Phto Ppr A4 Pk20 S041287,679001
EP41315,Epson Premium Glsy Pht Ppr A3 Pk20,67901X
EP41316,Epson Premium Glsy Pht Ppr A3Plus Pk20,679028
EP41303,Epson Prem Glssy Phto Ppr 100Mmx8M Roll,679036
3M87126,3M PostIt Dreamy Rbow Pk6 76x127mm,679788
3M87124,3M PostIt Dreamy Rbow Pk6 76x76mm,679796
3M87122,3M PostIt Cool Neon Rbow Pk12 38x51mm,67980X
3M87281,3M PostIt Neon Cube 76x76mm Blue 2028NB,679834
JT34514,Concord Doc Wallet 14X10 Mauve 34514,679842
JT37214,Concord Double Pocket Wallet Fcp Mauve,679850
HPC6035A,Hp Bright White Inkjet Ppr 610Mm 45Mtr,681985
HPC6628A,Hp 350C/Cbi Inkjet Cart Black C6628Ae,68601X
PZ16834,Panasonic Ink Film Black KXFP181-185 Pk2,686028
AU93310,Nescafe Gold Blend Coffee 500G Cc330,68629X
AU99486,Millac Maid Half Fat Milk Pots Pk120,68632X
NL85680,Nescafe Coffee Granules 500gm 12081372,68663X
UP20219,Stewart Slide Sign Vacant/Meet Progress,688029
NB33944,Nobo Easy Peel Eraser 33944,688061
BB91712,Fellowes Standard Monitor Riser 91712,688126
IB125845,Lexmark Optra T610 Hy Rprog Cart,688185
3M79024,3M 9312 FFP1 Valved Fold Respirator Pk10,688196
BI00111,BI Gift Bag Holo Large 265x330mm Astd P6,688525
BI00112,BI Gift Bag Holo Medium 180x230 Astd P6,688533
BI00113,BI Gift Bag Holo 1 Bottle 100x330 Ast P6,688541
3M79020,3M 9332 FFP3 Valved Fold Respirator Pk10,688633
IB26554,Lexmark Non RP Tnr Black 17G0154,688835
IB16396,Lexmark Z12/32 Hi Res Cart Blk 17G0050,688843
IB16397,Lexmark Z12/32 Hi Res Cart Col 17G0060,688851
3M30434,3M Scrn Fltr Privacy-Plus 13-15In Pf400L,689709
PLR00223,Duoset Headset Voice Tube 34623-21,689822
MF13019,Fast Paper Curved Lit Disp Blk 285.01,689848
3M91797,3M 8833 FFP3 Unvalved Cup Disp Resp Pk10,690011
3M06833,3M Coverall 5/6 Size Large 4540L,690249
3M06832,3M Basic Protective Coverall 4540M,690532
IB15MX120E,Lexmark No20 Ink Cart Colour 015MX120E,69079X
EP60244,Epson Ink Cart Black Stylus 480 T013401,690803
EP60245,Epson 3 Colour I/Cart Stylus 480 T014401,690811
EP60252,Epson Stylus Photo 2000P Ijet Cart Blk,69082X
EP60253,Epson Stylus Photo 2000P Ijet Cart 5Col,690838
EP82993,Epson Premium S/Gls Photo Ppr A3Plus P20,690846
EP83005,Epson A3Plus Archival Matte Paper Pk50,690862
DB10210,Durable Security Pass Holder Transp Pk25,69096X
BB53457,Fellowes Binding Comb 8Mm Blk Pk100,691183
BB53455,Fellowes Binding Comb 8Mm Blu Pk100,691191
BB53454,Fellowes Binding Comb 8Mm Wht Pk100,691205
BB53461,Fellowes Binding Comb 10Mm Blk Pk100,691213
BB53459,Fellowes Binding Comb 10Mm Blu Pk100,691221
BB53458,Fellowes Binding Comb 10Mm Wht Pk100,69123X
BB53465,Fellowes Binding Comb 12.5Mm Blk Pk100,691248
BB53463,Fellowes Binding Comb 12.5Mm Blu Pk100,691256
BB53462,Fellowes Binding Comb 12.5Mm Wht Pk100,691264
BB53469,Fellowes Binding Comb 14Mm Blk Pk100,691272
BB53466,Fellowes Binding Comb 14Mm Wht Pk100,691299
BB53473,Fellowes Binding Comb 16Mm Blk Pk100,691302
BB53470,Fellowes Binding Comb 16Mm Wht Pk100,691310
BB53481,Fellowes Binding Comb 22Mm Blk Pk50,691329
BB53478,Fellowes Binding Comb 22Mm Wht Pk50,691337
BB53218,Fellowes W/Bind Element 6Mm Blk Pk100,69140X
BB53215,Fellowes W/Bind Element 6Mm Wht Pk100,691418
BB53261,Fellowes W/Bind Element 8Mm Blk Pk100,691426
BB53258,Fellowes W/Bind Element 8Mm Wht Pk100,691434
BB53265,Fellowes W/Bind Element 9Mm Blk Pk100,691442
BB53262,Fellowes W/Bind Element 9Mm Wht Pk100,691450
BB53713,Fellowes Delta Leather Crdbrd Pk100 Rbl,691574
BB53701,Fellowes Delta Leather Crdbrd Pk100 Wht,691582
BB53703,Fellowes Leather Brd Cvrs Rd Pk100 53703,691604
BB53704,Fellowes Delta Leather Brd Cvs Blk Pk100,691612
BB53760,Fellowes Trany Plastic Cvr 150Mic Pk100,691671
BB53762,Fellowes Trany Plastic Cvr 240Mic Pk100,69168X
BB53022,Fellowes A4 Adhesive Lam Pouch 80Mic,691752
BB53060,Fellowes Lam Pouch A5 160Mic Pk100,691760
BB53061,Fellowes Lam Pouch A4 160Mic Pk100,691779
BB53062,Fellowes Lam Pouch A3 160Mic Pk100,691787
BB53063,Fellowes Lam Pouch 54x86mm 250mic P100,691809
BB53073,Fellowes Lam Pouch A5 250Mic Pk100,691833
BB53074,Fellowes Lam Pouch A4 250Mic Pk100,691841
BB53075,Fellowes Lam Pouch A3 250Mic Pk100,69185X
BB53093,Fellowes Laminating Pouch A2 250Mic Pk50,691868
BX06312,Elba A4 Panorama 50Mm 2D Pres Binder Wht,69199X
BX06401,Elba A4 Panorama 65Mm 2D Pres Binder Wht,692006
AG30594,Addis Soft Broom Head Metallic 9220MET,692308
AG05955,Addis Broom Handle Metallic 9599MET,692332
AG05741,Addis Ultra Grip Dishbrush Metallic,692367
CNT14234,Golden Magnet V Sweeper 160Vs,69260X
MA14572,Corrugated Ppr Roll 900X75 Brn Sfcp-0900,692952
MA99131,Bubble Film 600Mmx25M Jb-S20L-60025,693338
MA99267,Safety Tape Disp Wth Retr Blade 74Pd1083,693370
MA99713,Flexocare 2In Comfort Grip Tape Disp,693389
MA14624,Kraft Paper Roll 750X25M Brn Ikr-070-075,693486
WAC10400,WAC Latex Gloves Disposable Med P100,69404X
CPD17700,Dove Cream Soap 250ml KMSDOVE1,694058
CT34069,Connect Hand Towel Dispenser Ds923E,694090
3M50876,3M Postit Index Refill 4Colours,694287
3M50879,3M Postit Index Refill 4 Bright Arrows,694295
3M87129,3M PostIt Balanced Rbow Pk6 76x127mm,694309
3M87128,3M PostIt Balanced Rbow Pk6 76x76mm,694317
3M83813,3M PostIt ZNote Refill 76x76 Neon Pk6,694325
AV98781,Avery Inkjet Full Fce CD/DVD Lbl 25Shts,694376
AV98873,Avery Full Face CD/DVD Lbl IJet Wht P100,694384
AV98782,Photo Glsy Ijet Cd/Dvd Lbl 2Tv Pk25 Wht,694422
AV98785,Avery Cd Dvd Lbl Face Pk25 L7676,694430
AV98872,Avery Full Face CD/DVD Lsr Lbl Pk100,694449
AV98787,Avery Glossy Col Lsr F/Face CD/DVD 25Sht,694465
AV98894,Avery Ijet Addr Lbl 24Tv Pk100 Wht J8159,694481
AV98895,Avery Ijet Addr Lbl 10Tv Pk100 Wht J8173,69449X
AV98881,Avery Lsr Lbl 24Tv Pk250 Wht L7159 Fpc,694503
AV98882,Avery Lsr Lbl 4Tv Pk250 Wht L7169 Fpc,694511
AV98883,Avery Lsr Lbl 10Tv Pk250 Wht L7173 Fpc,69452X
AV98884,Avery Lsr Lbl 18Tv Pk500 Wht L7161 Fpc,694538
AV98885,Avery Lsr Lbl 1Tv Pk500 Wht L7167 Fpc,694546
TX10068,Tippex Shake And Squeeze Correction Pen,694554
ES53710,Dymo 24Mm D1 Tape Black/Clear 53710,694570
ES53713,Dymo 24Mm D1 Tape Black/White 53713,694589
PE05955,Pentel Energel X Blue 2 FOC BL107/14-C,694783
PE05953,Pentel Energel X Black 2 FOC BL107/14-A,694791
PE05954,Pentel Energel X Red 2 FOC BL107/14-B,694805
LX02212,3L Self Adh CD Pockets Protect Inlay P10,695932
ES23461,Xyron A4 Cart Adhesive Permanent 23461,695967
EA30445,Colorado Boxfile Lockspring A4 Bk 30445,696075
EA28146,El Colorado 80 L/Arch A4 Orange 28146,696105
EA28116,El Colorado 80 L/Arch Fc Orange 28116,696113
EA43244,Eastlight Jiffex File A4 Green 43244,696148
EA43247,Eastlight Jiffex File A4 Pink 43247,696156
EA43246,Eastlight Jiffex File A4 Orange 43246,696164
EA43216,Eastlight Jiffex File Fcp Orange 43216,696180
ES23462,Xyron A4 Cart Adh Repositionable 23462,696202
EA12706,El Lateral T Susp File 11In Org Pk50,696296
RX12131A,Nyrex Folder A4 Pvc Asst P25 Pfa4C,696512
RX12161A,Nyrex Folder A4 Pvc Asst Pk25 Pfca4C,696520
RX12223A,Nyrex Cut Back Fldr Poly Ass Pk100 12223,696547
RX12602A,Report File A4 Assorted Pk25 12602,696571
ES18644,Xyron A4 Cartridge Laminate 18644,696679
NB11812,Nobo Magnetic Round Marker 20mm Pk10 Ast,696741
NB18058,Nobo Glide Flipchart Marker Ass Pk12,696768
NB38861,Nobo Whiteboard Starter Kit 344 38861,696776
PHT00400,Wooden Frame A4 Black,69689X
PHT00402,Wooden Frame A3 Black,696903
NB14600,Nobo Elipse NBrd Felt 1800x1200 Grey,696938
ES23465,Esselte A4 CS Cart Lam/Magnet 23465,697070
AK11501,Arianex Fixed LA File Blue DA4BL,697259
AK11504,Arianex Fixed LA File Red DA4R,697267
LX15000,Decadry Paper 95g Pk100 Marble Grey,697282
AK11503,Arianex Fixed LA File Black DA4BK,697291
JFM00,Jiffy Mailmiser 115X195 Pk100 Wht 00,697348
JFM0,Jiffy Mailmiser 140X195 Pk100 Wht Size 0,697356
JFM1,Jiffy Mailmiser 170X245 Pk100 Wht Size 1,697364
JFM2,Jiffy Mailmiser 205X245 Pk100 Mm2 Wht,697372
JFM3,Jiffy Mailmiser 220X320Mm Pk50 White Mm3,697380
JFM4,Jiffy Mailmiser 240X320Mm Pk50 White Mm4,697399
JFM5,Jiffy Mailmiser 260X345 Pk50 Wht Mm5,697402
JFM6,Jiffy Mailmiser 290X445 Pk50 Wht Mm6,697410
JFM7,Jiffy Mailmiser 340X445 Pk50 Wht Mm7,697429
JF15030,Jiffy Airkraft Gold 90X145Mm P150 Go-000,697542
JF15020,Jiffy Airkraft Gold 115X195Mm P100 Go-00,697550
CO17483,Canon Matt Photo Paper A4 Pk50 MP101,697568
JF15010,Jiffy Airkraft Gold 140X195Mm Pk100 Go-0,697569
JF15100,Jiffy Airkraft Gold 170X245Mm Pk100 Go-1,697577
JF15200,Jiffy Airkraft Gold 205X245Mm Pk100 Go-2,697585
JF15300,Jiffy Airkraft Gold 220X320Mm Pk50 Go-3,697593
JF15400,Jiffy Airkraft Gold 240X320Mm Pk50 Go-4,697607
JF15500,Jiffy Airkraft Gold 260X345Mm Pk50 Go-5,697615
JF15600,Jiffy Airkraft Gold 290X445Mm Pk50 Go-6,697623
JF15700,Jiffy Airkraft Gold 340X445Mm Pk50 Go-7,697631
AFI50104,AF Phoneclene 100 Wipes Tub APHC100T,697666
AFI50022,AF Screenclene 100 Wet/Wet Sachets,697674
AR80450,Artline Laundry Marker Black 750,697852
AR11702,Xstamper Xclamations Very Good 11702,697879
AR11759,Xstamper Xclamations Star Blue 1175,697895
AR11736,Xstamper Xclamations Smiling Face 11736,697909
AR11757,Xstamper Xclamations Gold Star X11757,697933
HS09133,Door Wedge Heavy Duty Brown 9133,698106
HS09132,Door Wedge Brown 9132 Pk2,698114
DB293119,Durable Spinebar 6Mm A4 Trans Pk50 2931,698513
DB294519,Durable Report Cvr A4 Glass Clear P100,698521
DB710201,Durable Desk Mat 40X60 Black 7102/01,698602
DB710301,Durable Desk Mat 500X700 Black 7103/01,698629
DB7112,Durable Desk Mat Duraglas 40X53Cm 7112,698645
